rpid,oid,type,mid,root,parent,dialog,count,rcount,ctime,like,plat,device,content,emote,at_uname,at_mid,invisible,level,sex,sign,uname,avatar
210614099488,1351109300,1,36868098,0,0,0,0,0,1709351856,9,,,"C罗这场表现确实力压梅西

梅西的无球跑动不好，并不是不会跑，真跑的那一下因为爆发力强杀伤力还是很有的。
最大的弊端在于他体力不行很多时候根本没力气前插,跑空位。再加上本身盘带要花费体力，就更是一点都不想跑了。

前插这一点算是C罗看家本领。虽然是巴萨球迷但是皇马三连时期淘汰赛基本都看了，C罗场上踢法可以说就一点——有球必插，转型之后尤甚。（之前可能还喜欢摸球，转型后摸球大量减少）
战术上确实是很简单，但是他确实有大量的体力完成战术任务。这样即使自己不摸球，也有资格跟队友说一声“打开球路的任务就交给你们了”，因为他在前面消耗后卫的任务的的确确完成了。再加上门前一下能力强，进球就水到渠成。

在不同路径上，梅西却直到非常后期才练出背身，包括世界杯很多比赛大量背身接球洗球，走出他早年在巴萨的舒适区（一度认为瓜让他踢伪九限制了他的发展，瓜有的时候喜欢打压球员“前锋”的一面，还搞什么无锋，却没有意识到前锋能力大于中场能力[捂脸]）

有的时候让球员走上自身巅峰的并不是自己最光鲜的一面。什么C罗半场开炮，梅西连过五人。也许在关键比赛确实有过这样的表演，但最后支撑他们赢比赛的还得是基本盘。一次次前插，一次次接球",[捂脸],,,False,6,保密,Vamosヽ(•̀㉨•́ )ゝ,卡布-达,https://i0.hdslb.com/bfs/face/870d6406f8236203f375fce03f26c7fc98df302a.jpg
210895333376,1351109300,1,1468372376,0,0,0,3,3,1709516071,6,,,你喜欢C罗，这没错，谁都有情节。可是球王之争已经结束了,,,,False,3,保密,,金小石头123,https://i0.hdslb.com/bfs/face/member/noface.jpg
211277460752,1351109300,1,3494358020000212,210895333376,210895333376,211277460752,0,0,1709749243,0,,,怎么好意思吹球王的，我是没看见那个球王被人按着地上打的，如果呦西是球王，那穆勒就是上帝了，世界杯冠军穆勒也有，各种比赛呦西对上穆勒基本都是输，甚至被人8比2屠杀，一边被人按在地上摩擦一边称王吗？,,,,False,3,保密,,大象88886,https://i0.hdslb.com/bfs/face/member/noface.jpg
211001973520,1351109300,1,2070936505,210895333376,210895333376,211001973520,0,0,1709569230,0,,,视频都不看就开始叫是吧,,,,False,3,保密,,sjdjxxbbx,https://i1.hdslb.com/bfs/face/17b94b2abae49f4e457bec0dd675e4d5bb5b4ca1.jpg
210998998976,1351109300,1,625319593,210895333376,210895333376,210998998976,0,0,1709567794,1,,,结束又怎样啊，哟西会多看你一眼吗,,,,False,5,保密,,最Q的那个,https://i0.hdslb.com/bfs/face/member/noface.jpg
211256456784,1351109300,1,3546588739799104,0,0,0,0,0,1709736934,5,,,小学足球队教练需要你[偷笑],[偷笑],,,False,2,保密,呼呼,Thxxx10,https://i1.hdslb.com/bfs/face/1f59a9e10f59e82c315d9cbf7c6adc0948296fc4.jpg
210651439280,1351109300,1,105423950,0,0,0,46,40,1709369142,68,,,太片面了，梅西经常能在防守最密集的两线间拿到球，然后通过连续传切瓦解对方防线，踢过球的都知道在对方两线防区接住球是多么困难的能力，就凭这一点也不能说他无球能力差吧。。。梅罗俩人一个历史最强10号，强调后插上，一个最强7号，强调直插禁区，完全不需要踩一捧一，你让这俩人互换踢法谁也达不到后来的高度。。,,,,False,5,保密,,想娶名字的人好多,http://i0.hdslb.com/bfs/face/member/noface.jpg
210711569584,1351109300,1,259917743,210651439280,210691135712,210677682208,0,0,1709393090,7,,,回复 @澪乂 : 前插都是为了过顶球？野球踢多了？,,澪乂,37310155,False,5,男,胖胖胖胖胖胖胖,在太湖划船的黑皮人,http://i2.hdslb.com/bfs/face/6d96e91f5e8accd18fe07da57d10817fc0488a5a.jpg
210709295632,1351109300,1,670540119,210651439280,210691135712,210677682208,0,0,1709392183,7,,,回复 @澪乂 :前插是顶球？沙比,,澪乂,37310155,False,4,男,,黝黝__,https://i0.hdslb.com/bfs/face/37660dc902170a7be251242a16577d4fdec761c3.jpg
210677682208,1351109300,1,670540119,210651439280,210651439280,210677682208,0,0,1709379939,7,,,有空挡不前插啊，服了,,,,False,4,男,,黝黝__,https://i0.hdslb.com/bfs/face/37660dc902170a7be251242a16577d4fdec761c3.jpg
211304224240,1351109300,1,4080871,0,0,0,0,0,1709781774,4,,,海洋哥，我觉得你比瓜地奥拉懂球，你是我的偶像，如果我们可以投票选国足主帅，我一定偷海洋哥一票,,,,False,5,男,"of the people, for the people, by the people",bili_4080871,https://i1.hdslb.com/bfs/face/4d9da508c2d5063694fdf3e0443a55f1724094fa.png
210947572864,1351109300,1,385167977,0,0,0,0,0,1709545698,7,,,说得好，梅西守门能力也不行[滑稽],[滑稽],,,False,4,男,恃才嗷呜,WANDERWOOLorz,http://i2.hdslb.com/bfs/face/53435cffb367364f5bcbc4f60a964863dbf7cdc0.jpg
210658902720,1351109300,1,482035957,0,0,0,10,9,1709372440,11,,,不是 真就现在名声不好啥妖魔鬼怪都出来了 边锋传带停射 射门这俩人平分秋色 传球停球球感方面就不要比了 这不是罗哥的什么强处 传球梅西的视野那也是一般要跟顶级中场比的 你说要围绕着他来 那都tm是19年了 他不来那让登贝莱来还是给慢慢下滑的苏亚雷斯来？年轻时边路一条龙过人的时候需要队友按住对面防守的手？你说梅西依靠队友的球王踢法 那梅西走了巴萨为啥还是这鸟样 什么朗格莱不都走了 不是更高更快更强？,,,,False,5,保密,,伽马未来7777,https://i1.hdslb.com/bfs/face/4219f088c0494780782e974c07c6f35ce539457e.jpg
210660316800,1351109300,1,526232299,210658902720,210658902720,210660316800,0,0,1709373061,4,,,你看视频了吗，你在说啥？UP也没否认梅西人球合一能力和传球能力啊，说的是梅西的无球能力差了。你知道啥是无球能力不？😅,,,,False,6,男,,与心yuxin,https://i1.hdslb.com/bfs/face/3712b0f599ae5e9c4634c493dbd5e9291b2b55bb.jpg
210659743072,1351109300,1,520450148,210658902720,210658902720,210659743072,0,0,1709372836,3,,,射门c罗更强，看看c罗射程，就是在曼联时期都能中圈射进世界波。梅西射门力量没那么足。另外，头球射门c罗是神级，梅西入门级。任意球梅西更强，但定位球技术不算在射门能力里面呀,,,,False,3,保密,,Tony1oo1,http://i0.hdslb.com/bfs/face/member/noface.jpg
210661597328,1351109300,1,482035957,210658902720,210660587232,210660587232,0,0,1709373578,2,,,回复 @与心yuxin :来来来 说碰瓷我好奇了 罗哥的水平我倒是人 但他的粉丝好像没学他好的一点 既然说他年度91球是队友硬喂的 那是怎么做到一方面无球吃饼 一方面大量占用球权伤害球队,,与心yuxin,526232299,False,5,保密,,伽马未来7777,https://i1.hdslb.com/bfs/face/4219f088c0494780782e974c07c6f35ce539457e.jpg
210620881728,1351109300,1,327394053,0,0,0,66,50,1709354625,82,,,不是洗梅西，单纯提供一个解释角度。按梅西那时的踢法，每场比赛只要拿球就是高强度盘带，踢过球的都知道那种接近无氧的高频率带球，对体能损耗有多大，再加上一年这么多场比赛要踢，放弃无球跑动有可能是教练组和梅西达成的保护性共识（但桑切斯抢断那球他不前插真的…有点过分）,,,,False,5,男,,如旋,https://i0.hdslb.com/bfs/face/258d04d4ce92bd2a5fb0deaaeb33875690620762.jpg
210622432528,1351109300,1,170291208,210620881728,210620881728,210622432528,0,0,1709355270,21,,,那这么看马拉多纳更全能,,,,False,6,男,,yxfighting-,https://i0.hdslb.com/bfs/face/1e5c34dc5421e39696bbd552560af9d7cddb9c26.jpg
210621003680,1351109300,1,279173565,210620881728,210620881728,210621003680,0,0,1709354680,19,,,"“不是我说哈”
“我来说句公道话”",,,,False,6,保密,,崇洋犬缉拿科主任,https://i0.hdslb.com/bfs/face/b1f2040891dfd65f98f2c5b8a18f78a53e21001a.jpg
210633037792,1351109300,1,327394053,210620881728,210621003680,210621003680,0,0,1709360035,15,,,回复 @崇洋犬缉拿科主任 :这有啥不公道的，最近足坛里无球有球两手硬的人叫-莫德里奇，你们怎么称呼他的，“铁人”“跑不死”[脱单doge]再比比梅西和魔笛谁的盘带更耗体力，还要求梅西无球积极跑动，那梅西成啥了，机器吗？去年c罗风评不好的时候跟着阴阳怪气的也是你们这帮人吧哈哈哈,[脱单doge],崇洋犬缉拿科主任,279173565,False,5,男,,如旋,https://i0.hdslb.com/bfs/face/258d04d4ce92bd2a5fb0deaaeb33875690620762.jpg
210566715984,1351109300,1,11583880,0,0,0,21,18,1709309531,40,,,作为一个前锋，需要的素质有哪些？除了踢球最基本的传停带射之外，高空球，背身，无球跑动，前场压迫也是衡量一个前锋是否优秀的能力标准。梅西作为一个前锋，高空球天生个子矮就不用考虑了，背身也同理，但梅西最为诟病的是他的跑动能力，他总是惦记着把球运转到自己脚下，梅西会开始做无球跑动的时候大概率是由自己发起或者和队友做小范围配合。所以梅西在我看来是一个及其偏科的前锋，在他的有球领域内他确实称得上是第一人，但是他的身体缺陷和跑动不积极给球队带来的负面影响是实打实的，更别说他的逆足能力也不算优秀。自始至终在足球整体的理解上我都认为梅西是不如C罗的，这样极端偏科的球员使用起来对于球队的建立和打造是极为苛刻的，所以显而易见的就是离开了哈白为核心的舒适圈之后，梅西的各项赛事总是会有各种各样的滑铁卢。,,,,False,6,男,蚌埠住了家人们,YYL♂龙,https://i1.hdslb.com/bfs/face/82749ad9688332de113a0b8686c567525ab0b95a.jpg
210574805440,1351109300,1,359173551,210566715984,210566715984,210574805440,0,0,1709313945,8,,,儒迷们只看带，谁带的牛逼谁球技好，逆足头球跑位他们都不看的[吃瓜],[吃瓜],,,False,5,男, 高质量的单身,B站管理不给我改名,https://i0.hdslb.com/bfs/face/3ded4969dee694dc2ddb41eb47ab79ff69ac5c90.jpg
210578526080,1351109300,1,1320028155,210566715984,210566715984,210578526080,0,0,1709317226,5,,,我看球晚基本就看C罗的，20年打巴萨的时候，看的梅西踢的也懵逼，其他人踢的也懵逼。梅西每次突破分球给队友，队友倒着倒着又回到梅西脚下了，再突过分，看着啥活都干了，但没人能从他脚下承担分走一些活，像内马尔那样。就他最熟悉突破分球给前插队友倒三角给他会往禁区提速能形成打门威胁。,,,,False,3,保密,,不淆俗潮,https://i0.hdslb.com/bfs/face/298a09841a5e76a8a77cc4a7947e9c0de2cec8aa.jpg
210599350816,1351109300,1,21665586,210566715984,210596738160,210574805440,0,0,1709344811,3,,,回复 @天空与我相依_ :唉，兄弟能过人不就行了吗，还谈什么技术动作，踩单车和马赛回旋有啥难度啊？我的天啊,,天空与我相依_,407777353,False,6,男,,薛定谔的番茄,http://i0.hdslb.com/bfs/face/cc487e0fd03ca1e4b74f78727312af3b338f505b.jpg
210697596144,1351109300,1,39664448,0,0,0,39,22,1709387875,40,,,正如梅西粉丝说的，这确实是球王踢法，也是巨婴踢法，这是梅西身体所带来弊端，确实也没什么办法，但是一个球员能力的评定不会因为你身体不好就对你放低标准，这方面梅西做的不好就是不好，不会因为你的身体不行就觉得说好,,,,False,6,男,伤春悲秋,落落落落Luol,https://i2.hdslb.com/bfs/face/527975a6b8e1cdc4e86638208e6f69960f9fbd17.jpg
210746852176,1351109300,1,436911585,210697596144,210697596144,210746852176,0,0,1709428047,3,,,这也就是为什么梅西的所谓吃饼进球数少的原因,,,,False,5,保密,,柚子味的皮卡,http://i0.hdslb.com/bfs/face/0ba09ca595ba6385d52f3d7b7354796fd7f2f8de.jpg
210802913504,1351109300,1,287038508,210697596144,210800578480,210746852176,0,0,1709454111,1,,,回复 @土豆兄弟职业选手 : 问题是比助攻也薄纱你罗哥呀[喜极而泣],[喜极而泣],土豆兄弟职业选手,100670989,False,5,男,,快乐のYUAN,http://i2.hdslb.com/bfs/face/cb41ae52fb45a298d71b81b636938a503f548b25.jpg
211338615808,1351109300,1,285272215,210697596144,210697596144,211338615808,0,0,1709800355,0,,,没问题   马拉多纳真球王就是那个身材也能干那么多事,,,,False,5,保密,,Uh-yep,https://i1.hdslb.com/bfs/face/1ad42cb1afbd930e4aa84966bef213d32270883f.jpg
210634915504,1351109300,1,252881678,0,0,0,2,2,1709360911,39,,,魔笛自传里对梅西的评价很中肯:必须带球跑起来才有威胁。如果跑不起来，顶尖球队有太多方法限制他了。,,,,False,5,保密,别是一般滋味在心头。,南河一猪,https://i2.hdslb.com/bfs/face/15e728afe90bf23c4e07114f75a62c5fb61f0348.jpg
211181406688,1351109300,1,27940685,210634915504,210755939312,210755939312,0,0,1709700380,0,,,回复 @潜水摸虾 : 所以能吸引对面两到4个人的注意力 这作用还不够？,,潜水摸虾,178105979,False,5,男,,夏夏夏夏啊x,https://i2.hdslb.com/bfs/face/91b3b1051e8a7f411b145c7d2cc615a3b3704395.jpg
210755939312,1351109300,1,178105979,210634915504,210634915504,210755939312,0,0,1709433117,0,,,两个大高个夹着他就行了，很多球队的针对方式,,,,False,6,保密,,潜水摸虾,http://i2.hdslb.com/bfs/face/e0bcf0b9deacd295f285807c46aa69556c67da6c.jpg
210749956912,1351109300,1,454547918,0,0,0,0,0,1709429992,4,,,感觉不如,,,,False,5,男,到底什么我想要,跨时代TheEra,https://i2.hdslb.com/bfs/face/9321f67650d1824193992561b02b28b57f01d81f.jpg
210566443936,1351109300,1,1401125353,0,0,0,7,7,1709309384,150,,,这个时期的C罗用增肌补充了骨架上的先天不足拥有了一定的背身能力。并且拥有边锋的一切素质,,,,False,5,男,人生中最重要的不是终点是旅途中的风景,可是我真的不想摆烂,https://i1.hdslb.com/bfs/face/f8c818b382e2f14a390e19394705a1984dad3d55.jpg
210574678912,1351109300,1,2349360,210566443936,210566443936,210574678912,0,0,1709313921,29,,,其实曼联时期就有挺多回撤背身接球转身推进的，不过背身这事情太看身体了，无论c罗，梅西还是都说背身好的萨拉赫，对着一些体型没那么大的边后卫，后腰，后卫可以背身下，背身大体型的后卫真只有力量强的中锋才行,,,,False,6,保密,,武当大马猴,https://i0.hdslb.com/bfs/face/b3ab4cfee245a40cf302812e228ae24a35963452.jpg
210597398512,1351109300,1,49139193,210566443936,210574678912,210574678912,0,0,1709343679,16,,,回复 @武当大马猴 :其实就是田忌赛马，那会儿一个185的大边锋对于绝大多数的边后卫身体都是碾压的趋势。那会儿强队的边后卫大多都是偏灵活，偏进攻的。,,武当大马猴,2349360,False,5,男,梅西球迷等于智商筛选器,alan_atzec,https://i0.hdslb.com/bfs/face/12bc481bf189c1c7fef76652ccfb75316f2c82c3.jpg
210601374832,1351109300,1,2349360,210566443936,210597398512,210574678912,0,0,1709345854,12,,,回复 @alan_atzec :是这个理，齐达内控球那么厉害很大程度也是他那个超出一般中场的大骨架大力量，所以对c罗限制最厉害的后卫就是阿什利科尔，速度身材力量都不吃亏。其实真要说他现在这个身材对大部分边后卫也是碾压的，但后期不这么踢，一是不需要，球队其他人能更好完成，保持体力输出，第二是年龄大了就不停减肌，维持灵活去了，所以在尤文最后一年还能是队内过人王，但是回英超再去和高大后卫对抗就很吃亏了,,alan_atzec,49139193,False,6,保密,,武当大马猴,https://i0.hdslb.com/bfs/face/b3ab4cfee245a40cf302812e228ae24a35963452.jpg
210614961024,1351109300,1,12438767,0,0,0,16,11,1709352227,21,,,梅西确实是自带体系，但是你围绕他建队想要出成绩的话整个体系的阵容身价估计得去到全欧全五。c罗作为全能武器库，到任何队都可以即插即用，这就是区别,,,,False,6,保密,,治愈伤疤_,https://i2.hdslb.com/bfs/face/ee98c88cad7874887736cda3942301d39eea62c6.jpg
210654939744,1351109300,1,94722320,210614961024,210614961024,210654939744,0,0,1709370712,7,,,除了回到国家队，回到曼联[doge],[doge],,,False,4,保密,,katypapa,http://i2.hdslb.com/bfs/face/4540457d8f9066185ee1121abf9fadf676534dbc.jpg
210661317344,1351109300,1,520450148,210614961024,210654939744,210654939744,0,0,1709373429,6,,,回复 @katypapa :多大了？抛开运动员年纪谈成绩就是耍流氓。,,katypapa,94722320,False,3,保密,,Tony1oo1,http://i0.hdslb.com/bfs/face/member/noface.jpg
210671189360,1351109300,1,12024937,210614961024,210614961024,210671189360,0,0,1709377398,3,,,带球烫脚确实全能,,,,False,6,保密,,空酒尽路,https://i1.hdslb.com/bfs/face/f1a0bc034b46e4d93bafe92838ececf7ab9f6425.jpg
211165364032,1351109300,1,5786151,0,0,0,0,0,1709692055,5,,,"这都什么水平的人在瞎评价
哟西踢右是没有人黑的动的超级边锋，中后期喜欢在中路球王踢法是另外一码事。总裁是在安胖手下练出中路意识后才更进一步，那会已经是真正意义上的前锋了。",,,,False,6,男,,YukinoKanade,http://i0.hdslb.com/bfs/face/aa17586f107e3055dad7b446e7f3ef02660e6d83.jpg
210654749120,1351109300,1,94722320,0,0,0,4,4,1709370603,8,,,一本正经的胡说八道，田忌赛马对比法。把梅西在前场丢球的全部剪出来，把c罗球都拿不住的全部忽略。也不想想梅罗正面对决的胜率、场次和表现。,,,,False,4,保密,,katypapa,http://i2.hdslb.com/bfs/face/4540457d8f9066185ee1121abf9fadf676534dbc.jpg
210667774288,1351109300,1,282011762,210654749120,210654749120,210667774288,0,0,1709375997,2,,,错位对比谁不会，b站c罗梅西盘带集锦一堆，搜一搜就知道谁才是潮水褪去在裸泳的人了[吃瓜],[吃瓜],,,False,5,保密,普通人,MrJulyJ,https://i2.hdslb.com/bfs/face/e4734831c1ec6e25dc65fae62ecea5f42a3bea73.jpg
210684429120,1351109300,1,94722320,210654749120,210654749120,210684429120,0,0,1709382676,1,,,阿伟罗正儿八经持球超过5秒集锦都少的可怜[doge],[doge],,,False,4,保密,,katypapa,http://i2.hdslb.com/bfs/face/4540457d8f9066185ee1121abf9fadf676534dbc.jpg
210676768496,1351109300,1,1118120096,210654749120,210667774288,210667774288,0,0,1709379606,1,,,回复 @MrJulyJ :哪里潮水褪去了？足球荒漠里对球星的看法会影响球星的地位吗？若干年之后贝马梅前三就是不争的事实。,,MrJulyJ,282011762,False,4,保密,,喵喵喵喵喵喵喵画,https://i0.hdslb.com/bfs/face/member/noface.jpg
211258200256,1351109300,1,4586656,0,0,0,0,0,1709737611,5,,,技术特点不一样还拿c罗的技术特点对标梅西,,,,False,5,保密,,浅笑的黑猫,http://i1.hdslb.com/bfs/face/d29c654f28f138494957aa531b19111083dadd52.jpg
210737394544,1351109300,1,43514342,0,0,0,1,1,1709414320,7,,,梅西无球能力几乎为0……听到这种话说出来视频直接可以关了,,,,False,5,保密,二十多年实况足球老粉,大天使翼,https://i2.hdslb.com/bfs/face/25bae1e4603faf2b31974b079881ef752b6ed21d.jpg
210756086032,1351109300,1,332614441,210737394544,210737394544,210756086032,0,0,1709433204,5,,,"11-12赛季，梅罗交手了6场，超级杯2，国王杯2，联赛2。这么大的样本量，楼主偏偏选取了皇马唯一取胜的一场比赛来做解析，这种断章取义、无比片面的解析得出的结论还能获得这么多的播放量，真是可笑之极。

意思其他5场，你金边罗就拿不出手了呗。还有所谓的金边罗，一个场均过人不超过2次无限射门的边锋，居然被称为历史最强边锋？所以最强边锋不用过人，射门就行了是吧？",,,,False,4,保密,,伊比利亚的骑士,http://i0.hdslb.com/bfs/face/member/noface.jpg
211061951504,1351109300,1,489366373,0,0,0,4,4,1709622734,5,,,都2024了，梅西离开巴萨都几年了，还说体系球员，离开巴萨的成绩都是假的，都是抱大腿，靠裁判，就这种人你说你看球干嘛呢？费电不,,,,False,4,保密,,哈喽哈哈123lmg,http://i1.hdslb.com/bfs/face/05c696d03d400beb7e32b24567bf42dbc2f8798e.jpg
211119955040,1351109300,1,489366373,211061951504,211087573152,211087573152,0,0,1709649596,2,,,回复 @缄默的路人甲 :你可真逆天啊，不如阿拉冠，你开心了吗？,,缄默的路人甲,626802919,False,4,保密,,哈喽哈哈123lmg,http://i1.hdslb.com/bfs/face/05c696d03d400beb7e32b24567bf42dbc2f8798e.jpg
211273998976,1351109300,1,3494353320282962,211061951504,211133701040,211133701040,0,0,1709745702,1,,,回复 @jdjs121 :单兵作战能力是啥能力？一个人带球往对面冲吗？那有球球王不完爆你无球球王。,,jdjs121,3546604449564806,False,2,保密,,林海听歌吗,https://i0.hdslb.com/bfs/face/member/noface.jpg
211133701040,1351109300,1,3546604449564806,211061951504,211061951504,211133701040,0,0,1709655335,0,,,梅西单兵作战能力可能确实不如c罗，但是梅西是更好的团队球员。,,,,False,2,保密,,jdjs121,https://i2.hdslb.com/bfs/face/a8dfc85b3e105fb13114c94505ff85d3be757fb6.jpg
210565901024,1351109300,1,50998833,0,0,0,7,7,1709309167,27,,,"我一直认为金边罗的技术特点和现在的姆巴佩很像，但是巅峰期的C罗任意球，远射，力量，头球，射术都强于现在的姆巴佩。
为什么说C罗才是边锋天花板，因为C罗满足边锋上的所有技术素质要求，早年在曼联踢右边前卫，有一脚传中技术，无逆足对于一个边锋来说更是难能可贵，意味着他既可以下底也可以内切，左右开弓，随时换边，再加上上述说的无球跑动，远射，头球，任意球等，完美的边锋模板
而梅西其实生涯中很少真正踢边锋，梦三时期的巴萨出任伪9，msn时期算是给苏亚雷斯让位置踢的右路，后期踢的前场大核心，梅西其实不能算严格意义上的边锋。比较好的边锋模板我个人认为就是里贝里和罗本",,,,False,5,保密,,作弊的红叉,https://i0.hdslb.com/bfs/face/597a9db08c104246fff9826b06ce8019b1af9af7.jpg
210576062688,1351109300,1,243928536,210565901024,210565901024,210576062688,0,0,1709314994,2,,,头球和力量罗更强，但是柔韧度和爆发力巴佩更强，巴佩就像一个灵活的小肉球，罗像一个大马力推土机。巴佩因为个子矮一点的原因射门可以更侧躺一点，射术很好。但法甲太弱了不好评价。,,,,False,6,保密,,黑褐色的是榛子,http://i0.hdslb.com/bfs/face/71c090a9f4d4d031ff39086e3b80d0f7f47841cc.jpg
210633174528,1351109300,1,317700991,210565901024,210565901024,210633174528,0,0,1709360050,0,,,能左右开弓的我还知道一个人，就是斯诺克的火箭奥沙利文,,,,False,5,保密,,玫瑰飞侠,https://i1.hdslb.com/bfs/face/642cabdc9dab01e6db2325edc4943f2af0144825.jpg
210599863808,1351109300,1,50998833,210565901024,210576062688,210576062688,0,0,1709345051,0,,,回复 @黑褐色的是榛子 :我也是这么认为的，姆巴佩的模板不完全是C罗，在禁区里也有大罗的影子，就因为他柔韧性更高,,黑褐色的是榛子,243928536,False,5,保密,,作弊的红叉,https://i0.hdslb.com/bfs/face/597a9db08c104246fff9826b06ce8019b1af9af7.jpg
210603706256,1351109300,1,432139338,0,0,0,13,9,1709347038,32,,,梅西到哪里都用自己的踢法改变球队，很难看到他为了适应球队做出的改变,,,,False,5,男,太像一条狗,一模猫猫,https://i0.hdslb.com/bfs/face/d4c4f9583c54603400775a8fdc2cce267b454122.jpg
210608128448,1351109300,1,945574,210603706256,210603706256,210608128448,0,0,1709349201,7,,,梅西的踢法受限于身体条件，改变很困难,,,,False,5,保密,,太武钗,https://i1.hdslb.com/bfs/face/45fc5d49131f4ffbf71ba514981aa03bc87eb74f.jpg
210878253536,1351109300,1,18948098,210603706256,210814890464,210814890464,0,0,1709488783,4,,,回复 @sadness-maybe :所以为什么不愿意承认是体系球员呢…..,,sadness-maybe,409261676,False,5,保密,独尊儒术罢黜百家,诸如球王再创辉煌,https://i2.hdslb.com/bfs/face/00f557de46fa3bee9f75ace0e9799a38bcbf1468.jpg
210821678544,1351109300,1,41162481,210603706256,210814890464,210814890464,0,0,1709462474,4,,,回复 @sadness-maybe : 然后成绩是八连逆？他这辈子配置除了巴萨最后俩赛季都够好了吧，就算除开巴黎时期不兼容，只算巴萨也是哈白布这种历史级的中场组合呀,,sadness-maybe,409261676,False,6,保密,,黄瓜超肉,https://i0.hdslb.com/bfs/face/c57698c5f5550a9d870a646f492253b8b487c67d.jpg
210660661728,1351109300,1,374535766,0,0,0,11,9,1709373194,13,,,c罗的弱点永远是靠队友，没有厉害的中场制造入球，你给他单上一个都过不了，看看葡萄牙跟阿根廷的区别就知道，阿根廷前锋一多梅西就会回撤，这就是10号跟7号的区别,,,,False,3,保密,,杰仔kt,http://i0.hdslb.com/bfs/face/member/noface.jpg
210663715680,1351109300,1,3546607242971336,210660661728,210660661728,210663715680,0,0,1709374384,7,,,足球11人为了什么？,,,,False,2,保密,,禁止摄摄,https://i2.hdslb.com/bfs/face/3cff4fb58c4fc0b65b93342db7a5fcece7235040.jpg
210748414672,1351109300,1,3546607242971336,210660661728,210689175408,210663715680,0,0,1709429049,2,,,回复 @胡桃夹子Nutcraker :总不能是为了带球而带球吧？人家在前场即使头发丝抢球，抢不到还能干扰门将。梅西回撤中场，过了人好说，被断不去重新抢夺球权罚站原地为了什么？我一开始就是为了说，足球是一个11人的团队运动，如果单凭个人能力还能1v11，那你咋不创个单挑王？,,胡桃夹子Nutcraker,10007693,False,2,保密,,禁止摄摄,https://i2.hdslb.com/bfs/face/3cff4fb58c4fc0b65b93342db7a5fcece7235040.jpg
