rpid,oid,type,mid,root,parent,dialog,count,rcount,ctime,like,plat,device,content,emote,at_uname,at_mid,invisible,level,sex,sign,uname,avatar
207641983840,1950358984,1,13495291,0,0,0,0,0,1707695185,5,,,因为一个人退坑足球那没有必要看下去了。。,,,,False,6,保密,人生在世不就图个成果,丶Chzi,https://i1.hdslb.com/bfs/face/2bb1c48099b1033a43de5f2810036a201278fdd7.jpg
207754294224,1950358984,1,83195964,0,0,0,0,0,1707747615,4,,,喜欢C罗曾经一度是不敢在社交媒体明说的事，直接被打成梅黑，好像喜欢C罗就一定仇恨梅西一样，现在终于等到了[辣眼睛],[辣眼睛],,,False,5,保密,,熊孩纸烤烤吃,http://i0.hdslb.com/bfs/face/9befe8366f932ff1553f678f4a8885190c87c511.jpg
207396404656,1950358984,1,8406865,0,0,0,4,4,1707551512,5,,,从2比0输沙特    就知道会保送冠军,,,,False,6,男,杨永信？？ 是卖杨国福的吗？,对不起我忍不住了,https://i1.hdslb.com/bfs/face/d337f9e4dd71af66f6bd55af9e452557b9746390.jpg
207396610464,1950358984,1,95787336,207396404656,207396404656,207396610464,0,0,1707551640,3,,,那你压了吗，发财了吗[吃瓜],[吃瓜],,,False,4,保密,,小炒面丶,https://i0.hdslb.com/bfs/face/625ba610547536acf3919c7b130dc8b8a1f388bd.jpg
207412955456,1950358984,1,8406865,207396404656,207396610464,207396610464,0,0,1707559380,0,,,回复 @小炒面丶 :最后一场     将输的都赢了回来了，还多一点          梅西人品确实贱,,小炒面丶,95787336,False,6,男,杨永信？？ 是卖杨国福的吗？,对不起我忍不住了,https://i1.hdslb.com/bfs/face/d337f9e4dd71af66f6bd55af9e452557b9746390.jpg
207403889248,1950358984,1,3493119104387521,207396404656,207396404656,207403889248,0,0,1707555214,0,,,2比1,,,,False,3,男,,大青蛙国际足球俱乐部,https://i1.hdslb.com/bfs/face/1015e0e4ac1e4b016366c9b36f39e82dd9a90705.jpg
208468339072,1950358984,1,19430411,0,0,0,6,5,1708145977,10,,,跟风黑真看烦了，这和前段时间跟风踩c罗有什么区别，无非是哪边声音大站哪边。,,,,False,6,保密,我是一个经常笑的人，可我不是经常开心的人。,鸟游花,https://i2.hdslb.com/bfs/face/dc185d557939abd339c9a6fd6d90bdbae4d106da.jpg
208944040784,1950358984,1,3493082100140126,208468339072,208468339072,208944040784,0,0,1708399729,6,,,踩 c 罗是粉圈战争，踩哟西是众望所归,,,,False,3,保密,,kaola零零,https://i2.hdslb.com/bfs/face/82cc53d61549d3b12caa8db95d3e480b0937c826.jpg
210033263616,1950358984,1,7919807,208468339072,208468339072,210033263616,0,0,1708970753,3,,,你以为踩哟西的都是C罗粉丝是吧？？？？byd还对比上了，这个时候知道当理中客了？还跟风黑，我说句实话，你偶像自己选的，你挑的嘛，偶像,,,,False,6,保密,妈的这比班还要上到什么时候,卡拉肖克丶玲,https://i2.hdslb.com/bfs/face/f8f4be0615ad30367ee98ae7707f565b20f9fb57.jpg
208837966864,1950358984,1,402055790,208468339072,208468339072,208837966864,0,0,1708337280,2,,,真是这样，只要发这种视频就有流量,,,,False,5,保密,,歪比歪比歪比歪比,https://i2.hdslb.com/bfs/face/a71ddd2eac84cbaebfb68c6c08f2cee750c22740.jpg
207418047744,1950358984,1,256508122,0,0,0,0,0,1707561478,4,,,"所以up能讲讲梅西去巴黎的故事吗，梅西去巴黎前姆巴佩是万众瞩目的天才少年，和内马尔关系和铁哥们一样，社交媒体内外各种联动，然后梅西去了巴黎以后，姆巴佩的人设就变成那种蔫坏阴暗比，各种心机大牌耍脾气，和内马尔各种小细节表示闹矛盾，然后梅西走了以后姆巴佩的风评才开始好转，这中间到底经历了什么？每年过年姆巴佩都给中国送祝福，姆巴佩对小球迷的态度也好的一批，怎么就中间有这么大反差？
从梅西说要去巴黎那会我就说完了，花这么多钱引入个没防守的“爹”，那姆巴佩就不得不挤到他不熟悉的中锋上，所以为什么不引入一个大中锋或者补强一下那毫无存在感的中场，姆巴佩和内马尔双翼齐飞难道不香吗，只能说商业足球，利益至上，后来就不关心大巴黎的比赛了，那会我就知道姆巴佩早晚有一天要去皇马了",,,,False,5,保密,,知北星,https://i1.hdslb.com/bfs/face/0a992c7394d6e22074891b958ab6ca4149a37aa5.jpg
207934619728,1950358984,1,1571694442,0,0,0,0,0,1707843170,3,,,一直就是路人21年路转黑，看我头像是个人都知道什么原因吧[脱单doge],[脱单doge],,,False,4,保密,,永远支持最好的莱万,https://i1.hdslb.com/bfs/face/c76fe888ab8b88a5964808dd65adb544987875d4.jpg
207606946720,1950358984,1,323779096,0,0,0,1,1,1707662466,8,,,不是，就算哟西现在万人踩，也轮不到集锦球迷发声吧？说实在的集锦球迷是最恶心的一帮人，从大小罗到姆巴佩哈兰德，吹的时候无所不用其极踩的时候也是一点也不含糊，墙头草一样,,,,False,5,保密,轨迹改变角度交错，寂寞城市又在探戈,罗德尔牧羊人,https://i1.hdslb.com/bfs/face/f551d12a4e9de35fc3d050d07490f96a471cc813.jpg
207607354416,1950358984,1,323779096,207606946720,207606946720,207607354416,0,0,1707662615,1,,,叠个甲，我从272皇马时期开始看的西甲，从来不是哟西粉丝,,,,False,5,保密,轨迹改变角度交错，寂寞城市又在探戈,罗德尔牧羊人,https://i1.hdslb.com/bfs/face/f551d12a4e9de35fc3d050d07490f96a471cc813.jpg
207404802880,1950358984,1,3546375855802938,0,0,0,0,0,1707555603,12,,,德拜球迷可以站起来了，感谢两队为捕鼠事业做出的巨大贡献,,,,False,2,男,像德约一样，永不言弃，与命运和强敌拼搏到底,温布尔登奇迹,https://i0.hdslb.com/bfs/face/f5c4e4a92435af558b5479e3f1dc741b05e4be95.jpg
209325030992,1950358984,1,284272242,0,0,0,2,0,1708589137,7,,,哈哈，up主钓出来了好多小哟西,,,,False,5,男,,丶最后的倔强,https://i0.hdslb.com/bfs/face/245369e1db3d71f9ba9a6e0b4beae7b3a3a2d82d.jpg
207914545216,1950358984,1,1176439246,0,0,0,0,0,1707834962,3,,,终于知道甲亢哥为嘛这么讨厌哟西了,,,,False,3,保密,,wooohmy,https://i1.hdslb.com/bfs/face/6688a4d99d0baab067179f67e0742d4e882bfbc6.jpg
207519664912,1950358984,1,76845767,0,0,0,0,0,1707624703,5,,,梅粉跟罗粉最大的区别就是阿根廷球员说不得 葡萄牙球员在那个队表现不好队迷可以随便说 阿根廷球员不管你是谁 你说句不好 一堆蓝白围着你打,,,,False,6,男,空持千百偈 不如吃茶去 ,一座小山丶,https://i2.hdslb.com/bfs/face/b1366e43a1d6257f5818d76e70b582f5d3d73769.jpg
209594888464,1950358984,1,259255762,0,0,0,0,0,1708729270,3,,,老球迷，从还在穿19号做小罗小弟的时候就关注，从他第一次退国家队就对他没什么好感了，一个国家队的核心队长哪有这样的啊？又不是那种年纪大了或者有了太多荣誉急流勇退，输了就跑？还不止一次。后来跟巴萨闹僵的时候我说了两句，直接被他球迷喷。已经拿着世界第一的年薪还不满足吗？多少才够？没有巴萨他有个毛现在的成就？,,,,False,4,保密,,我最喜欢大宝剑,http://i0.hdslb.com/bfs/face/member/noface.jpg
210705639344,1950358984,1,2085821402,0,0,0,0,0,1709390838,4,,,又蹭到了 爽😊,,,,False,3,保密,,白轩也,https://i0.hdslb.com/bfs/face/member/noface.jpg
207548331824,1950358984,1,3782849,0,0,0,0,0,1707638139,3,,,19年才发现？有点晚了啊，10年就开始偷金球了,,,,False,6,保密,,海星影,https://i2.hdslb.com/bfs/face/06b6136bff8b6627b60f2606cb32576dcd1550b5.jpg
207632905552,1950358984,1,411515159,0,0,0,0,0,1707675797,6,,,阿根廷夺冠之前之后都有无数ast骂格策，，，我们德拜姐承伤也很高[微笑],[微笑],,,False,5,女,,求求你了我真的起不来,https://i2.hdslb.com/bfs/face/05b2a9e31130dc6940f891fa110d4bed8fda98cf.jpg
207557040704,1950358984,1,354363477,0,0,0,0,0,1707642308,5,,,狠狠打了梅西粉的脸，不过放心，真正的粉还是会吃屎的,,,,False,5,保密,,23266108172_bili,http://i0.hdslb.com/bfs/face/member/noface.jpg
207686098240,1950358984,1,16912653,0,0,0,1,1,1707718527,3,,,看过马拉多纳，贝利，大罗，小罗，卡洛斯，里瓦尔多踢过球的，说实话还真看不上梅西这类的，没有球星气质，以前说一堆人骂，现在没人骂了吧，感觉逆境里没什么担当的球员，内心球技都不够强大，实话实说,,,,False,5,保密,,kuangaikimi,https://i0.hdslb.com/bfs/face/member/noface.jpg
207699746224,1950358984,1,1462705272,207686098240,207686098240,207699746224,0,0,1707725245,0,,,确实，老鼠终归是老鼠,,,,False,5,保密,,宇智波_梅西,https://i0.hdslb.com/bfs/face/9112216bd3728bc8b48470294a508c4f314f3897.jpg
207332643360,1950358984,1,121287494,0,0,0,1,1,1707512285,8,,,从没喜欢过梅西和C罗，但是自从阿萨塔无差别攻击其他家的时候，我就是个偏罗一边的罗本粉了 [脱单doge],[脱单doge],,,False,5,保密,,雨乀瞳,http://i0.hdslb.com/bfs/face/member/noface.jpg
207416670928,1950358984,1,220642504,207332643360,207332643360,207416670928,0,0,1707560887,0,,,罗本结晶也是罗结晶[脱单doge],[脱单doge],,,False,5,保密,,噼里啪啦小猪头,https://i1.hdslb.com/bfs/face/af5863c9f08f213adeaae8f01272f453faec3ca8.jpg
207335474960,1950358984,1,478140323,0,0,0,125,102,1707519679,16,,,@Canoe独木  记住千万不要删视频 因为我替你保存了[吃瓜]已经开始又回旋镖了 香港政府与迈阿密国际的合同 为什么到现在都不敢爆出来 如果真有说的那么难看 可以直接使用法律措施 告 那为什么到现在还静悄悄的？拿爱国来绑架人 你们也是独一份 还有梅西在香港没上场，和他在日本上有啥关系？你们也是真的联想，不得不佩服想象力[吃瓜],[吃瓜],Canoe独木,3493132175935882,False,5,保密,,关握劈式,https://i2.hdslb.com/bfs/face/e3f3f019e381a205046e0bef719fa510483b136f.jpg
207336345312,1950358984,1,39967809,207335474960,207335474960,207336345312,0,0,1707521111,35,,,不得不说舔狗就是舔狗，无论被怎么踩依旧无脑舔,,,,False,5,保密,,想去海边吹吹风_,https://i0.hdslb.com/bfs/face/0d3733ff6106edfcf8c504e42cb76c0c58fdb7da.jpg
207337360016,1950358984,1,679435493,207335474960,207335474960,207337360016,0,0,1707522289,21,,,别扯什么回旋镖，在这件事上呦西永远洗不了，合同咋了？合同让他哑巴了？合同把他两手绑裤兜了？,,,,False,4,保密,,要做个人啊,https://i0.hdslb.com/bfs/face/member/noface.jpg
207336844896,1950358984,1,15911674,207335474960,207335474960,207336844896,0,0,1707521852,20,,,只能说 你这种 众人皆醉我独醒的🤡挺可笑的,,,,False,6,保密,永燃的瞳术师,P1ate,https://i1.hdslb.com/bfs/face/a56c7980e1e14780d2bf730ea3a569caae3e5862.jpg
207485007600,1950358984,1,268612263,0,0,0,0,0,1707592719,3,,,哈哈哈，当聪明人可太好了[脱单doge][doge]可以少被骗几年[喜极而泣],[doge] [喜极而泣] [脱单doge],,,False,6,女,"粤语hip-hop，无限进步
某音：天线得得B",Rap粤语的Lulu,https://i0.hdslb.com/bfs/face/fe3dadd9087a354076c762830a23b8c925e11da2.jpg
209408106416,1950358984,1,49720609,0,0,0,0,0,1708619461,4,,,偷了斯内德的金球的时候我就开始不喜欢他了，而且竞技精神真的很差，逆风就完全摆烂，虽然我承认他球感和技术绝对顶尖,,,,False,6,保密,,术理化,https://i1.hdslb.com/bfs/face/e9403eae067467d2221c850a651b471c04caa961.jpg
207387588000,1950358984,1,477197464,0,0,0,0,0,1707547090,16,,,"为你的清醒点赞
其实敢于发声的人不少 都被那些声音淹没了
前段时间没戏世界杯预选赛连续2场锁喉 都被洗的干干净净 说成队长担当为队友出头 这放到其他人那绝对被打成罪大恶极",,,,False,3,女,,兰玉金,https://i1.hdslb.com/bfs/face/e2f3e97e8d2d422fe447f0dd97a58a8488abd570.jpg
207386494144,1950358984,1,146491816,0,0,0,2,0,1707546502,40,,,巅峰脱粉只有我吧，脱粉十年了，现在更是路转黑,,,,False,5,保密,活着,这货不是阿克曼,https://i1.hdslb.com/bfs/face/02a808837ab70b34322c8cecba8c9ad616fd328d.jpg
207631371072,1950358984,1,327325701,0,0,0,1,1,1707674293,4,,,不喜欢讨厌还要说曾经喜欢过，现在人都喜欢这么玩了吗[嗑瓜子]还是说说自己成分是什么让你感到很丢脸？,[嗑瓜子],,,False,5,男,天子呼来不上船，自称臣是酒中仙,不盲是非,https://i0.hdslb.com/bfs/face/39f0e3e03671198c833888a7667d0c5eed8e2fd3.jpg
207762111136,1950358984,1,35647988,207631371072,207631371072,207762111136,0,0,1707750505,0,,,用饭圈的话说这叫脱粉回踩。很正常噜。我原先还是厄齐尔球迷🤗,,,,False,6,保密,水能载舟，亦可……,van家小绵羊,https://i2.hdslb.com/bfs/face/66db50fe72a0b89d9ebdb920d52903a804c2b540.jpg
207757037904,1950358984,1,18312785,0,0,0,0,0,1707748632,3,,,吆西个人实力跟c罗有断档的差距,,,,False,6,保密,,云想霓裳舞,http://i2.hdslb.com/bfs/face/e5cb2f45e257f337c756521bd73c56814443c8c0.jpg
207508650112,1950358984,1,67441887,0,0,0,0,0,1707619594,4,,,跟风黑蹭流量玩的溜[点赞],[点赞],,,False,6,保密,,xuanshicizuimeng,http://i0.hdslb.com/bfs/face/27a967d88921290efc4b96f68c134eefebf922bd.jpg
207479248016,1950358984,1,3546582704195909,0,0,0,0,0,1707586725,3,,,已经没事了，要问为什么，因为梅西已经横空去世了,,,,False,3,保密,,I_LOVE_FUNO_CHAN,https://i2.hdslb.com/bfs/face/6acf7bc14516eed4bddb5a1f81fd413f2df7a367.jpg
207410199904,1950358984,1,440103304,0,0,0,0,0,1707558146,3,,,还好我从小到大都是颜控看脸看身子，没有恋丑癖，这辈子喜欢不了一点梅鼠[脱单doge],[脱单doge],,,False,5,女,此时相望不相闻，愿逐月华流照君.,白落尘-,http://i1.hdslb.com/bfs/face/68fda312319e2087c05a0c66a874d065788b8c1d.jpg
208114671232,1950358984,1,3493122656963362,0,0,0,1,0,1707957213,3,,,我同学全喜欢梅西，写作文也全是梅西，“呦西”事件以后，他们开始反思了，开始抨击中国社会了[微笑]，他们说中国就是不如日本，我直接退班群，删光好友了，真的。,[微笑],,,False,3,男,。。。,符三岁plus,https://i1.hdslb.com/bfs/face/9c763459d82b5fa2a6e9216dc1309fd5f840a1f6.jpg
207631662512,1950358984,1,176017899,0,0,0,0,0,1707674679,4,,,阿根廷只有一个球王，那就是马拉多纳,,,,False,5,保密,今天我中奖了吗？,韭菜陈陈,https://i0.hdslb.com/bfs/face/66d51e40d8a879e8015395f4277b5bc7056ab762.jpg
207439828432,1950358984,1,352898053,0,0,0,0,0,1707570139,3,,,"在此和所有还在洗梅西的说一句  
当初你们要C罗跪下  要罗迷跪下  C罗没有跪  罗迷也没有  
现在罗迷奉劝你们  不要跪  站起来！！！！！",,,,False,5,保密,,通辽后宫主管,https://i1.hdslb.com/bfs/face/8748913fecd6d093401d27a8ae34479e12568087.jpg
207361299536,1950358984,1,3493104057321498,0,0,0,7,4,1707535668,27,,,竞技体育篮球足球都有造神现象，裁判偏袒，投票有问题,,,,False,3,保密,,建议不要笑挑战,https://i0.hdslb.com/bfs/face/183bb8f9f0658ee79ae695a175f83f2d9adb2fcc.jpg
207426019808,1950358984,1,3493104057321498,207361299536,207423019616,207423019616,0,0,1707564653,4,,,回复 @路過的路人A : 你说的对，场均2016年的欧文fmvp 0票，2020年戴维斯fmvp 0票，太监真别装,,路過的路人A,264487300,False,3,保密,,建议不要笑挑战,https://i0.hdslb.com/bfs/face/183bb8f9f0658ee79ae695a175f83f2d9adb2fcc.jpg
207780075424,1950358984,1,418183360,207361299536,207423019616,207423019616,0,0,1707758884,2,,,回复 @路過的路人A :NBA投票就算了吧,,路過的路人A,264487300,False,5,男,Anything is possible!!!,孤柒JdzN,https://i1.hdslb.com/bfs/face/8022f840dcc6516aa05a0843ea9c958fb2e6b1e0.jpg
207626951632,1950358984,1,515970418,207361299536,207426019808,207423019616,0,0,1707671239,1,,,回复 @建议不要笑挑战 :回复 @建议不要笑挑战 :是这样。按照15年伊戈达拉的标准，16年fmvp甚至应该给到欧文[嗑瓜子]投票规则跟梅西一样都是随詹而变的。你理他干嘛哩,[嗑瓜子],建议不要笑挑战,3493104057321498,False,4,保密,,武猩上将六步郎,https://i1.hdslb.com/bfs/face/776db5e3a4055981e3d5fcac86235b0e6ba04432.jpg
207422479936,1950358984,1,19099329,0,0,0,35,26,1707563287,102,,,其实现在大家说造神的时候基本上爱从近10年说，其实呦西第一次出现在金球前三名的时候就很有问题了，07年普拉蒂尼上台，那年的金球是卡卡，但是很多人忽略的是银球是呦西，铜球是C罗。那次卡卡有欧冠，C罗有英超，呦西什么荣誉都没有，表现也没有卡卡和C罗突出，但是他就是银球，当时贝利颁奖差点把银球给C罗，被人提醒才知道银球给呦西。,,,,False,5,保密,,作宇由来称栋梁,https://i0.hdslb.com/bfs/face/093cc0abbc242e08d3d4430aa3e9ae0229d3496d.jpg
207439135376,1950358984,1,287403652,207422479936,207422479936,207439135376,0,0,1707569823,17,,,哥们你记错了，那是那一年的世足，那一年金球奖c罗拿的是银球,,,,False,4,保密,,whrdashuai,https://i0.hdslb.com/bfs/face/member/noface.jpg
207437148720,1950358984,1,161328163,207422479936,207422479936,207437148720,0,0,1707569087,4,,,金球个屁，是世界足球先生。,,,,False,5,保密,,机智的兔子呀,http://i0.hdslb.com/bfs/face/member/noface.jpg
207468399584,1950358984,1,429661143,207422479936,207465722080,207439135376,0,0,1707580891,4,,,回复 @霸天男神 :呦西,,霸天男神,283474491,False,5,男,,御坂10577,https://i0.hdslb.com/bfs/face/eb68e47ef063d0df71a9cfe53a4d38359ffd93a7.jpg
207618683040,1950358984,1,695657038,0,0,0,1,1,1707667041,5,,,我不知道为什么从我入坑的第一天起，我就对梅西无感，反而对c罗有感，就特别奇怪，我旁边的同学都天天跟我营销梅西干嘛干嘛，但是我就说我喜欢c罗，我喜欢莫德里奇，喜欢皇马[微笑],[微笑],,,False,4,保密,宇宙很大，生活更大,执剑人J,https://i1.hdslb.com/bfs/face/64d0836bc9cd6a5e310f22e242a7dab2a5e7926a.jpg
208668214656,1950358984,1,1897638332,207618683040,207618683040,208668214656,0,0,1708248475,0,,,因为你是正常人,,,,False,5,保密,,詹蜜必须拉黑,https://i2.hdslb.com/bfs/face/938fdd23a179b8b9846436aa3672e90b3b85f2f0.jpg
207327873280,1950358984,1,54482846,0,0,0,10,7,1707504483,24,,,[doge]连续输给智利两次梅西只怪队友，而且回去就闹着退出国家队。5年4届美洲杯有裁判和赛事组保送进决赛第五次才拿个冠军，再说世界杯，我就问一句同样的犯规就没什么区别，阿根廷场场点球，为什么别的国家队就硬不给点球呢？有人在欧冠就踢的烂离开体系一坨不是，欧冠大舞台太容易能看出一个球员的实力了。,[doge],,,False,5,男,,表情易乱,https://i2.hdslb.com/bfs/face/ef4b2f41f0045d9a388464e49867c9ef14e56b98.jpg
207336006144,1950358984,1,1671036194,207327873280,207327873280,207336006144,0,0,1707520633,6,,,"梅西16美洲杯踢丢点球赛后说退出国家队，哪句话怪队友了？15年决赛点球就他一个人罚进， 四轮就输掉了点球大战。16年他和比达尔第一轮都罚丢，后面队友又罚丢一个，点球大战再次输掉。他三连亚到三连冠期间，哪句话怪过队友？
21年美洲杯遇上疫情，哥伦比亚放弃承办，阿根廷想接手被南美足协给拒绝，巴西承办，决赛马拉卡纳，死敌卫冕冠军巴西配合保送？欧美杯卫冕冠军意大利又配合？世界杯前36场不败全是演？决赛法国70多分钟没射门是踢假球还是被下了98年的药？
别的国家怎么没点球了？英法大战，英格兰两个点球，所以是保送英格兰过关？决赛法国两个点球，又换保送法国卫冕了？21欧洲杯葡萄牙三场小组赛三个点球，想再演奇迹？法国三届决赛四个点球，保出来几个大力神杯？
梅西欧冠踢得烂？欧冠进球129，比C罗少11球，助攻39，比C罗少2球，你说的体系是什么，无非想说哈白布。那么离开哈白的19欧冠踢得烂？12球3助攻，比第二莱万多4个还少踢1个点球，巴萨队内第二射手是乌龙，然后才是库蒂尼奥和登贝莱的3球，那届欧冠射手榜前20都排不进。或者是想说哈维替补赛季的15欧冠也是体系？欧冠梅西还需要证明自己？那你从19年以后开始看好了，梅罗都是一坨屎，两人加一块淘汰赛只赢过一轮。",,,,False,4,保密,"吵架就吵架，别动手拉黑啊
…言而无信非人也…",iamsohappy2022,https://i2.hdslb.com/bfs/face/b3ab4cfee245a40cf302812e228ae24a35963452.jpg
207337045328,1950358984,1,526484616,207327873280,207327873280,207337045328,0,0,1707522019,3,,,国家队更看个人实力，俱乐部赛事各种位置能自己砸钱搭配顶尖的球员，欧冠之王阿伟罗国家队赛事表现无一届MVP，世界杯淘汰赛5届零进球零助攻，三次入选最差阵容，欧洲杯历年来的MVP都是冠军的，就16年欧洲杯赛事mvp给了非冠军的格列兹曼，所谓欧冠大舞台能看出实力的阿伟罗怎么在国家赛场就不灵了？,,,,False,5,保密,,泠波,https://i0.hdslb.com/bfs/face/dafc80a4c8df95f0708cf9587c9adc78f521abcc.jpg
207378521168,1950358984,1,488588965,207327873280,207327873280,207378521168,0,0,1707542853,0,,,"就事论事随便喷随便黑
但请不要学坏人学编造
哟西啥的随便骂",,,,False,5,保密,,ii隐藏的深,https://i1.hdslb.com/bfs/face/053f035bdcec08d645e2f02dfd183cb6420c3814.jpg
208439782592,1950358984,1,3546622250191711,0,0,0,2,0,1708133336,3,,,吆西粉们给老子记清楚了：靠一个点球杯到处压迫各方球迷甚至路人都时候就要想清楚自己的主子后面会不会塌房乃至于全被我们清算！[笑],[笑],,,False,2,保密,,理智巴萨球迷,https://i1.hdslb.com/bfs/face/930b7f4a684afd3cc0143d774d99742ab6b358cc.jpg
207354782032,1950358984,1,263027756,0,0,0,0,0,1707532823,14,,,我也是。我14年刚看足球时还是呦西粉丝，15年巴萨拿欧冠但我不知为何对梅西喜欢不起来。后面就粉上了c罗一直到现在。22年世界杯后我一个足球迷被恶心的直接不看足球了甚至潜意识里有些厌恶，找了个足球相关的工作却发现自己喜欢不起来[喜极而泣]。从22年年中c罗在曼联的那些事开始一直到今年2月，整整一年半的时间啊，到处都是“阿伟罗”这个梗。可见梅毒们心里对c罗是多么憎恨啊、憋屈了多久啊。虽然你主子的荣誉很多都是偷的，但已经压过了c罗，继续吹你主子也无所谓。但非得反过来对着c罗球迷落井下石了一年半，这期间不喜欢呦西的都被打成了c罗粉丝。问题是你们觉得自己的主子真没什么问题么？23年世界足球先生颁给梅西彻底说明这个奖已经变成“只要有梅西就会颁给它”的无脑奖项，也许只有梅毒退役这个奖才会正常一些吧。别给我避重就轻说什么都是别人投的，我就问23年梅毒和哈兰德谁表现更好！现在梅西因为自己作死在cn臭了，大家憋屈了很久终于爆发了。我知道过一两个月热度减少梅毒粉丝必然反弹，但至少这一波扫清了大家心理的阴霾，以后对线时一句“呦西”梅毒粉丝们怎么喊“阿伟罗”都是无力的，因为梅毒看不起的举动cn是事实，有本事你们梅毒粉丝全去当恨国党吧！当然我知道今年暑期c罗来华时粉毒粉丝必然要制造事端展开舆论攻势，那就试试吧！,[喜极而泣],,,False,5,保密,,奥加斯ORGAS,https://i2.hdslb.com/bfs/face/82e612c32bfa920d3bce93e97b7fee9b28a15417.jpg
207493905520,1950358984,1,327045214,0,0,0,1,1,1707611031,5,,,足球是欧洲的 球王是南美的  这是欧洲人为了市场做出的妥协 毕竟再牛逼的球王最后还得到欧洲踢球 给欧洲缴税  但是大罗 小罗 卡卡 距离神位都差点儿运气 这时候C罗一出来 某些人就急了 要开始造神了 皇马五年四欧冠的时候胜负已分 侏儒不到三十岁的年级已经被球迷亲切的称为欧尼酱了 不是FIFA死保 它拿什么奖？只有马戏团会给它颁奖,,,,False,5,保密,,AISINSELE,http://i0.hdslb.com/bfs/face/member/noface.jpg
207511862432,1950358984,1,100193887,207493905520,207493905520,207511862432,0,0,1707621103,1,,,梅毒是双国籍 相当于就是欧洲的狗,,,,False,5,保密,相见不如怀念   ,天使沐浴着阳光,https://i1.hdslb.com/bfs/face/81be03686d785e010ac87d0dbd1cf85abf44a5fb.jpg
208774083008,1950358984,1,287566639,0,0,0,0,0,1708309932,3,,,我是12年左右开始看球的，那会喜欢刷腾讯新闻的足球版块。当时有个ID叫《贝尔狂虐伊莲娜》的用户，整天在C罗的新闻下面用污秽的词辱骂C罗，点赞好几万，还有楼层中梅西球迷的回复更是不堪入目，典型的痞子聚集地，毫无道德可言。那会就比较好奇，他们为什么要骂C罗？腾讯为什么不删？梅西球迷到底是什么组成的？  所以第一印象有点讨厌梅西，讨厌梅西球迷。如今来看，我对里奥呦西的第一印象是对的。,,,,False,4,男,,年弗大会员,https://i0.hdslb.com/bfs/face/member/noface.jpg
207514760464,1950358984,1,40215662,0,0,0,5,5,1707622465,9,,,18-19欧冠我印象太深了，当时巴萨3:0利物浦，我都觉得巴萨要夺冠了（中立球迷，我主队阿森纳），然后次回合被利物浦逆转的时候，我当时都觉得震惊。无比的震惊,,,,False,6,保密,喜欢苹果茶和妮妮是我的荣幸,橙橙子orange10,https://i2.hdslb.com/bfs/face/d896db11c31db9679e2a6a21ba3e5c813da7daac.jpg
207519574768,1950358984,1,429251862,207514760464,207514760464,207519574768,0,0,1707624686,2,,,毕竟伊斯坦布尔之夜历历在目，当时米兰也觉得稳了[微笑],[微笑],,,False,4,保密,,唯世君爱,http://i0.hdslb.com/bfs/face/member/noface.jpg
