rpid,oid,type,mid,root,parent,dialog,count,rcount,ctime,like,plat,device,content,emote,at_uname,at_mid,invisible,level,sex,sign,uname,avatar
208244053728,1750523137,1,398936532,0,0,0,0,0,1708011654,0,,,没关系，与我无关,,,,False,5,男,我 吼吼吼吼吼吼吼吼吼吼吼吼     ,两只老虎爱跳舞o,https://i0.hdslb.com/bfs/face/625261143cccc36a9e6cf7673484d608e080e117.jpg
208858709200,1750523137,1,486169684,0,0,0,0,0,1708344984,0,,,顶上去啊 多点赞啊,,,,False,5,男,,摸鱼怪小元,https://i1.hdslb.com/bfs/face/8b386f3a58b2cc57ba115c401b605ea6d543df72.jpg
208306867344,1750523137,1,292657285,0,0,0,0,0,1708059145,0,,,"---简单聊聊梅西合同问题。
    梅西事件已经过去了一段时间。梅西已被封杀。首先再澄清一下，梅西被封杀不是梅西不出场的合同问题，而是态度问题。即使他“受伤”了，不会影响他挥手及微笑。那么现在合同有什么可聊的呢？
    合同情况大概是这样的，听闻，俱乐部一份合同，梅西单独另外一份合同。而俱乐部又分低价与高价两份套餐。而低价套餐的写法是：梅西没有受伤的情况下，出场踢45分钟。这个写法不是定性的，而是有弹性的，打官司时法官很难作判决，意思是胜算难料。本来，收多少钱，办多少事，梅西不出场很合理的。但制定合同的甲方，就一点问题都没有了吗？
    其实，合同的制定本身就存在很大的问题。因这是表演赛，球王梅西的俱乐部合同的设计中，居然有球星不出场是弹性设置，本身就很奇怪。球星必须出场，那怕是一分钟，也应该设置其中。就如同大家上网订餐一样，餐单上写着必要时配饭，饭到时，你却只收到菜，米饭要另外买。又举例，如果在网上购花。网页上写着花盆随机发货，结果你买的只有花朵，连花盆也没有。这不就是妥妥的欺诈吗？
    所以，合理的设计是，凡以球王或球星为主打的表演赛，球星必须要出场。并且，合同要白纸黑字写上，球星出场要单独另找当事人签约。合同价格的高低，与球星出场时间长短相配套。如果真的有伤不宜运动，可默契地设立终场前一分钟出场露脸项，此项被喻为向观众行答谢礼。合同是人定的，现在出事了，把责任全推给没经验的主办方，这很不公平。
    结论是，俱乐部与梅西，没有提供最基本的观赛服务。在合同设计上，存在严重陷阱，负主要责任。如果合同的设计，无论是什么套餐，球星都必须出场，这才符合表演赛的最低标准。那主办方无论有没有经验，就一定不会出现签错合同的现象。",,,,False,4,保密,,雷电追风,https://i1.hdslb.com/bfs/face/10cb469e90e1c5de460225b62b118cbdc785e520.jpg
208169971264,1750523137,1,254231035,0,0,0,1,1,1707983255,0,,,假老师能不能关注我下，不能私聊。,,,,False,5,保密,,专一帝73748,http://i1.hdslb.com/bfs/face/97da1fbb035bdb3bea3979dcb14bba9fc3f33108.jpg
208170116096,1750523137,1,254231035,208169971264,208169971264,208170116096,0,0,1707983261,0,,,@請假,,請假,174383177,False,5,保密,,专一帝73748,http://i1.hdslb.com/bfs/face/97da1fbb035bdb3bea3979dcb14bba9fc3f33108.jpg
208426497392,1750523137,1,20747108,0,0,0,0,0,1708114798,0,,,君子论迹不论心，虚伪的阿伟罗处心积虑，银耳汤推杯换盏折腰五斗，开发布会不取消要延期反客为主尽显狂妄自大。谦谦君子如梅西双手插袋低调过人不屈权贵，带病上场一诺千金远赴日本抗日险破一门是为球王风范！,,,,False,6,保密,"Blaze way down the rebel path
照亮离经叛道的征程啊",爷爱二次元呐,https://i2.hdslb.com/bfs/face/4b2789f33a17843f24e6c3592230fdb8a4cb4e48.jpg
208241889712,1750523137,1,263556326,0,0,0,0,0,1708010853,3,,,还在洗呢...[偷笑],[偷笑],,,False,6,保密,"Money doesn't buy happiness,it buys crazy-ass happiness!!!",Dell_You_Lader,https://i2.hdslb.com/bfs/face/de307768de371c8ececc5fa811a1e64ce7505319.jpg
208252113456,1750523137,1,475013336,0,0,0,0,0,1708014974,0,,,你什么up主[doge],[doge],,,False,5,保密,,凡嗲,https://i2.hdslb.com/bfs/face/ca2496206a81f8fbbe1967fc46c0697fff99d73c.jpg
208238780256,1750523137,1,327980829,0,0,0,1,0,1708009743,0,,,真的，别跪了,,,,False,5,保密,,neo0503,http://i0.hdslb.com/bfs/face/e64aa307dc701e4e8b79bae954bf75d6df3d4e71.jpg
209075154704,1750523137,1,434320052,0,0,0,0,0,1708449457,0,,,串麻了,,,,False,5,保密,,不善言辞李狗蛋,https://i2.hdslb.com/bfs/face/fcfdb4f70493eea527084b514ba3f1a1ecc00111.jpg
208431273264,1750523137,1,15994351,0,0,0,0,0,1708126645,0,,,足坛天龙八部[doge],[doge],,,False,6,保密,,别人总是叫我输出,https://i1.hdslb.com/bfs/face/5ceac11ec6bddcec377ac2ab00fae9242a877960.jpg
208232631232,1750523137,1,94906889,0,0,0,0,0,1708007524,0,,,你敢说什么？  我直接反手一个上升  丑事就怕闹大 就怕盖帽子,,,,False,6,男,纯爱发电(dian),Draco华生,https://i2.hdslb.com/bfs/face/06592ef00540f3d6166d8833285965b651b0925b.jpg
208335250304,1750523137,1,24913904,0,0,0,0,0,1708072093,0,,,去dy看看阿根廷中国行工作人员的发声 连个热搜都上不去的 前几天一百多个热搜轻而易举[喜极而泣][喜极而泣][喜极而泣],[喜极而泣],,,False,5,女,为什么不问问神奇海螺呢,机灵小脑瓜,https://i2.hdslb.com/bfs/face/f26ed51275131dc73f6cb37b7a53176ebff0987a.jpg
208221963008,1750523137,1,51181484,0,0,0,1,1,1708003725,0,,,要洗呦西不是应该哟西把日本的合同拿出来，如果是单独签的上场合同不就能洗了吗？不就能证明不签单独上场合同，呦西就不能上场,,,,False,6,保密,明镜止水下,llnt12,https://i2.hdslb.com/bfs/face/943b609bfc8c3f9971fae6ca3aaaaab1ee8333c1.jpg
208263991632,1750523137,1,535031302,208221963008,208221963008,208263991632,0,0,1708023639,0,,,急,,,,False,4,保密,,贲吉云的,https://i1.hdslb.com/bfs/face/107eb233dbe6738960e0f35daf8f6ba3def7d432.jpg
208174832096,1750523137,1,386361399,0,0,0,0,0,1707985481,0,,,插兜兜害人！以后都不许揣兜兜！,,,,False,4,保密,,知白守黑08,http://i0.hdslb.com/bfs/face/member/noface.jpg
208739325280,1750523137,1,71595170,0,0,0,0,0,1708274461,0,,,你们当年这是这么指责退赛的刘翔的，你们给刘翔道歉了吗？,,,,False,6,男,过年期间停更，等三月破站奖励出来以后复更,街机就要一币通关,https://i2.hdslb.com/bfs/face/cc271cd6f5a915b43cdd072047c90ae64685a346.jpg
208428790976,1750523137,1,476720166,0,0,0,0,0,1708121350,0,,,签洗白合同了,,,,False,6,保密,佛系up,维多利亚的树袋熊,https://i0.hdslb.com/bfs/face/55a6ed9510307062e19834de2560fd673892ce83.jpg
208461314736,1750523137,1,11366793,0,0,0,0,0,1708143153,0,,,过失杀人也是杀人，你有一万种理由来粉饰这个过失，但是事实就是无论这件事起因是什么，最终的结果就是香港行和日本行的双标。不好的影响已经造成了，现在不是一句，你梅西是个什么样的人就可以让人原谅的。甚至于梅西本人都没有出来亲自端水。你何必还帮梅西洗呢？,,,,False,6,男,2020.10.11开始戒烟,拉黑虽然可耻但是好用,https://i0.hdslb.com/bfs/face/7bf8b339f36687d41f14c4aaad8dae55f925f271.jpg
208261694848,1750523137,1,21025661,0,0,0,2,2,1708021110,0,,,洗地的还是反串的？[滑稽],[滑稽],,,False,4,保密,,beich9,https://i2.hdslb.com/bfs/face/29ca03ccae20ac2ffeacfda471298490cafa4a4d.jpg
208261644992,1750523137,1,21025661,208261694848,208261694848,208261644992,0,0,1708021153,3,,,AI配的音啊，真实的声音都不是，明显的洗地的太监[笑哭],[笑哭],,,False,4,保密,,beich9,https://i2.hdslb.com/bfs/face/29ca03ccae20ac2ffeacfda471298490cafa4a4d.jpg
208407792768,1750523137,1,13939832,208261694848,208261644992,208261644992,0,0,1708099787,0,,,回复 @beich9 :自问自答的你像个小丑,,beich9,21025661,False,5,男,,来自楚科奇的恶魔,https://i0.hdslb.com/bfs/face/member/noface.jpg
208165002240,1750523137,1,1951632,0,0,0,0,0,1707980836,0,,,4分钟前,,,,False,6,保密,,echoRa,https://i0.hdslb.com/bfs/face/member/noface.jpg
208164485680,1750523137,1,415271341,0,0,0,0,0,1707980558,0,,,第一,,,,False,5,男,,已焰丁真-落山机糊人,https://i1.hdslb.com/bfs/face/350a8cce9a523905f147f5620bbcc4f2d916fd24.jpg
208260267936,1750523137,1,221040243,0,0,0,3,2,1708019942,0,,,希望人迷尽量珍惜还能打出主子名字的机会😋,,,,False,4,保密,,hsudhfj,https://i0.hdslb.com/bfs/face/09b6b9e6369f4934ff698d8aa747ae07ecef8880.jpg
208309029344,1750523137,1,26324253,208260267936,208260267936,208309029344,0,0,1708060024,7,,,我的评价是真别太爱叫，跟你du1000梅西不被封杀，敢吗？没个影的事给你说的和板上钉钉一样，装个锤子,,,,False,5,男,我叫景无,景虽美，无人赏,https://i0.hdslb.com/bfs/face/ed2c9df24f653a59bbbff6c71afbc0505697187f.jpg
208293243584,1750523137,1,43512668,208260267936,208260267936,208293243584,0,0,1708053457,3,,,意思你以前迷的是272吗？,,,,False,6,男,人生无他求，但壶中有酒，掌中有剑，枕边有书，足矣,追忆丶君莫笑,https://i2.hdslb.com/bfs/face/f07cd664853a5e2dd17db7a87beb6d5dcbc19d9a.jpg
208164565024,1750523137,1,471684341,0,0,0,0,0,1707980575,0,,,第二[吃瓜],[吃瓜],,,False,5,男,,飞鱼小丸子_,https://i2.hdslb.com/bfs/face/601ee473906b0ad186c04fbc242e19df7983eaa1.jpg
208223760464,1750523137,1,289863769,0,0,0,0,0,1708004347,2,,,不是这也能洗啊,,,,False,5,男,,情话Lovewords,https://i1.hdslb.com/bfs/face/58745e2c94e3f6f3a16050bd699e6d58d3b9bade.jpg
208233255264,1750523137,1,43249447,0,0,0,0,0,1708007756,2,,,吆西吆西，诈骗辱华犯跪下!,,,,False,5,保密,尔曹身与名俱灭，不废江河万古流,你問西湖水,https://i1.hdslb.com/bfs/face/7f8d9752e8b9cacf4d779cc105bc5a026817eb0e.jpg
208236289968,1750523137,1,8530666,0,0,0,0,0,1708008826,2,,,你什么冠军，配帮霉閪说话？[doge],[doge],,,False,6,男,,砧板上的骆驼,https://i1.hdslb.com/bfs/face/519c036787544c1e801d5f4fb40e76a0b12e3c2c.jpg
208173198368,1750523137,1,134687,0,0,0,0,0,1707984777,0,,,[妙啊]评论区好多小号呀,[妙啊],,,False,6,男,,减肥穿衬衫,https://i2.hdslb.com/bfs/face/6281ea0fc319969aefe380efa6e28876f1994faa.jpg
208165178288,1750523137,1,574005586,0,0,0,0,0,1707980968,0,,,[打call],[打call],,,False,5,男,"这条白兰寿的特别在于:
2022年阿根廷战胜法国夺得世界杯冠军，点球大战时我对着它祈祷如果阿根廷夺冠我讲给它最好的照顾。",结晶48,https://i1.hdslb.com/bfs/face/220804728466c62f514d60dc58b829bda661595c.jpg
208250163760,1750523137,1,1382758655,0,0,0,0,0,1708014071,0,,,哟西，你滴大大滴孝顺,,,,False,5,男,軀體有盡時，靈魂無絕期,Gesetz_Q,https://i2.hdslb.com/bfs/face/f196cd6bdea3ae10310e8052160fc35c6a7f6ee8.jpg
208917842208,1750523137,1,270306139,0,0,0,2,0,1708379537,43,,,"我熟读读者三十年，理中客们教育了我:中国人去了国外要尊重当地的习俗文化。
今天假老师教育了我:外国人来了中国，中国要理解尊重外国人的习惯，双手插兜不代表不尊重，只是他的习惯性动作，不要想太多。
其实梅西这事我只是有点疑惑而已，现在假老师已经给我把道理讲清楚了，再提这事就是被舆论带节奏，自己不会独立思考。我深刻反思了半天，觉得假老师说的太对了。三十年来反思过无数次的我，还是得继续保持。这是个终生收益的好习惯，活到老，反思到老。我的儿子也十岁了，也要培养他反思的好习惯。
最后我作为中立球迷，能不能中立的替C罗说句话，梅西事件，你揶揄C罗干什么。[吃瓜]",[吃瓜],,,False,6,保密,手里的回旋镖就像南云的鱼雷和炸弹胡乱堆积，一时间竟不知用哪个好[笑哭],高空高速截击机,https://i1.hdslb.com/bfs/face/5e89ea6db89b2b4ae92f3b2980b013cbc356091c.jpg
208894817744,1750523137,1,504438980,0,0,0,0,0,1708357827,3,,,终于找到角度了，呦西,,,,False,3,保密,一个人要多优秀才能成为诸葛亮？,天怒法师扎贡纳斯,https://i2.hdslb.com/bfs/face/ffa378072f623911814bab431f9abafdfdf26225.jpg
208831030704,1750523137,1,543868551,0,0,0,0,0,1708334583,2,,,诸如跪下!,,,,False,5,保密,,幽默老p,https://i0.hdslb.com/bfs/face/3db325857ddb9beb199f0076c6dfecadf6683a94.jpg
208787879408,1750523137,1,619550742,0,0,0,0,0,1708316051,6,,,千万不要忘了,,,,False,5,保密,你好，查我身份的儒结晶。,里奥梅閪,https://i0.hdslb.com/bfs/face/a0ec265c08578870a48685a6708be1f5a6b7675e.jpg
208745590272,1750523137,1,381718594,0,0,0,0,0,1708278051,11,,,哟西万岁🎉🎉,,,,False,4,保密,,甜菜大神,https://i1.hdslb.com/bfs/face/c528d489a1e7ccf418cf1ff1590be6f883600685.jpg
208693481136,1750523137,1,1568619435,0,0,0,2,2,1708257803,30,,,有理有据，客观事实。 C罗有问题，纯属个人原因，绝无其它理由。 梅西有问题，大家太片面了，应该全方位多角度分析问题的根本，做的所有都是有理有据，大家太偏激了[滑稽],[滑稽],,,False,5,保密,,逍遥醉清风777,https://i0.hdslb.com/bfs/face/656ef2bf6164926402e91dbf367821eb15745307.jpg
210604061984,1750523137,1,1568619435,208693481136,210572131120,210572131120,0,0,1709347284,0,,,回复 @勿扰嗷z : 我去 还有霉子霉孙呢[吃瓜] 不滚回你的岛国？,[吃瓜],勿扰嗷z,450187068,False,5,保密,,逍遥醉清风777,https://i0.hdslb.com/bfs/face/656ef2bf6164926402e91dbf367821eb15745307.jpg
210572131120,1750523137,1,450187068,208693481136,208693481136,210572131120,0,0,1709312313,0,,,那么请你解释罗三脚问题，列出你的依据[doge],[doge],,,False,5,保密,放弃助人情结 尊重他人命运,勿扰嗷z,https://i0.hdslb.com/bfs/face/a07e550243b65a86c81721238371fa34f58f9bc9.jpg
208631261344,1750523137,1,286946229,0,0,0,2,0,1708232704,0,,,"球王，是一个果位，不是一个职务！梅西修成了正果，所以得到了球王的荣耀！

这是他历经磨难修来的，所以即便他不想要，别人也得不到！一朝加冕，即是永远！

就像悟空成了斗战胜佛，他已经与这个称号融为一体！因为足球的世界，需要球王！

里奥梅西，就是这个时代的天命球王！

一切诽谤抹黑，还有ZZZQ带来的流量审判，正如长舌村妇的咒骂，看似凶猛恶毒，但终将破灭！

梅西球迷们，你们必须坚定自己的心，在这至暗时刻站出来，支持这个带给你们圆满青春的男人！

不要畏惧，更不要怀疑自己曾经的选择！因为你们的身后，有全世界数以亿计的梅粉同袍！

还有一颗已经在绿茵场上勇敢了二十多年的心!更有——大力神杯的万丈光芒！",,,,False,5,保密,,梦魇骑士117,https://i0.hdslb.com/bfs/face/af239f7145ebe7fa0cdfe52b0742bd0916e86b08.jpg
208587338528,1750523137,1,423774877,0,0,0,15,9,1708201249,25,,,再说一下霍启刚为什么生气？如果我是一个想为香港普通球迷，市民争取利益的官员的话，我也会很生气，因为香港和各地球迷为了迎接这场比赛和梅西确实花了很多钱和精力。维多利亚港的帆船广告是实打实的，媒体铺天盖地的宣传广告也是事实。在这种情况下，作为明星球员不出场本来就已经惹了众怒，虽然说合同规定可以因伤不上场，但是告知的也太晚了点儿吧，既然说晚了，那就态度诚恳点儿道歉，想办法补偿球迷，多做些跟球迷亲和的互动，或许也能挽回一些局面。当然按照up主的态度，这是主办方和迈阿密球队的问题，不应该责怪到梅西身上，但是这点我是完全支持霍启刚的，因为这件事情本来的由头就是因为有梅西来，迈阿密和主办方跟梅西的声望无法相提并论。如果梅西不出来用诚恳的表态来安抚球迷，那是无论如何都过不了关的，这是中国人看来再普通不过的道理。,,,,False,4,男,,大菠萝zhi,http://i0.hdslb.com/bfs/face/member/noface.jpg
208636492928,1750523137,1,1773933027,208587338528,208587419952,208587419952,0,0,1708234731,15,,,回复 @大菠萝zhi :身体不适，然后过了三天去日本生龙活虎是吧，什么大日本医疗技术,,大菠萝zhi,423774877,False,3,保密,,安静路过看,https://i0.hdslb.com/bfs/face/88300e8e28d48a3f8a752c2b421ccebbfe412f20.jpg
208708629568,1750523137,1,425428091,208587338528,208705741488,208587419952,0,0,1708263236,10,,,回复 @悲伤的大狗狗 :原文发来？那这样为什么不全款退钱？,,悲伤的大狗狗,279621263,False,6,保密,"所有的战争宣传，所有的叫嚣、谎言和仇恨，都来自那些不上战场的人。
————乔治·奥威尔",fluteeee,https://i2.hdslb.com/bfs/face/f5ae249dc7c6d3f013a2b87aa3f326e38972613e.jpg
208685154704,1750523137,1,425428091,208587338528,208660750320,208587419952,0,0,1708254774,10,,,回复 @悲伤的大狗狗 :那俱乐部怎么不提前一天说？大腿受伤影响声道了？,,悲伤的大狗狗,279621263,False,6,保密,"所有的战争宣传，所有的叫嚣、谎言和仇恨，都来自那些不上战场的人。
————乔治·奥威尔",fluteeee,https://i2.hdslb.com/bfs/face/f5ae249dc7c6d3f013a2b87aa3f326e38972613e.jpg
208459097712,1750523137,1,9005367,0,0,0,0,0,1708142255,1,,,支持up主，支持梅西,,,,False,5,男,爱水果派的蛋黄派！,应该能反杀,https://i0.hdslb.com/bfs/face/07789384eb2c7b660d34f34c53e0e2d834cc70a4.jpg
208407994048,1750523137,1,13939832,0,0,0,0,0,1708099893,0,,,对了，前段时间，有个事情，c罗球迷冲酒店的时候为啥要骂中国国家队呀,,,,False,5,男,,来自楚科奇的恶魔,https://i0.hdslb.com/bfs/face/member/noface.jpg
208394380320,1750523137,1,50255761,0,0,0,4,1,1708094748,1,,,BV1bS421K7MX,,,,False,6,保密,,七海观澜,https://i1.hdslb.com/bfs/face/003dfd3fba69d7992ea2828085b07e07ea6740b0.jpg
208394455248,1750523137,1,50255761,208394380320,208394380320,208394455248,0,0,1708094763,0,,,自己看看呗,,,,False,6,保密,,七海观澜,https://i1.hdslb.com/bfs/face/003dfd3fba69d7992ea2828085b07e07ea6740b0.jpg
208365703616,1750523137,1,4222728,0,0,0,8,6,1708084213,27,,,"如果只以合同说事，up的观点没啥问题，但是问题是感官感觉问题，网友认可梅西或者否认梅西，这都是感觉，包括球迷喜欢梅西也都是因为感觉，[脸红]这是我的核心观点，如果不认可这个“感观”核心的，可以有理有据的反驳我。
既然喜欢与不喜欢是“感觉”为王。我们这些没有买票的，没有利益冲突的，合同如何，与我们没有关系。
梅西作为一个公众人物，自己应该做好维护形象和大众的“感觉”，他不是一个人，他也有团队，我不相信梅西就靠一个“我行我素”就可以完全不用顾虑形象，与粉丝的“感觉”。
这次香港梅西事件，很明显就是梅西给现场球迷的“感觉”很不好。事后发酵也是“纵容”的态度根本没有在乎中国球迷的“感觉”。那么一个公众人物让我们“感觉”不好了，我们为什么不能抵制他？[OK]
广大网友不能因为几个死忠的“没膝”就让惯着自己感觉不好的人吧？毕竟中立的非球迷的网友还是多的，梅西前面还能下场，后面也能下场，就到了中国不能下场有伤，说拿合同说事？我承认从法律和公理上梅西没有问题，但是从网友的“感觉”上就是有问题，更别说到了日本还和牛郎热情见面。
我说了核心就是“感觉”喜欢一个人是“感觉”不喜欢也是“感觉”，梅西可以我行我素，但是广大网友也可以因为他这次的“我行我素”而讨厌抵制他，这不冲突，这和他的合同是否合理不冲突。他的合同只能作为，他的不出场的合理性，但是不能让他对中国粉丝“感觉”不好的合理性。
这就好像，某艺人，去看了站台了一些我们网友“感觉”不好的秀。广大网友就主动封杀他一样。他可能也有和同学啊，他也是“我行我素”呀！和抵制他冲突么？[OK][OK][OK][OK]",[OK] [脸红],,,False,6,男,,西方生命,http://i0.hdslb.com/bfs/face/fcc5e7a160ebe73ea3244ed6b4e3edcd86c62d5c.gif
208441816544,1750523137,1,7830132,208365703616,208365703616,208441816544,0,0,1708134474,9,,,部分香港球迷自己都站出来谴责营销号曲解自己意思了，抛开当事人谈“感觉”不觉得搞笑么，凭“感觉”就能肆无忌惮地伤害刘翔，苏炳添等等数不尽的运动员么，就能肆无忌惮地拿民粹给别人扣帽子么，这就是中国的体育环境和素质？,,,,False,6,男,浮生若梦，为欢几何,Spikex_,https://i0.hdslb.com/bfs/face/f252c159e58fcad853d4cfe845a5f713fa0736a8.jpg
208436494624,1750523137,1,2063892083,208365703616,208365703616,208436494624,0,0,1708131285,4,,,讲个笑话，这个视频没提合同,,,,False,4,保密,伤感小丑,沉默伺只因,https://i2.hdslb.com/bfs/face/746bb42a20a8f5d5532ec2bfc3a307a0bc1fe081.jpg
208906674400,1750523137,1,7830132,208365703616,208744943600,208744943600,0,0,1708363519,2,,,回复 @big大梁 :所以说为什么说你就是那种听风就雨营销号说什么就信的，我已经说了你不会自己去看？那几个在媒体面前发言失望和说你对得起我们吗的，高呼退票有什么问题吗？不该退票吗？立牌被踢飞后面还有好心球迷去修复你不知道？,,big大梁,338238079,False,6,男,浮生若梦，为欢几何,Spikex_,https://i0.hdslb.com/bfs/face/f252c159e58fcad853d4cfe845a5f713fa0736a8.jpg
208319310320,1750523137,1,351468443,0,0,0,0,0,1708064531,0,,,可惜网络上的一群喷子感觉是看到新大陆了，特别是结晶们,,,,False,4,保密,,陆个七,http://i0.hdslb.com/bfs/face/member/noface.jpg
208296631072,1750523137,1,1805653733,0,0,0,1,0,1708054976,5,,,呦西好厉害,,,,False,3,保密,,蜗牛见面,https://i2.hdslb.com/bfs/face/b97a423738909a6843046038056766e6f084bb8d.jpg
208281720672,1750523137,1,383133907,0,0,0,0,0,1708047957,3,,,“投名状”最可笑，他这个级别的需要投名状么,,,,False,5,保密,,zx嘴巴嘟嘟,http://i0.hdslb.com/bfs/face/member/noface.jpg
208260584464,1750523137,1,294805,0,0,0,2,1,1708020212,5,,,已经成为巨大的信息茧房了，外网尤其是ig霍公子已经被香港人骂飞了，也就这边舆论完全不一样,,,,False,6,男,唯不争天下莫能与之争,ダークライ,http://i1.hdslb.com/bfs/face/d38b9729fcff0662e5e52167b7f8fc8c761930f5.jpg
208293229184,1750523137,1,43512668,208260584464,208260584464,208293229184,0,0,1708053436,0,,,战狼卖56亿，最不缺的就是土壤,,,,False,6,男,人生无他求，但壶中有酒，掌中有剑，枕边有书，足矣,追忆丶君莫笑,https://i2.hdslb.com/bfs/face/f07cd664853a5e2dd17db7a87beb6d5dcbc19d9a.jpg
208252570928,1750523137,1,20412286,0,0,0,0,0,1708015176,11,,,有理有据 令人哟西[doge],[doge],,,False,6,保密,,好土的名纸,https://i1.hdslb.com/bfs/face/541b0e273061896bc0231f0545c5bf298dd53632.jpg
208248864624,1750523137,1,252590008,0,0,0,11,8,1708013563,2,,,"央视已经删掉了梅西夺冠的镜头，换上了德国夺冠的镜头[吃瓜]
杭州拒绝，北京否认和阿根廷队的友谊赛。
这就是官方的态度。",[吃瓜],,,False,5,保密,,尼罗粉2,http://i1.hdslb.com/bfs/face/e87b396074ead5e27a07de39e4ee809b94696f09.jpg
208255030064,1750523137,1,234074411,208248864624,208248864624,208255030064,0,0,1708016528,4,,,北京真没定，但是拉姆真干了[嗑瓜子] 原来官方的态度就是同意繁花言论,[嗑瓜子],,,False,6,男,"he feels deeply, he feels tenderly.",副导演meiko,https://i2.hdslb.com/bfs/face/f1ecdeff552a225d050cd572d0b7906264675fed.jpg
208354574032,1750523137,1,234074411,208248864624,208331662656,208255030064,0,0,1708079994,2,,,回复 @尼罗粉2 : 你不会以为菲利普·拉姆就没有辱华举动吧？就和你说的，渠道畅通，但凡动动你的小手搜一搜，就知道相关的新闻，不是一个拉姆反华另一个就不会，把你的非黑即白的理论收一收,,尼罗粉2,252590008,False,6,男,"he feels deeply, he feels tenderly.",副导演meiko,https://i2.hdslb.com/bfs/face/f1ecdeff552a225d050cd572d0b7906264675fed.jpg
208260566992,1750523137,1,294805,208248864624,208248864624,208260566992,0,0,1708020167,1,,,这才是最离谱的，拉姆才是繁华，他居然换了，真就离谱,,,,False,6,男,唯不争天下莫能与之争,ダークライ,http://i1.hdslb.com/bfs/face/d38b9729fcff0662e5e52167b7f8fc8c761930f5.jpg
208244772336,1750523137,1,293669213,0,0,0,6,6,1708011927,12,,,终于知道真相了，这些媒体太可恶了，捕风捉影带节奏，谢谢up我还是会支持里奥哟西[奋斗],[奋斗],,,False,5,保密,"pvz无炮三级玩家
喜欢医学，自然科学，语言时政，科幻象棋，pvz红警 欢迎交流",梅屿湾,https://i2.hdslb.com/bfs/face/ec028cf1ce8fc750f22dc33b5cdc0df3cd925ac6.jpg
208321036512,1750523137,1,432662752,208244772336,208244772336,208321036512,0,0,1708065387,2,,,跟上一条重复了，这条不算钱,,,,False,5,女,雪与后来,斑驳陆离的夏天,https://i1.hdslb.com/bfs/face/0d04c6789f581927022e1759b0c0eb3a828e8a9e.jpg
208261742896,1750523137,1,31593998,208244772336,208244772336,208261742896,0,0,1708021236,1,,,刀收不住了， 厚葬！,,,,False,6,保密,为什么要做梦？为啥要幻想？,伊傅丶,https://i2.hdslb.com/bfs/face/5ec17c8274a22a19d6fa4247eb3a6a7e9c79d336.jpg
208900542640,1750523137,1,510406104,208244772336,208244772336,208900542640,0,0,1708360233,0,,,发现柯南粉脑子不好好像挺普遍,,,,False,4,男,真真假假假假,_lelouch-_,https://i0.hdslb.com/bfs/face/7f59e150495ddbd8d3c825572ee3e4ff03860b56.jpg
