rpid,oid,type,mid,root,parent,dialog,count,rcount,ctime,like,plat,device,content,emote,at_uname,at_mid,invisible,level,sex,sign,uname,avatar
207384759040,1950358984,1,37070239,207376908992,207376908992,207384759040,0,0,1707545667,16,,,我最好的哥们现在还挺梅西，不过没事，朋友永远是朋友，不影响，哈哈。毕竟这个时间段还能坚持喜欢梅西的，那确实说什么也没用了。,,,,False,5,保密,,法杖西来-,https://i1.hdslb.com/bfs/face/fa29a718bbbddd26938b89d0809bcbac88e57263.jpg
207422927824,1950358984,1,34204585,207376908992,207376908992,207422927824,0,0,1707563437,5,,,习惯就好，09 年开始看球，学生时代还有很有各家球迷的同学朋友，一毕业工作，立刻被哟西球迷包围了，全他妈哟西球迷[笑哭]去年新入职了一个可怜的曼联球迷，我可高兴了,[笑哭],,,False,6,保密,,吃最补唐僧,http://i1.hdslb.com/bfs/face/116f3ccf98f643747494900c84a32d826d63a794.jpg
207407874800,1950358984,1,108958120,207376908992,207376908992,207407874800,0,0,1707557098,5,,,你问他足坛有什么人他能说出来么，都是些世界杯看看球的货,,,,False,6,保密,,欧阳振飞,http://i1.hdslb.com/bfs/face/b862efdd8e683b6f0529bdd9cba154eed52bbfce.jpg
207374118992,1950358984,1,93300548,0,0,0,15,7,1707540976,4,,,我19年看的球，当时利物浦双冠还是三冠，而梅西在巴萨也仅仅是一个西甲冠军和一个没啥含金量的杯赛。那年范戴克荣誉满身，基本上满贯了。然后金球奖就给了梅西，我当时就讨厌上他了。我不喜欢利物浦而且我最开始看球也喜欢巴萨和梅西，后来看到巴萨和切尔西09欧冠我就更恶心巴萨了，一直对梅西没啥感觉，就一直觉得是人造球王还嗯吹,,,,False,6,保密,喜欢足球篮球，足球只看英超，主队曼联,Forgetable透明,https://i2.hdslb.com/bfs/face/c85c57c4383dd48d0476909bbfa5be43573cca64.jpg
207374233296,1950358984,1,93300548,207374118992,207374118992,207374233296,0,0,1707541063,1,,,fifa的评分每次都给梅西最高，梅西干什么媒体都宽容他给他营销，这样是真没意思了,,,,False,6,保密,喜欢足球篮球，足球只看英超，主队曼联,Forgetable透明,https://i2.hdslb.com/bfs/face/c85c57c4383dd48d0476909bbfa5be43573cca64.jpg
207391941312,1950358984,1,93300548,207374118992,207391167232,207374233296,0,0,1707549248,0,,,回复 @ii隐藏的深 :我很好奇就是你对任何一个足球视频都有人刷阿韦罗跪下这一点你怎么看待的？,,ii隐藏的深,488588965,False,6,保密,喜欢足球篮球，足球只看英超，主队曼联,Forgetable透明,https://i2.hdslb.com/bfs/face/c85c57c4383dd48d0476909bbfa5be43573cca64.jpg
207391786080,1950358984,1,93300548,207374118992,207391167232,207374233296,0,0,1707549139,0,,,回复 @ii隐藏的深 :好的，梅西八个金球奖，梅西是2022世界杯冠军得主，这是事实吧？开心了吧,,ii隐藏的深,488588965,False,6,保密,喜欢足球篮球，足球只看英超，主队曼联,Forgetable透明,https://i2.hdslb.com/bfs/face/c85c57c4383dd48d0476909bbfa5be43573cca64.jpg
207427471280,1950358984,1,2108747771,0,0,0,1,0,1707565240,2,,,其实足球早变味了。已经沦为政治和赌场的玩物，VR各种明黑。梅西就是一个踢球的玩意，花钱当娱乐看看就算了，总有一些人花钱还帮他当爹跪着看。一群丢人玩意的东西。我篮球很早没看了，现在足球也看着没多大意思，没有当年有味道了，还不如早睡早起去按摩。.,,,,False,4,保密,,美国队长牢大,https://i2.hdslb.com/bfs/face/cc42e7b70610c697a87f1aa1bc9b6c33a6e53c0b.jpg
207547508576,1950358984,1,2032166227,0,0,0,0,0,1707637749,2,,,吃相不要太难看了,,,,False,4,保密,,唯可止心驭,https://i1.hdslb.com/bfs/face/39528641b8d1a509f83ad60d5ce847f6707a53e9.jpg
207389675648,1950358984,1,348646891,0,0,0,11,11,1707548121,2,,,牛啊，范戴克都服，你们不服，尤文跟利物浦都记串，好意思说“死忠”[辣眼睛]看来这点流量是非跟不可啊[疑惑],[疑惑] [辣眼睛],,,False,6,男,,Elast1c0,https://i1.hdslb.com/bfs/face/9a955f7c4800a2912e0e4a45d20bac43a23452ce.jpg
207490995792,1950358984,1,8940603,207389675648,207408023968,207389998768,0,0,1707607397,1,,,回复 @专注掉节操30年 :这会儿又范加尔了，范加尔说阿根廷保送，荷兰不也在保送阿根廷，那假球一号就应该是他自己啊,,专注掉节操30年,685772,False,6,男,已遁入空门,虚无法师爆破天才,https://i0.hdslb.com/bfs/face/e151aa2b371205ee24f710330138c3c8d83251e5.jpg
208434886656,1950358984,1,13905159,207389675648,208425999952,207389998768,0,0,1708130104,0,,,回复 @Elast1c0 :我可以喷，我也可以不喷，但是梅西是偷了，况且我不喷人,,Elast1c0,348646891,False,6,保密,凝视黑暗,监视黑暗,https://i0.hdslb.com/bfs/face/17af83d630ef947b2ed1099140b06b434330e333.jpg
208425999952,1950358984,1,348646891,207389675648,208269561872,207389998768,0,0,1708114010,0,,,回复 @监视黑暗 :笑了，那你去喷范戴克虚伪吧,,监视黑暗,13905159,False,6,男,,Elast1c0,https://i1.hdslb.com/bfs/face/9a955f7c4800a2912e0e4a45d20bac43a23452ce.jpg
207550348288,1950358984,1,512131,0,0,0,16,16,1707639120,16,,,"我算是个伪球迷，只看冠军决赛的那种，最喜欢的球员应该是卡卡，后面的其实都没太所谓
不过有一点，我是个游戏迷，那段时间沉迷实况，经常跟朋友开，但玩的不好，玩实况的时候，梅西给我的感觉就不是那种能C的选手，不像C罗，我这种新手用都感觉出游戏给的数据从身体和速度上，都很厉害
后来时不时的看一些冠军赛，梅西在决赛里的表现就是那种，比顶级球员好那么一点，但离真正的C位差口气的感觉，至于拿奖我到不清楚，毕竟我一个伪球迷也不知道具体数据",,,,False,6,男,,華爾裘蕾,http://i1.hdslb.com/bfs/face/572b7faf2eb0e0883b3401158bf44a59d1a8f753.jpg
207551602000,1950358984,1,512131,207550348288,207550348288,207551602000,0,0,1707639758,3,,,补充一下，后面喜欢的是罗纳尔迪尼奥，也主要是游戏的感觉来的，就是那种明显牛逼的球员，不过小罗堕落的太快了，好可惜,,,,False,6,男,,華爾裘蕾,http://i1.hdslb.com/bfs/face/572b7faf2eb0e0883b3401158bf44a59d1a8f753.jpg
209105508944,1950358984,1,512131,207550348288,209105409168,208609635264,0,0,1708482170,1,,,回复 @我厂未崩 :啥呗，人话都看不懂,,我厂未崩,435903823,False,6,男,,華爾裘蕾,http://i1.hdslb.com/bfs/face/572b7faf2eb0e0883b3401158bf44a59d1a8f753.jpg
209862453536,1950358984,1,512131,207550348288,209845900224,209790172576,0,0,1708864938,0,,,"回复 @吕七忧人拜年球王 : 我说我的直观感受，你来表现你很懂球，你是不是真懂我不清楚，反正你一点懂性都没表现出来，话也说不清楚
给你个建议，你可以自己开个视频说梅西有多C，然后你去跟评论区对喷，喷赢了我就认为你说得对",,吕七忧人拜年球王,205424223,False,6,男,,華爾裘蕾,http://i1.hdslb.com/bfs/face/572b7faf2eb0e0883b3401158bf44a59d1a8f753.jpg
207489498720,1950358984,1,484440405,0,0,0,0,0,1707604066,2,,,讲得真好😘,,,,False,5,保密,,boraLu27,https://i0.hdslb.com/bfs/face/6be566210db1a9e91cdd777a0889dfd4ffe5df0e.jpg
207579717328,1950358984,1,226851106,0,0,0,0,0,1707651870,2,,,还好我从来对没戏不感冒。拜仁和尤文才是主队。二娃粉丝,,,,False,5,保密,,何慕清水郎,http://i1.hdslb.com/bfs/face/0915c51a156e9c821cc35570e554c124b85584d5.jpg
207870680912,1950358984,1,16016040,0,0,0,0,0,1707817938,2,,,退坑足球？恰流量？,,,,False,5,保密,不看消息的杠精,活在梦中梦的梦里,https://i0.hdslb.com/bfs/face/13f570504b18a70f5fb5ed9f1f098cd83494ae55.jpg
207397926864,1950358984,1,17520085,0,0,0,11,6,1707552253,6,,,[笑哭]不是，怎么越分析越觉得像詹姆斯了？,[笑哭],,,False,5,女,,梅惜熙,http://i1.hdslb.com/bfs/face/154a05b1f5f06f81885dc5045ab5b1b02e9e3f6b.jpg
207400143504,1950358984,1,176811637,207397926864,207397926864,207400143504,0,0,1707553424,4,,,摊子起码常规赛MVP实打实带队打出来的，呦西怎么比?[疑惑],[疑惑],,,False,5,保密,,_沧海横流_,http://i1.hdslb.com/bfs/face/101324184b5af81ac2bae70e4ae7f448350e7d0f.jpg
207561235680,1950358984,1,416864665,207397926864,207397926864,207561235680,0,0,1707644225,1,,,"路人，不是听说，老詹对中国球迷场面不输的
不是能被黑脸碰瓷[吃瓜]",[吃瓜],,,False,6,男,注意形象，保持风度,无风无浪无语无情,http://i1.hdslb.com/bfs/face/d59a3545e1922f219629e90a1c0b7e3bca7e0b86.jpg
207449945344,1950358984,1,97159869,207397926864,207397926864,207449945344,0,0,1707573858,1,,,不是库里梅西绑定吗，建议继续绑定锁死,,,,False,5,保密,,带鱼亦是刀鱼,https://i0.hdslb.com/bfs/face/member/noface.jpg
208863850128,1950358984,1,622414321,0,0,0,0,0,1708346892,2,,,？？？哈兰德上个赛季踢这么好都没进球，呦西算个啥啊,,,,False,4,男,若给你一块木头，你可以去选择慢慢腐烂，也可以选择熊熊燃烧；曾经以为，拥有是不容易的；后来才知道，舍弃更难。,老江城,https://i1.hdslb.com/bfs/face/91158faed327c8c1b6a32cebb6e0e12be0f9ec1b.jpg
207610003328,1950358984,1,27094725,0,0,0,0,0,1707663570,2,,,这次世界足球先生简直太可耻了,,,,False,5,保密,,QueenStella,http://i0.hdslb.com/bfs/face/member/noface.jpg
207631282976,1950358984,1,176017899,0,0,0,1,1,1707674132,3,,,真的是人工授金的球王，起码偷了五个金球奖，世界杯全是点球有鸡毛说服力？欧冠你梅西什么垃圾玩意还需要多说吗？不过是有点实力的关系户罢了，喜欢阿根廷的正常人，都认为迪马利亚比梅西强吧？营销太厉害了，真是乌烟瘴气，一边打压C罗，一边吹捧梅西，你就说，球员里面喜欢梅西多还是喜欢C罗多？不要用水分极大的荣誉来捧一踩一，弱智吗？,,,,False,5,保密,今天我中奖了吗？,韭菜陈陈,https://i0.hdslb.com/bfs/face/66d51e40d8a879e8015395f4277b5bc7056ab762.jpg
207636173216,1950358984,1,14242866,207631282976,207631282976,207636173216,0,0,1707680294,0,,,嗯,,,,False,4,男,,Ganc,https://i0.hdslb.com/bfs/face/032935b48f669898830498a180a994b92fc3d979.jpg
207365704144,1950358984,1,28584648,0,0,0,1,1,1707537524,2,,,作为一个不喜欢双娇的球迷，每次发表不支持其中一人的言论就会被定义为对方的结晶，真是烦死这两人了[辣眼睛],[辣眼睛],,,False,6,保密,关关难过关关过 前路漫漫亦灿灿,踢风寻宝到处寻宝,https://i0.hdslb.com/bfs/face/476b92f442585dcbc22c4d482d973dc8645749d0.jpg
207366203952,1950358984,1,224662314,207365704144,207365704144,207366203952,0,0,1707537734,0,,,仿佛世界上只有他俩踢球,,,,False,6,男,,-_-鬼畜区我来了,https://i0.hdslb.com/bfs/face/7970d7de9eb62b6d6c2efa09c8f79442be35c804.jpg
207460704016,1950358984,1,641342,0,0,0,0,0,1707577857,3,,,"梅西出道在巴萨罗那就已经知道是个小丑了。普拉蒂尼干爹在的时候直接偷了4个欧冠，干爹没了一次欧冠决赛都没进过，更多的是惨案。
阿根廷能拿美洲杯和世界杯靠的是天使迪玛利亚，关你个侏儒什么事。
我也喜欢阿根廷，但我喜欢的是克雷斯波，巴蒂斯图塔。梅西这个西班牙杂种小偷也配。",,,,False,6,保密,,castiello,http://i0.hdslb.com/bfs/face/member/noface.jpg
207498683392,1950358984,1,3221123,0,0,0,0,0,1707614280,2,,,全部奉还还是他自己上升到国家层面 不然在群众眼里他还是“神” 反而是理智粉退坑,,,,False,6,男,,爱喝橙子汽水,http://i0.hdslb.com/bfs/baselabs/eaefa889e917a73dfd290c500a3713187d618f51.png
207360001008,1950358984,1,384620288,0,0,0,0,0,1707535094,5,,,推荐up主看英超，就看强强对话，好看的,,,,False,6,保密,,b海风,https://i2.hdslb.com/bfs/face/e3392b0206e8025d9c336b006c1fb421b6f16cd2.jpg
207658678800,1950358984,1,14411734,0,0,0,3,2,1707706116,2,,,我18年入坑足球，粉上巴萨和梅西，19年被逆转后，开始黑梅西，后面喜欢上了C罗，至今一直在黑梅西。,,,,False,6,男,我只喜欢过一个人,年迈的萝莉,https://i1.hdslb.com/bfs/face/53182530a2f9523c0b2945c7c3cbc5266b699761.jpg
208747677408,1950358984,1,26508587,207658678800,207658678800,208747677408,0,0,1708279728,0,,,理由绝了,,,,False,6,保密,,土豆零九零,http://i2.hdslb.com/bfs/face/aa208452ebebd31e6d95abd90c03c2c206668fb9.jpg
208273392160,1950358984,1,258091830,207658678800,207658678800,208273392160,0,0,1708042171,0,,,被逆转就开始黑？,,,,False,5,男,,殇不患呀,https://i0.hdslb.com/bfs/face/98c131aab1278658924a26de5d5250e48ed0c89a.jpg
207401025904,1950358984,1,3494358407973317,0,0,0,12,10,1707553844,124,,,大多数人会喜欢c罗而不是梅西是因为真正了解这两个人的经历就知道，c罗是靠自律的品格，逆境中的坚韧一步步走来的，之前就有c罗想要拿金球比其他人难得多，而梅西就是资本捧出来的，只有他的粉丝不愿相信罢了，美洲杯夺金球，世界杯保送，凭啥让人信服你是球王啊？只有他的粉丝和背后的资本认他是球王吧,,,,False,3,男,失败总是贯彻人生始终，但永远不要放弃对成功的追逐。,Dream_ican,https://i2.hdslb.com/bfs/face/8dd9d9cde48610b76b6edb7d7d23ce12d2c43bf1.jpg
207414000912,1950358984,1,1469485,207401025904,207401025904,207414000912,0,0,1707559744,14,,,体坛之前的报道 C罗进球就会大肆宣扬他抢球权不团结 一场不进就要宣称进球荒 所以有不少篮球迷偶尔翻到都会对C罗没有好印象 其实也都不咋看足球,,,,False,6,保密,B站带着你的梅西离开我的首页,francesnail,https://i1.hdslb.com/bfs/face/4b5d2856f02f5c532444ee65b0f652a914956fc0.jpg
207416979680,1950358984,1,179141281,207401025904,207414000912,207414000912,0,0,1707561000,11,,,回复 @francesnail : 进球伤害球队，当时舆论真的牛,,francesnail,1469485,False,6,男,足球是一种信仰,Crisk777,https://i1.hdslb.com/bfs/face/523ff45e9519987e75209c59566205106e65f154.jpg
207402686128,1950358984,1,279036166,207401025904,207401025904,207402686128,0,0,1707554614,11,,,并不是，国内大多数人之前梅粉的数量多一些。舆论和公关都被控制了，导致国内梅粉是高于罗迷的。,,,,False,5,保密,,木村介叶,https://i0.hdslb.com/bfs/face/member/noface.jpg
207360074336,1950358984,1,536357193,0,0,0,0,0,1707535189,2,,,本来对梅西不讨厌的，后来他天天退队，然后阿根廷天天球王回来吧天天跪舔又舔回去，我可无语了，为国效力不应该是他本身就很渴望的事情吗？我真的无语了，从那之后我就一身黑了,,,,False,5,女,2024求个暴富,萌萌子呀,https://i0.hdslb.com/bfs/face/9c452246358cc6d4ec9e5424634b395c7c582bfc.jpg
207322278896,1950358984,1,597225110,0,0,0,1,0,1707500557,5,,,我也是15年入坑足球，不過是國足[tv_笑哭],[tv_笑哭],,,False,5,女,好想嫁人啊～,陈巧倩师姐,https://i2.hdslb.com/bfs/face/46c759221d49f57f48b8aba64c8b37affa0a169e.jpg
207615333888,1950358984,1,5657218,0,0,0,1,1,1707665645,3,,,我虽然是皇马球迷，但之前也挺喜欢梅西的，从什么时候开始讨厌梅西的呢，就是他退国家队，欧尼酱就算了，欧尼酱还不敢承担责任、没担当、小人，直接跑路，这种行为真的太恶心，从此微粉直接转黑，此时越看c罗越感觉这才是有担当有气魄的真汉子,,,,False,5,保密,,一只吱吱,http://i0.hdslb.com/bfs/face/member/noface.jpg
207616471104,1950358984,1,388947735,207615333888,207615333888,207616471104,0,0,1707666119,1,,,他两正好反过来，C罗是背锅的,,,,False,5,保密,,FAIRCRITTY,http://i0.hdslb.com/bfs/face/5e604d67dde2826e191c4fc3d9548a61db788309.jpg
207498812480,1950358984,1,241720792,0,0,0,0,0,1707614347,2,,,每个不管什么地位的人，让中国不高兴就立马黑，往死里扒黑,,,,False,4,保密,喜欢二次元的一切，各种游戏玩家。反正我最菜啦啦啦,三下三上四十酱,https://i1.hdslb.com/bfs/face/545e0a66c06462c70fcc44715a86433e60249883.jpg
207553017232,1950358984,1,1398127357,0,0,0,0,0,1707640455,2,,,因为某些儒迷的表现太让人膈应了,,,,False,3,男,,-米切尔-,https://i1.hdslb.com/bfs/face/125467af9f9e06dd5b4bb5794d7a3214868f48e6.jpg
210082604512,1950358984,1,89323976,0,0,0,2,2,1709015356,2,,,"它可不是只是傲慢和诈骗，
美国经济犹太人占大头，迈阿密球队也有犹太资本，
阿根廷经济也是犹太人占大头，
所以哟西是乌贼，才故意的反中亲日。
即便没有合同，没有背后原因，它本人也是反中亲乌亲日的。",,,,False,6,男,CG百苗图作者,宝庆苗散人,https://i2.hdslb.com/bfs/face/e439854e9dc70e57d7a97240b41c20faa21d508c.jpg
211072105072,1950358984,1,89323976,210082604512,211063330512,211063330512,0,0,1709628681,0,,,回复 @南方胖头鱼 :你膝盖生根了？,,南方胖头鱼,454274734,False,6,男,CG百苗图作者,宝庆苗散人,https://i2.hdslb.com/bfs/face/e439854e9dc70e57d7a97240b41c20faa21d508c.jpg
211063330512,1950358984,1,454274734,210082604512,210082604512,211063330512,0,0,1709623591,0,,,天天键政脑子坏了？,,,,False,5,男,你几金球几欧冠。,南方胖头鱼,https://i1.hdslb.com/bfs/face/4b421af2f3b62d30b0707e4e3e14e088c12ff21c.jpg
207444695536,1950358984,1,510457217,0,0,0,0,0,1707571944,2,,,不谈品德，就从他对中国不尊重，我就不会去喜欢他,,,,False,5,保密,开心点,北杳w,https://i2.hdslb.com/bfs/face/a367ec75b9a5be7a5bc1f3abf1c63dd0d15ca9ab.jpg
207365346624,1950358984,1,82579938,0,0,0,0,0,1707537438,2,,,3欧冠8金球 随我偷偷偷 八嘎呀路,,,,False,6,保密,,哎欧亚,https://i0.hdslb.com/bfs/face/c8f4b42c174ee478925dc6686fccf3d489a95deb.jpg
207388843728,1950358984,1,544610479,0,0,0,0,0,1707547690,3,,,听到希望竞技体育有一天能够实力至上，❤️痛了一下，造出来的神，是神吗？,,,,False,4,保密,,香蕉I菠萝派,https://i1.hdslb.com/bfs/face/a724849f27c9efda8f6f3c17e1e38edbbab1534b.jpg
207359447968,1950358984,1,240757913,0,0,0,0,0,1707534859,4,,,推荐拜仁[给心心],[给心心],,,False,5,女,"Dear, I am waiting for you in the past.",未雪祈求的灵,https://i2.hdslb.com/bfs/face/c035c14a3afe0581637396f05af3a8733b81ec3b.jpg
207345632752,1950358984,1,3461570751367369,0,0,0,0,0,1707528337,6,,,同15msn成为梅西巴萨跟风球迷，之后几年了解到巴萨所谓“梦三”的黑点，纯粹是为了这个“足球本球”硬生生坚持了5年。经历了16-19四年耻辱出局，c罗欧洲杯夺冠，金球追平欧冠三连反超，3-3西班牙大出风头，17年梅西跳广告牌揽功逼走内马尔，19年nt梅毒“出来见上帝”遭反噬，美洲杯不仅年年被打还炮轰南美足协，但是我都坚持了下来。直到20年8-2后，作为球队的队长不知道主动承担责任反而甩锅管理层，甚至用离队要挟干预管理层重建，我真心粉不动这人了。很奇怪为什么每次讨论到梅西与巴萨的关系都有那么多人在那喊梅西是忠臣，巴萨对不起梅西，20年你煤做过什么当大家眼瞎了没看见？？,,,,False,3,保密,,蓝黑小将迪马尔科,https://i0.hdslb.com/bfs/face/member/noface.jpg
207495622768,1950358984,1,4747526,0,0,0,9,8,1707612282,2,,,流量密码真好吃😋,,,,False,6,男,圣伊丽莎白医院院长,BeastNaomi,https://i2.hdslb.com/bfs/face/dceaead35586e25373daa477609653e1efa39f57.jpg
207495652608,1950358984,1,377654739,207495622768,207495622768,207495652608,0,0,1707612347,6,,,二等兵里奥哟西给我跪下！,,,,False,6,保密,,Andy-Samuer,https://i0.hdslb.com/bfs/face/94e766eb1e1af0cf8fed44eccdf820b0815126be.jpg
207507940752,1950358984,1,1316939511,207495622768,207495622768,207507940752,0,0,1707619259,2,,,哟西哟西哦一西！,,,,False,5,女,星铁xp党。xp玩爽了才是真的爽,银河白毛替身使者,https://i0.hdslb.com/bfs/face/e93a539cd60dab465ae0775e374bc4bb37831dc3.jpg
207618037792,1950358984,1,4747526,207495622768,207617893136,207507940752,0,0,1707666751,0,,,回复 @银河白毛替身使者 :那个早就辟谣了，你们瞎眼自己不看我有什么办法，好好玩儿你的米家全家桶得了,,银河白毛替身使者,1316939511,False,6,男,圣伊丽莎白医院院长,BeastNaomi,https://i2.hdslb.com/bfs/face/dceaead35586e25373daa477609653e1efa39f57.jpg
207375080000,1950358984,1,223215870,0,0,0,0,0,1707541396,4,,,说的太好了兄弟,,,,False,6,保密,,丛林少年,https://i0.hdslb.com/bfs/face/52827d271b2dee493f0b20815bbbb37f09da0286.jpg
207339429248,1950358984,1,286946229,0,0,0,13,11,1707524415,3,,,"球王，是一个果位，不是一个职务！梅西修成了正果，所以得到了球王的荣耀！他是自己历尽磨难修来的，所以即便他不想要，其他人也得不到！一朝加冕，即是永远！

一但修成，就像孙悟空成了斗战胜佛，想摆脱也绝不可能！因为足球的世界，需要球王！而里奥梅西，就是这个时代的天命球王！

一切诽谤抹黑，还有zzzq带来的流量，正如长舌村妇的咒骂，看似凶猛恶毒，但它们只是虚妄的泡影，终将破灭！

梅西球迷们，你们必须坚定自己的信心，在这至暗时刻站出来，支持这个带给你们圆满青春的男人！

今天，我们四面楚歌。明天，我们就要八面威风！

不要畏惧，更不要怀疑自己曾经的选择！因为你们的身后，有一颗已经在绿茵场上勇敢了二十多年的心，还有——大力神杯的万丈光芒！",,,,False,5,保密,,梦魇骑士117,https://i0.hdslb.com/bfs/face/af239f7145ebe7fa0cdfe52b0742bd0916e86b08.jpg
207339915552,1950358984,1,1367619089,207339429248,207339429248,207339915552,0,0,1707524827,7,,,“更残忍的是，最让爸爸受伤的，是他的偶像好像真的不在乎这个伟大的国家，和这个国家里那些无数挚爱他很多年的球迷；最让爸爸遗憾的是，他的偶像用国家歧视和意识形态闹出了这么一出最不该发生的闹剧，让他那十几年青春的追随和热爱变成了一个无比悲伤的笑话。”,,,,False,5,保密,​本是后山人，偶做前堂​客，醉舞经阁半卷书，坐井说天阔。大志戏功名，海斗量福祸，论到囊中羞涩时，怒指乾坤错。,圣歌德嘉的守夜人,https://i2.hdslb.com/bfs/face/75f31fde395e53001bc89089f3aae03435d59c1b.jpg
207339847760,1950358984,1,401595164,207339429248,207339429248,207339847760,0,0,1707524660,4,,,"小头一低，里奥哟西。
七场五点，人工加冕。
双手插兜，谁是特首？
理性爱国，我是梅迷[点赞]",[点赞],,,False,5,男,棋差一招，将军！,Trum_kk,https://i2.hdslb.com/bfs/face/3ebab6c93bdbaaedeae010c0c962852417273ce7.jpg
207339634864,1950358984,1,353794824,207339429248,207339429248,207339634864,0,0,1707524528,3,,,哟西哟西哟西[藏狐],[藏狐],,,False,5,保密,I really wanna smoke at your house,AtakNeon,https://i0.hdslb.com/bfs/face/40144caf9c430a0ebe096ebcbd7111844ed8958b.jpg
207587565856,1950358984,1,43394005,0,0,0,0,0,1707654993,3,,,从这事看出来 网络造神真的太离谱了[尴尬],[尴尬],,,False,6,男,迈向光明之路，注定荆棘丛生,蛋an挞,https://i1.hdslb.com/bfs/face/70ed848e5503bd2835453259c36a4c7823d0a8f5.jpg
209386022736,1950358984,1,522876259,0,0,0,0,0,1708611357,2,,,"为了迎接中国第37个《性病防治宣传周》，引导和“促进生殖健康行动”！

我们将高呼口号——“凝聚社会力量，合力共抗梅毒！”“愿天下无梅”！",,,,False,5,保密,,Acreator丁一,https://i1.hdslb.com/bfs/face/5775ac84b935f7bedfc49a979dae5a1cea09681e.jpg
207703567040,1950358984,1,405334510,0,0,0,0,0,1707727013,2,,,我不看球之前在巴黎都能刷到一直在喷姆巴佩，梅西迷是不是有病，投抖＋喷？,,,,False,5,保密,,小鹏JP8,https://i1.hdslb.com/bfs/face/1ce2dd048cc105968f183c82e94feb4e326756cd.jpg
207423804752,1950358984,1,1510049361,0,0,0,0,0,1707563795,2,,,"和我一样啊，也是18,19就开始不看球了。
那会看上感觉足球不好看了，特别是有些明星在的比赛。
反而一些不咋地的小球队之间的比赛，一个听说过的球星都没有，我看的是津津有味。[笑哭]",[笑哭],,,False,5,保密,,サクサク,https://i0.hdslb.com/bfs/face/member/noface.jpg
207743563856,1950358984,1,335595104,0,0,0,0,0,1707743682,2,,,吃流量的装反转粉的，新闻学给你玩明白了,,,,False,5,保密,祝各位新的一年平安快乐发大财,fengchen剪辑,https://i2.hdslb.com/bfs/face/eac2828d2f6b37d53073620e60adee15fb34500f.jpg
208117976912,1950358984,1,66741294,0,0,0,5,3,1707959571,1,,,一年前梅西给日本冷脸的时候你们不是这么说的，半年前梅西在北京踢完全场的时候你们也不是这么说的。有些人到底是在发掘真相还是在发泄情绪，自己心里有数,,,,False,5,保密,,临涓,https://i0.hdslb.com/bfs/face/f22001df5c14b29565c82a460533f26f53ceb34f.jpg
208561822784,1950358984,1,377654739,208117976912,208117976912,208561822784,0,0,1708183263,1,,,儒结晶还没走出来？,,,,False,6,保密,,Andy-Samuer,https://i0.hdslb.com/bfs/face/94e766eb1e1af0cf8fed44eccdf820b0815126be.jpg
208139990992,1950358984,1,199663111,208117976912,208117976912,208139990992,0,0,1707969936,1,,,梅西给日本冷脸，这次怎么没见到？港府也在发泄情绪是吧？梅西踢完全场那是有积分的，这次不一样友谊赛想不踢不踢反正也没重视中国，我们也不在乎一个梅西,,,,False,6,保密,.,昔日友人C,https://i1.hdslb.com/bfs/face/4b882e2b7c57af21d502e08fc422e7c17ac4e3ab.jpg
