rpid,oid,type,mid,root,parent,dialog,count,rcount,ctime,like,plat,device,content,emote,at_uname,at_mid,invisible,level,sex,sign,uname,avatar
210907495920,1351109300,1,9044554,210682095088,210868821072,210735596864,0,0,1709523783,7,,,回复 @尼采ccb : 问题是你所谓的迪巴拉＋曼朱基奇时期和c罗在尤文图斯时期的中场是有差距的，你真要控制变量哪怕不考虑球员状态的起伏起码要保持人员不变吧，巅峰尤文bbbc的后防，mvpp的中场，c罗到来之后又剩了几个？还有你说射门数的问题，有没有一种可能，任何球队的优先开火权都会给最能吃饼的那个前锋，进球伤害球队简直是最抽象的言论，只有进不去才叫伤害球队，之所以战术资源由迪巴拉转向c罗那就只能说明在球队眼中c罗得分能力比迪巴拉强啊，锋线加强了但总进球数不变，是因为中场无法提供足够的火力输送，明明球队变化有很多却一股脑把所有问题归咎在c罗一个人身上是否有失偏颇,,尼采ccb,5653893,False,6,保密,咸鱼,寂寞的枕头,https://i1.hdslb.com/bfs/face/b100f8eabf7a8123e9d6f9268d9dd0b040c66742.jpg
210840304608,1351109300,1,95251842,210682095088,210735596864,210735596864,0,0,1709470429,3,,,回复 @尼采ccb :他能进球就是即插即用，还要求球队成绩？球王年度91球也没拿联赛冠军啊,,尼采ccb,5653893,False,5,男,,嗨翻了呦,https://i0.hdslb.com/bfs/face/member/noface.jpg
211097152160,1351109300,1,405205518,0,0,0,4,2,1709640086,3,,,梅西的踢球的能力是职业足球员里最弱的。,,,,False,6,保密,,uweniyoho,https://i0.hdslb.com/bfs/face/1ffb700cba5e5b20effa1fdc325cadf67c51566e.jpg
211307527104,1351109300,1,77971339,211097152160,211097152160,211307527104,0,0,1709783537,0,,,逆天典,,,,False,6,男,人民万岁！,子任-同志,https://i1.hdslb.com/bfs/face/4b756b594cca27b274bcdf5afc5a4eaa20db9ace.jpg
211105339904,1351109300,1,178312604,211097152160,211097152160,211105339904,0,0,1709643653,0,,,典,,,,False,5,保密,网络上的闹残别骂完人就拉黑，低能儿一个，要骂就别拉黑懂吗，飞舞东西,北杨立川,https://i2.hdslb.com/bfs/face/b66beefd65bc9745c10bb34d9f07a890d94ab70f.jpg
210719499872,1351109300,1,393488798,0,0,0,0,0,1709396358,13,,,梅西明显有球能力强，虽然说是边锋，其实基本上都会活动在前腰的位置，基本上是十号球员。在皇马罗会内收但基本上都是爆破为主，其实没啥可比性,,,,False,6,男,← ←,杜_较瘦,https://i2.hdslb.com/bfs/face/0ba755aa40877f5decd59ee62e266381d4b47fcb.jpg
210654135296,1351109300,1,9099471,0,0,0,13,2,1709370372,3,,,梅西吃了不少巅峰哈布白红利,,,,False,6,男,,史莱姆指挥官,https://i0.hdslb.com/bfs/face/b4baf0a240aea636d57856d78681c1e0e99c7403.jpg
210680395680,1351109300,1,12357340,210654135296,210668612896,210659615248,0,0,1709381074,1,,,回复 @秀小一 :问题是人家C罗也不是什么皇马青训啊[喜极而泣]别人什么身份去的皇马，在去皇马前他就已经证明过自己了，人家离了曼联带当时还困在欧冠十六强的皇马一步一脚印的拿冠军，就算末期去尤文也是在关键场次力挽狂澜。你梅西从小就在巴萨青训跟着巅峰小罗巅峰哈白布踢球，但是你离开巴萨在巴黎把人家欧冠亚军带到十六强，关键的场次没有一场是站出来了的，没有姆总和法甲环境可能连联赛冠军都要丢。这些事实也闭口不谈吗？错位比较谁不会啊？[喜极而泣],[喜极而泣],秀小一,26168159,False,6,男,一点浩然气，千里快哉风。,桐枫Phoenix,https://i1.hdslb.com/bfs/face/a591097d26ff2b280af58de4f1b740cd8e319d27.jpg
210660920960,1351109300,1,351320604,210654135296,210659615248,210659615248,0,0,1709373320,2,,,回复 @ShinyruoAsuka :笑死了，是谁离开巴萨体系后欧冠淘汰赛零球零助啊？是谁离开巴萨体系后零联赛金靴零联赛MVP啊？,,ShinyruoAsuka,277590941,False,6,保密,,bili_351320604,https://i0.hdslb.com/bfs/face/ca7a1b5b65cdd45bd44a817395db1103d1d7fd95.jpg
211055928224,1351109300,1,10776405,0,0,0,0,0,1709618912,3,,,完美边锋带球都带不利索,,,,False,6,保密,,nike0505,http://i0.hdslb.com/bfs/face/172d6912bf85d0dd70e5a604c19bd0cf5d1b1ad0.jpg
210816450384,1351109300,1,294669907,0,0,0,12,9,1709460217,8,,,儒触最安静的一集,,,,False,5,保密,@E .Ten Hag ，卡拉宝历史第一位率队夺冠的荷兰主帅 ；发布会射手榜第一人。曼联大清洗运动革命家。,埃里克_滕哈格,https://i1.hdslb.com/bfs/face/621d42a58c1c153ef0e634da4ae20527ddbdddb8.jpg
210878267760,1351109300,1,18948098,210816450384,210877324288,210877324288,0,0,1709488828,3,,,回复 @不存在概率问题 :儒处委屈了呜呜呜要哭哭惹[滑稽],[滑稽],不存在概率问题,1011248602,False,5,保密,独尊儒术罢黜百家,诸如球王再创辉煌,https://i2.hdslb.com/bfs/face/00f557de46fa3bee9f75ace0e9799a38bcbf1468.jpg
210877324288,1351109300,1,1011248602,210816450384,210816450384,210877324288,0,0,1709487934,3,,,螺处不闹麻了吗,,,,False,4,保密,,不存在概率问题,https://i1.hdslb.com/bfs/face/89dc6c40dd44f2ed2bffe1cf900ad63049c44cde.jpg
210879215040,1351109300,1,1011248602,210816450384,210878267760,210877324288,0,0,1709489827,4,,,回复 @诸如球王再创辉煌 :不是看笑了，我看哭了[笑哭][笑哭][笑哭]最后一届[笑哭][笑哭][笑哭]坐板凳[偷笑][偷笑]替补上场吃饼都吃不明白[脸红][脸红][脸红][偷笑][偷笑][呲牙][呲牙],[偷笑] [呲牙] [笑哭] [脸红],诸如球王再创辉煌,18948098,False,4,保密,,不存在概率问题,https://i1.hdslb.com/bfs/face/89dc6c40dd44f2ed2bffe1cf900ad63049c44cde.jpg
210705946784,1351109300,1,1194277221,0,0,0,0,0,1709390918,4,,,其实C罗是把左边锋当中锋踢的，梅西是把右边锋当前腰踢的。还有就是球队战术问题，皇马长传反击对要求就是锋线球员前插，而巴萨传控就是要求把球传进球门。对球员要求不一样。自然球员意识也不一样。其次梅西梅西不是不前插，他在10年对阵皇马半决赛就有前插抢点破门的例子，他之所以前插较少就是因为梅西的任务是把球从中场过度到禁区前沿并传出威胁球，这个过程对体力消耗巨大，所以你再要求他前插就有点难了。而C罗是在中场过渡球之后插上接球，所以前插比较多。,,,,False,3,保密,阿伟罗忠实信徒，禁区林黛玉追求者，姐控。,库西帝尼阿萨塔,https://i0.hdslb.com/bfs/face/ac04cb75f60da388b7f482d743382cbfc1ee0bfb.jpg
210709830256,1351109300,1,359104282,0,0,0,9,8,1709392436,8,,,人们很宽容哈兰德拿不了世界杯，c罗却不行。c罗巅峰的时期葡萄牙的实力其实并不强力，只是比挪威好一些罢了,,,,False,5,女,"银河中心的魔女向你问好——！本账号将专注于轻小说，MAD,ACGN杂谈……",陌莉丝,https://i1.hdslb.com/bfs/face/156eb7f0bf052af938ff5e3acd98265e61e6410f.jpg
210917085920,1351109300,1,11835566,210709830256,210709830256,210917085920,0,0,1709528269,7,,,笑死了从没打过这么富裕的仗,,,,False,5,保密,冬季万岁,比企谷久里,http://i2.hdslb.com/bfs/face/1271d826862f230f0274071a4002b294f9a8c04b.jpg
210841609456,1351109300,1,3546380289182047,210709830256,210709830256,210841609456,0,0,1709470953,2,,,现在来说可能确实是这样，但要是20年以前你要是说没有C罗的葡萄牙更好，那我只能说有没有可能把你们这种贵物拿下对中国这个聊球环境更好[嗑瓜子]sz少一点总归是更好的,[嗑瓜子],,,False,3,男,,九辰977,https://i1.hdslb.com/bfs/face/495330600a23d8e6cddeff0048df70584cd297ca.jpg
210814446864,1351109300,1,409261676,210709830256,210711992864,210711992864,0,0,1709459372,2,,,回复 @九辰977 :有没有可能把c骡拿下对葡萄牙更好[嗑瓜子],[嗑瓜子],九辰977,3546380289182047,False,5,男,我总觉得这世界少了点什么...,sadness-maybe,http://i2.hdslb.com/bfs/face/b84a4e6cc7695ecf3cc5ac5e65817a8239cbb51c.jpg
210709578272,1351109300,1,486022476,0,0,0,0,0,1709392329,3,,,明显就是战术定位不一样,,,,False,5,保密,,梦醒叁分归,http://i0.hdslb.com/bfs/face/1fbdf76c5c0728e1d5a871ca551b82e6d3de8825.jpg
210850848880,1351109300,1,13699519,0,0,0,1,1,1709474815,4,,,C罗快速反击里很强但是球队中场被限制住就容易隐身，梅西适合阵地战但是碰到防反很强的球队很难有很强的表现。梅西大概率是工业化足球里最后一个持球大核踢法的巨星，而C罗大概率工业化足球后最完美的前锋模板。梅西是体系球员，但这个体系却不是贬义词而是他强到围绕他组建体系能获得上限极高的球队，C罗则是以后工业化足球里最常见也是大部分球队最喜欢的一类只需要负责进球并且效率高，C罗即使状态不好球队依然能有赢球的战术方法，而梅西状态不好或者被限制死球队大概率要输。梅西这样的球员以后基本很少能看到，就算出现了也很难有什么作为，C罗这样的以后应该会比比皆是，但是很难达到C罗的高度，这是足球发展的趋势，全攻全守下梅西这样的球员站不住脚，没有几个教练愿意花大功夫去培养一个10号位，对一个球队来说传统十号位过于奢侈（性价比低），除非再次出现像梅西这样持球能力历史前三的人。其实论荣誉能力梅罗都称得上是球王，但是梅西用海贼王里话说就是旧时代的残党，是传统十号位的绝唱，所以非要选一个，我更倾向于梅西是第三个球王，如果这个时代可以有两个球王，那C罗就是那第四个球王,,,,False,5,男,,粗粗的大拇指,http://i1.hdslb.com/bfs/face/0551e56c0de00dd91ff2ce9347cf3adb0f7694db.jpg
210851600608,1351109300,1,13699519,210850848880,210850848880,210851600608,0,0,1709475056,0,,,说传统十号位性价比第是因为现代足球防守强度大，边路推进的容错率更低并且丢了球也能及时拼抢，没有几个纯正十号位能在现代足球的防守强度下从中场开始推进并且丢球率低，而且中路丢球被反打的成功率比边路高的多,,,,False,5,男,,粗粗的大拇指,http://i1.hdslb.com/bfs/face/0551e56c0de00dd91ff2ce9347cf3adb0f7694db.jpg
210623505408,1351109300,1,64317170,0,0,0,0,0,1709355734,3,,,又一个足球元素罢了,,,,False,5,保密,,铜锣湾的意大利炮,http://i0.hdslb.com/bfs/face/member/noface.jpg
210790501728,1351109300,1,671493681,0,0,0,0,0,1709448073,4,,,哟西是啥成分 就是足球政客养的一条哈巴狗,,,,False,4,保密,,甩手一烈火,https://i0.hdslb.com/bfs/face/2b72c57f868254d36b8ebe56a056a55152888c3a.jpg
210872632000,1351109300,1,12638155,0,0,0,1,1,1709484426,4,,,姆总监无球和头球再精进一下也许这个模版就换人了。后浪一浪接一浪啊,,,,False,6,男,,一只与世无争的鸡,https://i1.hdslb.com/bfs/face/eb8c388b67a5ad3902613f600e3b001262994a64.jpg
211004183664,1351109300,1,317458205,210872632000,210872632000,211004183664,0,0,1709570471,0,,,那只能靠姆总悟性了,,,,False,5,保密,晦气，太晦气，现在阿b好多人的人语文是真差，天天遇到晦气人，多去做做阅读理解好不好,御坂19999,https://i2.hdslb.com/bfs/face/824ca553d1bd9766ae1a5d8b6442e8de186fdafe.jpg
210589994896,1351109300,1,26623097,0,0,0,5,3,1709338649,20,,,那些有球的技巧还是似华丽，但足球还是更喜欢有速度有力量有暴发的球员，这些才是人类的极限，C罗这方面可以说是无敌。,,,,False,6,男,,Mr白水,http://i2.hdslb.com/bfs/face/0f132ac1d965f0c5b3f5088bf57a905bfc5fc97e.jpg
210645633616,1351109300,1,1490846779,210589994896,210589994896,210645633616,0,0,1709366403,7,,,按你的标准，那博尔特应该是足坛之王，是GOAT，没有比他更有速度更有爆发力的了；而马拉多纳 贝利 克圣 齐丹等几人都应该算不入流的球员。,,,,False,4,男,,往事随风M10Max,https://i0.hdslb.com/bfs/face/member/noface.jpg
210642326720,1351109300,1,1252307346,210589994896,210589994896,210642326720,0,0,1709364648,3,,,C罗这种只是将 梅西这种是帅,,,,False,5,保密,,梦星空路,https://i0.hdslb.com/bfs/face/member/noface.jpg
210820653328,1351109300,1,49787865,210589994896,210589994896,210820653328,0,0,1709462001,1,,,华丽？论华丽它还不如内马尔，更别说小罗，老马更是连影子都看不到,,,,False,6,男,,yangyuqing02,http://i0.hdslb.com/bfs/face/0b459eea21ec598f5ea538fad8c45c24443f09ca.jpg
210785803536,1351109300,1,475276479,0,0,0,0,0,1709445927,4,,,哟西不行，靠跌,,,,False,4,保密,"人造罐子侏儒嘻，哄堂大孝蠕囚亡
官方认证蠕斜角，上诉驳回坐大牢",下水道里的激素老鼠,https://i0.hdslb.com/bfs/face/1773b7da3fc089b0903a859c933d3c2016a10748.jpg
210641514320,1351109300,1,1252307346,0,0,0,2,0,1709364273,4,,,分析梅西踢法缺陷  梅西踢法最大的缺陷就是别人复制不了  [嗑瓜子],[嗑瓜子],,,False,5,保密,,梦星空路,https://i0.hdslb.com/bfs/face/member/noface.jpg
210565716480,1351109300,1,3546601878457240,0,0,0,56,34,1709309065,55,,,我喜欢看灌篮高手，喜欢湘北，喜欢樱木流川。他们从被人天天虐到最后战胜了山王。你是没拿到全国冠军。我依然喜欢他们。体育的意义不正是如此，去体验努力和拼搏的过程而不是仅仅只在乎结果。c罗最后在尤文欧冠小组赛3:0巴萨就是最好的说明。我开始输给你。不代表我一辈子不如你。我会努力，会进步，会拼搏。总有儒迷拿五指山说事。那近代的中国被列强欺负，就代表我们现在也那样？足球不仅有盘带，还有很多。,,,,False,2,保密,万千努力加上绝不放弃，才能成为最好的自己，超越最好的自己。永远的CR7。,i肉肉7,https://i1.hdslb.com/bfs/face/743207daa936af52d3a618bb17a6132def222af0.jpg
210588832192,1351109300,1,389607480,210565716480,210582926576,210582926576,0,0,1709337366,12,,,回复 @-ahwbHao :呃呃，抢断儒儒算不算隐身,,-ahwbHao,3546382893844825,False,5,保密,,臡纔偲輒鞷䆩纃㻸黙躎,https://i0.hdslb.com/bfs/face/74c807bedd2a0e43ad047927eee503a2420c67c1.jpg
210602075536,1351109300,1,3546601878457240,210565716480,210600446352,210582926576,0,0,1709346237,7,,,回复 @螺斗宗--阿伟罗 :儒处疑问句懂啥意思吗，点球不算进球可是儒处先说的。,,螺斗宗--阿伟罗,627502389,False,2,保密,万千努力加上绝不放弃，才能成为最好的自己，超越最好的自己。永远的CR7。,i肉肉7,https://i1.hdslb.com/bfs/face/743207daa936af52d3a618bb17a6132def222af0.jpg
210585050704,1351109300,1,3546601878457240,210565716480,210582926576,210582926576,0,0,1709330299,6,,,回复 @-ahwbHao :点球算进球么,,-ahwbHao,3546382893844825,False,2,保密,万千努力加上绝不放弃，才能成为最好的自己，超越最好的自己。永远的CR7。,i肉肉7,https://i1.hdslb.com/bfs/face/743207daa936af52d3a618bb17a6132def222af0.jpg
210917728944,1351109300,1,11835566,0,0,0,0,0,1709528567,6,,,吃饼的就是吃饼的单一领域里最顶级的没有人反驳，非要拉梅西下水我只能说小丑自取其辱，什么靠中场靠队友垃圾吧倒吧，这个理论有多么不攻自破心里没点逼数吗，这么多年敢不敢换个黑法,,,,False,5,保密,冬季万岁,比企谷久里,http://i2.hdslb.com/bfs/face/1271d826862f230f0274071a4002b294f9a8c04b.jpg
210706961376,1351109300,1,7643074,0,0,0,1,1,1709391293,11,,,基本没有前插是因为巴萨基本不打防反，皇马打的就是防反，反击时候前锋不跑等什么？你把球队战术这个大前提忽略了属于缘木求鱼。,,,,False,4,保密,,genswzf,http://i0.hdslb.com/bfs/face/member/noface.jpg
211005503680,1351109300,1,3008191,210706961376,210706961376,211005503680,0,0,1709571346,1,,,不打防反？那瓜帅布置的高位逼抢是干嘛的？,,,,False,6,男,it will come to me,我什么场面没见过啊,https://i1.hdslb.com/bfs/face/655b82e9c21e872d73ab80db2f87bbc0c72a3e78.jpg
210613432976,1351109300,1,1718369054,0,0,0,49,41,1709351608,23,,,这个时期的C罗增强的力量，其实突破能力已经不如9号罗和曼联时期了[酸了],[酸了],,,False,5,保密,CityUHK数据科学系,keidisodk,https://i0.hdslb.com/bfs/face/member/noface.jpg
210684303872,1351109300,1,582907693,210613432976,210679756944,210631669152,0,0,1709382635,2,,,回复 @特别特别的香傲 :稍微？梅持球能力真的薄纱罗哥[笑哭],[笑哭],特别特别的香傲,185889496,False,4,保密,尊重每一位球星 侮辱梅西 我自然会问候,16年开始的阿萨梅,https://i1.hdslb.com/bfs/face/53a71e90bc520be07198dc260acfa9ee56ed7ac6.jpg
210678573552,1351109300,1,1151534763,210613432976,210674034944,210631669152,0,0,1709380273,2,,,回复 @不知名休伯利安清洁工 :泛用性？这些都是什么词啊......他俩技术特点不同，没有真的全能球员，都是扬长避短的，梅西在传、停、带、射方面比C罗表现丰富，C罗专注在典型的前锋角色上，前突穿插接球，临门一脚能力强。,,不知名休伯利安清洁工,1860050738,False,3,保密,,我与杞人,https://i0.hdslb.com/bfs/face/a815cd6b6a2bec9d480cc9526fa8eb8eab898cdf.jpg
210784907840,1351109300,1,106783873,210613432976,210613432976,210784907840,0,0,1709445512,1,,,这么说吧，100满分算，梅西背身40分的话，罗哥只有-10分，罗哥在禁区和任何球员有身体接触的时候99%以罗哥莫名倒地收尾，背身不是背着球门传球就叫背身能力，去看看本泽马和吉鲁，什么叫背身，你吹罗哥啥都说得过去，你吹背身是真的特么眼瞎，罗哥所有技能里就背身基本为负分，和后期的持球能力一样，完完全全没有,,,,False,6,保密,,热衷丶7,http://i1.hdslb.com/bfs/face/c910ad2a45696d247fc3038accc63725ff55a60c.jpg
210638868704,1351109300,1,481091792,0,0,0,4,4,1709362923,3,,,这个赛季联赛没什么可说的，看了比赛的都知道怎么回事，所有人都希望皇马赢，包括裁判。,,,,False,5,男,,五色花瓣,https://i2.hdslb.com/bfs/face/159cb57e0d99e81d955bb894c4094f6478d9bee4.jpg
210755586880,1351109300,1,3493261991742302,210638868704,210638868704,210755586880,0,0,1709433005,1,,,瓦伦西亚看来不希望皇马赢啊,,,,False,3,保密,,toonnneeeel,https://i2.hdslb.com/bfs/face/d8745687bb4a249d65f0405eeaa6bfb0e4b78a06.jpg
210647725040,1351109300,1,384558379,210638868704,210638868704,210647725040,0,0,1709367360,1,,,行,,,,False,6,男,厉害！,22片海洋_,https://i1.hdslb.com/bfs/face/064fdd03d9ca9f79b8d67234215133021606eb22.jpg
210733583680,1351109300,1,1040755601,210638868704,210638868704,210733583680,0,0,1709406524,1,,,西甲哨都偏到克罗斯暴怒了还偏皇马？,,,,False,5,保密,不看回复，不用拿等级阴阳我，是小号。,树洞诺夫,https://i2.hdslb.com/bfs/face/0127302477b39a96209e7b3ed40546f426bddb0b.jpg
210917718224,1351109300,1,352944772,0,0,0,4,3,1709528551,3,,,因为C罗在无球的时候，梅西已经持球射门了,,,,False,5,保密,,你尊嘟假嘟O_o,https://i1.hdslb.com/bfs/face/e657c8552a6ec5d789358ef092c08df1aaec3614.jpg
210944119984,1351109300,1,352944772,210917718224,210940511344,210940511344,0,0,1709543923,2,,,回复 @新号不看镁铝 :确实不难，你看了吗[脱单doge],[脱单doge],新号不看镁铝,3493293627279386,False,5,保密,,你尊嘟假嘟O_o,https://i1.hdslb.com/bfs/face/e657c8552a6ec5d789358ef092c08df1aaec3614.jpg
211021578560,1351109300,1,177631820,210917718224,210917718224,211021578560,0,0,1709598479,0,,,梅西在替补席射门，他在中国也翻不了身,,,,False,5,男,"凤凰于天不意鸡议。
军事，科技，经济，攻守易形了。
停留在过去，那是你的落后。",欣旺-震旦天朝,https://i2.hdslb.com/bfs/face/3cbeee64d038767f04d50c9725069801a045bdf0.jpg
210940511344,1351109300,1,3493293627279386,210917718224,210917718224,210940511344,0,0,1709541996,0,,,难绷，看看比赛又不难,,,,False,4,保密,,新号不看镁铝,https://i0.hdslb.com/bfs/face/member/noface.jpg
210614647072,1351109300,1,490642304,0,0,0,2,2,1709352053,4,,,看这个标题我真的想笑。边锋？你咋不分析梅西为啥不适合做门将或者中后卫呢？,,,,False,4,保密,,ds19811116,https://i0.hdslb.com/bfs/face/member/noface.jpg
210620344768,1351109300,1,3461566041164736,210614647072,210614647072,210620344768,0,0,1709354445,1,,,梅西出道确实是边锋,,,,False,4,保密,faker粉丝,ffffaaakkkeeerrr,https://i0.hdslb.com/bfs/face/member/noface.jpg
210634145504,1351109300,1,490642304,210614647072,210620344768,210620344768,0,0,1709360551,0,,,回复 @ffffaaakkkeeerrr :瓦尔迪出道还是个工人呢。咱说的是这件事讨论的点关键是“梅西踢边锋”，和“齐达内踢边锋”“大罗踢边锋”不好如何如何……类似这种，这本身就是个伪命题。,,ffffaaakkkeeerrr,3461566041164736,False,4,保密,,ds19811116,https://i0.hdslb.com/bfs/face/member/noface.jpg
210729797712,1351109300,1,323865290,0,0,0,0,0,1709402410,4,,,所有人都没讲到的一点是，几乎所有球队遇到有梅西的球队防守落位都很深，三条线都压缩很紧密。皇马是打反击的，反击中跑位要比阵地战容易多了吧？1415巴萨为什么在中场下滑的情况下能拿三冠王？msn的个人能力是一方面，更重要的是那个赛季巴萨反击打得好，攻防转换快。后来又开始磨磨叽叽，回传倒脚等对方防守落位。成绩自然不行,,,,False,5,保密,,一句哟西送别一位至亲,https://i2.hdslb.com/bfs/face/0510beeaf6b6b52041e865a59d0d4d74d7a33abf.jpg
210795244432,1351109300,1,86395406,0,0,0,1,1,1709450464,3,,,都tm偏到姥姥家了还客观，说梅西无球跑动为0，我相信但凡上场踢过球都说不出这话，你说梅西有的时候散步那确实事实，但别尬黑，一点意思没有，就和前两年梅西粉喷c罗一样，玩什么风水轮流转,,,,False,5,保密,,重生之我娶了Cplusplus,https://i2.hdslb.com/bfs/face/6c5902ad00a61d49edacc39cd0882a16e9c4a3e3.jpg
210906233600,1351109300,1,454521635,210795244432,210795244432,210906233600,0,0,1709523043,0,,,-100,,,,False,5,保密,,灬汐叹,https://i2.hdslb.com/bfs/face/0d3f9a0fead7d24a40e71cacf02e8e18ce32aea1.jpg
210680419568,1351109300,1,2289797,0,0,0,5,3,1709381024,12,,,梅西这样球王级别的技术，把体力放在频繁前插上是暴殄天物的,,,,False,6,男,,风雅宋,https://i2.hdslb.com/bfs/face/ff2d82c528d0e0f9b514d4a52a8fa6ce3a3e907c.jpg
210786810528,1351109300,1,475276479,210680419568,210746036320,210746036320,0,0,1709446348,6,,,回复 @九年前的北扬克顿 :确实只能靠干碟,,九年前的北扬克顿,351539906,False,4,保密,"人造罐子侏儒嘻，哄堂大孝蠕囚亡
官方认证蠕斜角，上诉驳回坐大牢",下水道里的激素老鼠,https://i0.hdslb.com/bfs/face/1773b7da3fc089b0903a859c933d3c2016a10748.jpg
210746036320,1351109300,1,351539906,210680419568,210680419568,210746036320,0,0,1709427478,6,,,所以欧冠八年惨案，把巴萨巴黎坑出翔的囚亡,,,,False,5,保密,,九年前的北扬克顿,https://i2.hdslb.com/bfs/face/c379f57edca10d01b65bd45ddc2d3f0a282f5086.jpg
210710206176,1351109300,1,2101231006,210680419568,210680419568,210710206176,0,0,1709392567,0,,,问题就是打强队的防守很难体现出来，吃状态和运气,,,,False,5,保密,天若有情天亦老，人间正道是沧桑,曼联名宿韦恩鲁尼,https://i1.hdslb.com/bfs/face/5a1a1ce00f317da732e9105c997da86bbdf9c71a.jpg
210697267168,1351109300,1,1280285283,0,0,0,7,4,1709387741,8,,,为什么只谈锋线能力，不谈传带能力？用7号位标准分析梅西和c罗，但别忘了梅西踢得10号位,,,,False,4,保密,最好玩的那一只二狗,有点小聪明的王二狗,https://i0.hdslb.com/bfs/face/41d013e5fd83141af574a0a34784e40d28ab48a1.jpg
210711537024,1351109300,1,32622903,210697267168,210697267168,210711537024,0,0,1709393052,6,,,梅西早年踢的是边锋啊,,,,False,6,保密,,一只周某某,http://i0.hdslb.com/bfs/face/96beb0372855ca0127f1828146c027fbbe7341be.jpg
210786779888,1351109300,1,475276479,210697267168,210697267168,210786779888,0,0,1709446385,5,,,鼠儒是十号那鼠儒回防了？,,,,False,4,保密,"人造罐子侏儒嘻，哄堂大孝蠕囚亡
官方认证蠕斜角，上诉驳回坐大牢",下水道里的激素老鼠,https://i0.hdslb.com/bfs/face/1773b7da3fc089b0903a859c933d3c2016a10748.jpg
210859290656,1351109300,1,3493289560902291,210697267168,210697267168,210859290656,0,0,1709478171,0,,,那他到底是什么位置？中场不防守，锋线不前插。古典？,,,,False,4,保密,德国战车冲冲冲,糍力GG,https://i0.hdslb.com/bfs/face/1f33c0e18702f7a50c80ad54e83b1cb3ac097fb6.jpg
210874660864,1351109300,1,314249955,0,0,0,1,1,1709485654,3,,,说梅西无球能力为0的，纯粹是为了流量吧。,,,,False,5,保密,,丨奇幻の世界丨,https://i0.hdslb.com/bfs/face/ff3fe746c8d6c0b0d9c7e065ddf2078557d6f4ee.jpg
210905958912,1351109300,1,454521635,210874660864,210874660864,210905958912,0,0,1709522858,0,,,-100,,,,False,5,保密,,灬汐叹,https://i2.hdslb.com/bfs/face/0d3f9a0fead7d24a40e71cacf02e8e18ce32aea1.jpg
210635251376,1351109300,1,582907693,0,0,0,1,1,1709361088,6,,,梅西其实不算是一个传统意义上边锋  他无球能力确实不是那么出色 主要是有球能力很强 所以经常回撤持球 罗哥在边路功能性更强,,,,False,4,保密,尊重每一位球星 侮辱梅西 我自然会问候,16年开始的阿萨梅,https://i1.hdslb.com/bfs/face/53a71e90bc520be07198dc260acfa9ee56ed7ac6.jpg
