rpid,oid,type,mid,root,parent,dialog,count,rcount,ctime,like,plat,device,content,emote,at_uname,at_mid,invisible,level,sex,sign,uname,avatar
208258701184,1750523137,1,397808212,208166287024,208166287024,208258701184,0,0,1708018786,10,,,30年国米铁粉 前来支援，当这么多年球迷 头一次见大规模扣帽子事件，他们扣谁 我就支持谁,,,,False,5,保密,,群殴国度3366,http://i1.hdslb.com/bfs/face/4cbf8ab8e810b9adf0d6eacd7aa8ba0db4a4aaf8.jpg
208214604976,1750523137,1,392088045,208166287024,208182880608,208182880608,0,0,1708001043,5,,,回复 @溜溜球溜溜达达 :罗处从不开内容[生气],[生气],溜溜球溜溜达达,399627986,False,5,男,"梅西球迷
阿根廷球迷
巴萨的支持者

不羡武陵豪杰墓，
无花无酒锄作田！

",Kotori_木峤卿,https://i0.hdslb.com/bfs/face/1ce8d4ede5d3949fb8e8dbf426813e934824222b.jpg
211062062480,1750523137,1,1279730951,0,0,0,0,0,1709622815,2,,,就算全世界都在黑梅西，我也会支持全世界的[doge],[doge],,,False,4,保密,,猫茶的叶,https://i2.hdslb.com/bfs/face/3736af309140f72221af318c003a28b830afa767.jpg
208803230976,1750523137,1,525474982,0,0,0,0,0,1708322103,6,,,中梅毒了🤣👉🤡,,,,False,5,保密,没有什么喜欢的人，但是有想要的东西,亖预,https://i1.hdslb.com/bfs/face/7cad88b2c4664cd1fb7ec5504546e1b1ed3bd092.jpg
208173003616,1750523137,1,116122320,0,0,0,0,0,1707984640,5,,,还在洗呢,,,,False,2,保密,,杜若-曜,https://i0.hdslb.com/bfs/face/0149a57ddf1759e16c42bf9fce108b04a4d676cd.jpg
208296962400,1750523137,1,1434109394,0,0,0,0,0,1708055048,5,,,"结晶魅力时刻
BV1rm411Q7Eb",,,,False,6,保密,私信打广告没用，防骚扰已开,bili_37625992445,https://i2.hdslb.com/bfs/face/de737cd746a96742c07ced6c213aa25cf0429d90.jpg
208237912448,1750523137,1,3492972735760577,0,0,0,0,0,1708009407,7,,,没有实质内容，都是自己的逻辑。网上大部分视频都是这样。,,,,False,3,保密,,Nimitta,https://i0.hdslb.com/bfs/face/member/noface.jpg
208173797424,1750523137,1,18439798,0,0,0,0,0,1707985019,5,,,这么快洗地啦，钱到账的晚了点吧,,,,False,4,保密,,雷霆卍风暴,https://i1.hdslb.com/bfs/face/a1b09e55d7cc6d01cb5905ba19013acfeffa62e6.jpg
208300726816,1750523137,1,114655408,0,0,0,0,0,1708056627,8,,,逆天 梅毒 认叠王,,,,False,6,保密,,bwh994,https://i1.hdslb.com/bfs/face/2fd7169833dc3bc0d85d8d8dbcbc558d5e011837.jpg
208211601280,1750523137,1,436629415,0,0,0,0,0,1707999889,3,,,[doge]你扯合同那我就扯炸伤啰,[doge],,,False,4,保密,,卖了个鸡,https://i0.hdslb.com/bfs/face/member/noface.jpg
208175372720,1750523137,1,236188282,0,0,0,8,3,1707985692,6,,,所以，说了这么多，退钱了吗？你不知道很多人存钱就是为了见他一面，你就这样甩脸？,,,,False,5,保密,没有资本，何来人生,跌底666,https://i1.hdslb.com/bfs/face/e4dafd7fe659c99eba53b9d5c34ad5f96bde04f1.jpg
208198530304,1750523137,1,236188282,208175372720,208182392464,208182392464,0,0,1707995112,2,,,回复 @苍崎诚子 :退了一半，只有主办方退，迈阿密退了吗？,,苍崎诚子,73832958,False,5,保密,没有资本，何来人生,跌底666,https://i1.hdslb.com/bfs/face/e4dafd7fe659c99eba53b9d5c34ad5f96bde04f1.jpg
208256881520,1750523137,1,234074411,208175372720,208198530304,208182392464,0,0,1708017490,1,,,回复 @跌底666 : 你管谁退的？你从谁手里买的票就找谁退，主办方亏钱就起诉迈阿密国际，现在是不敢起诉，门票和机酒也不全退,,跌底666,236188282,False,6,男,"he feels deeply, he feels tenderly.",副导演meiko,https://i2.hdslb.com/bfs/face/f1ecdeff552a225d050cd572d0b7906264675fed.jpg
208217550944,1750523137,1,674312977,208175372720,208198530304,208182392464,0,0,1708002097,1,,,回复 @跌底666 :迈阿密能拿一半的门票钱吗？凭什么迈阿密退一半？,,跌底666,236188282,False,5,保密,,真的林清醒,https://i1.hdslb.com/bfs/face/e5cff16ebbd1cbaeb034e9c16bec41e7d540e971.webp
208262663104,1750523137,1,38883369,0,0,0,0,0,1708022064,7,,,有一种黑叫越描越黑，有一种义叫断章取义[doge],[doge],,,False,6,男,得之我幸，失之我命,暗中观察的小漠,https://i0.hdslb.com/bfs/face/123abfc8ec656f9b59135a17c8d54dc1cd56744d.jpg
208210002128,1750523137,1,265206345,0,0,0,1,1,1707999316,3,,,你个ai配音的不就是为了流量么来来给你根骨头,,,,False,5,保密,,蓑笠翁钓手,https://i0.hdslb.com/bfs/face/e2f98c2dc1984efbd47e263236121020d176b971.jpg
208211163920,1750523137,1,3494349295847456,208210002128,208210002128,208211163920,0,0,1707999761,1,,,啊，脑回路清奇,,,,False,3,保密,,reiccco,https://i2.hdslb.com/bfs/face/7aa96b544fd190cbeec9659dd48658fdb31556b6.jpg
208245182832,1750523137,1,341081929,0,0,0,2,1,1708012090,3,,,这么久的信仰塌了我能理解，出视频能让自己好受一些，但如果真到了石锤阶段，希望你接受现实，别再自欺欺人。,,,,False,6,保密, ,囨团,https://i1.hdslb.com/bfs/face/e166a5c66bec33326775484b84848a69a70ba105.jpg
208255403008,1750523137,1,234074411,208245182832,208245182832,208255403008,0,0,1708016726,1,,,行吧，期待实锤，但是实锤不了也希望你们能接受事实，别再自欺欺人，说什么“官方没说不代表没干”之类的话,,,,False,6,男,"he feels deeply, he feels tenderly.",副导演meiko,https://i2.hdslb.com/bfs/face/f1ecdeff552a225d050cd572d0b7906264675fed.jpg
208429812992,1750523137,1,430229004,0,0,0,0,0,1708123953,4,,,没到现场的人一个劲儿地各种揣测各种在洗试图还原呦西的完美人设，那些花了钱买票长途跋涉到现场却被呦西冷遇的粉丝却始终没等到梅西事后的一个回复，呵呵,,,,False,5,男,,究极老苟,http://i0.hdslb.com/bfs/face/member/noface.jpg
208433842432,1750523137,1,1580825,0,0,0,0,0,1708129295,3,,,梅西没签握手领奖合同，梅西没错，错的是世界,,,,False,6,男,,转瞬之间丶,http://i2.hdslb.com/bfs/face/c085863733b1dd631a1adc5e7461b3be03928c62.jpg
208329464784,1750523137,1,1928205416,0,0,0,2,2,1708069353,3,,,"但是无论如何梅西没有尊重中国球迷，没有出来和球迷互动一下，刻意冷了场。就算不上纲上线，这也是很大的错误。

其次，没有立场就是说不亲左翼咯。那亲什么呢？（亲钱嘛）真以为他是怀有朴素美好愿望的啊？只要是一个成年人都会对政治有见解的。只不过他不愿意说嘛，也不愿意担风险呗，不希望失去欧美市场（那是当然，一个西班牙国籍的世界级明星，这本就亲西方小资产阶级立场的，想来对阿根廷等第三世界反殖民立场也没什么忠诚度可言）。

结合这两点来看。在中国土地上如此这般，又是位于比较敏感的中国香港市，被人想象成亲西方的便也不足为奇了。我最开始看这个新闻，就有疑问，这人是不是对中国香港制度不满？好了，我不上纲上线瞎猜。但我希望梅西粉丝能够想一想，盛会冷场，对于主办方东道主是什么心情。

虽也不是什么大事，但两次冷场寒了中国球迷的心。（十几年前也有一次）",,,,False,5,保密,这个人很懒，什么也没写,念念是我滴,https://i2.hdslb.com/bfs/face/fbc7c672767d31ceede3c2b2b11b41f19c47ce9e.jpg
208428739952,1750523137,1,8108144,208329464784,208329464784,208428739952,0,0,1708120866,1,,,不知道的还以为你和梅西建过政呢？西方小资产阶级反殖民这些词真是信手拈来啊,,,,False,6,男,,KIHJYUGUYG,https://i2.hdslb.com/bfs/face/446a7c47c74dcc19257fb808e27944406059ff57.jpg
208861875312,1750523137,1,1451401406,208329464784,208329464784,208861875312,0,0,1708346121,0,,,@念念是我滴      梅西第一天去看望了癌症患者和退役足球队员。还跟小球迷一起踢球互动，一直在微笑。第二天虽然没有上场比赛，但是也给球迷招手。你看到的应该是被截取的个别图片吧。,,念念是我滴,1928205416,False,2,保密,,bili_81549341032,https://i0.hdslb.com/bfs/face/member/noface.jpg
208649217072,1750523137,1,293051960,0,0,0,5,3,1708240303,3,,,这次香港事件，破防的大都是年轻球迷，像我们这种老球迷就还好。。我们爱的是足球，不是明星！我们也有喜欢的球星，但我们喜欢的是他的技艺。。。至于人品什么的，他好最好，不好就不好，都是小老百姓，猜不透，也懒得猜，那都是肉食动物的游戏！球踢的好就鼓掌，踢的不好就骂几句。。纯粹点多好，何必给自己找烦恼！,,,,False,6,保密,,你古拉屎凯奇,http://i2.hdslb.com/bfs/face/9f2bb469af1c989dbd73a436deeea2e260c90d43.jpg
208652102080,1750523137,1,383830578,208649217072,208649217072,208652102080,0,0,1708241628,10,,,"“我不在乎731的罪恶，我只是为731的科学探索精神点赞”
“我不在乎霉蜥是个双标的反华狗，我只是为霉蜥的球机点赞”
“你知道我家giegie有多努力吗？”
“giegie面前无祖国”[吃瓜]",[吃瓜],,,False,6,保密,,风雨十一月,http://i0.hdslb.com/bfs/face/f523b42df9b84218123b13b4e5b56c1443becaa8.jpg
208707733424,1750523137,1,519026206,208649217072,208649217072,208707733424,0,0,1708262916,1,,,6,,,,False,5,女,这里是风风，infj！随便拍一些视频然后玩星铁王者！大家开心就好啦！,Windddsppp,https://i1.hdslb.com/bfs/face/44ed1641a8ef8168529f44d6a28d41ba537b5b95.jpg
208720973952,1750523137,1,293051960,208649217072,208649217072,208720973952,0,0,1708267482,0,,,额😓，要是有不同意件，直接说就行！,,,,False,6,保密,,你古拉屎凯奇,http://i2.hdslb.com/bfs/face/9f2bb469af1c989dbd73a436deeea2e260c90d43.jpg
208918108080,1750523137,1,628593859,0,0,0,0,0,1708380515,3,,,哟西,,,,False,5,男,"龙行江海匿无踪，鼠走田间去无影
生死本有命，气形变化中。天地如巨室，歌哭作大通",您乐嘛,https://i1.hdslb.com/bfs/face/a7a853a9bdc41c1439bcdb1d417ab9a81938977b.jpg
208173117104,1750523137,1,446799409,0,0,0,0,0,1707984740,5,,,[辣眼睛]这还能洗地，果然是结晶粉,[辣眼睛],,,False,5,保密,逮住你就喷死你,无产阶级领导一切red,https://i1.hdslb.com/bfs/face/7fef4a244be124fe02f697fed2acfb222dd0a9b4.jpg
208903925888,1750523137,1,472074228,0,0,0,0,0,1708361845,5,,,事情都发生这么多天了，你推断这是误会但为啥他还不出来解释清楚呢，解释起来很麻烦？根据你的推断是感觉不出整个事情有什么不能说的!几句话就说清楚的事情，为什么要通过各种营销号来推断原因解释，不是越描越黑嘛。这种事情不应该是出了问题，如果是误会，当时就解释清楚就不会有后面的这些节奏。换位思考，任何一个正常人经历这种事情都会当场说清楚并表明自己的态度。,,,,False,5,保密,一切都会好起来的，做生活的高手，加油！,亿万年前の星光,http://i0.hdslb.com/bfs/face/d4a9bd4ce5d4812cc39b67f613917643fc04697b.jpg
208229549072,1750523137,1,476352916,0,0,0,0,0,1708006438,2,,,呦西,,,,False,5,保密,,皇马C罗11,http://i0.hdslb.com/bfs/face/member/noface.jpg
208230123936,1750523137,1,35886718,0,0,0,0,0,1708006631,2,,,嘿嘿，洗衣机,,,,False,5,保密,哇哇跳跳叫叫，跳跳的叫叫哇，,万步天使,https://i1.hdslb.com/bfs/face/9da1bc6d607263f9dc81d9556b1848ba31ee1ebf.jpg
208229864704,1750523137,1,8669254,0,0,0,0,0,1708006527,2,,,签了辟谣的合同？,,,,False,6,保密,哈哈，顺飞太多了,超高素质人,https://i1.hdslb.com/bfs/face/0efc861db61fe4f4d2626295bee5c44c672ed68c.jpg
208222890112,1750523137,1,7600259,0,0,0,1,1,1708004033,2,,,BV1ip421d7gU,,,,False,6,保密,,白切哥斯拉,https://i2.hdslb.com/bfs/face/eb58a26548f6dd314464cfb5e2065d993da7cb6a.jpg
208222940448,1750523137,1,7600259,208222890112,208222890112,208222940448,0,0,1708004087,0,,,与其听旁观者的推理，不如看一看当事人的看法,,,,False,6,保密,,白切哥斯拉,https://i2.hdslb.com/bfs/face/eb58a26548f6dd314464cfb5e2065d993da7cb6a.jpg
208221625712,1750523137,1,2109063170,0,0,0,0,0,1708003588,2,,,你跟梅西签宣传合同了？,,,,False,4,保密,蓝白德国分白沙尔克04&巴伐利亚指定德甲反派拜仁慕尼黑，心中球王劳尔亨特拉尔赫韦德斯纳尔多特罗德萨拉萨尔费尔曼诺伊尔穆勒莱万科曼阿隆索帕瓦尔,沙尔克名宿王贝拉,https://i2.hdslb.com/bfs/face/8b8c75f94d98904ff97b483a2a32e66ee0c27897.jpg
208215462064,1750523137,1,148888137,0,0,0,0,0,1708001329,2,,,罗迷的狂欢，政治的工具,,,,False,5,保密,,无尽的呼唤,http://i0.hdslb.com/bfs/face/member/noface.jpg
208432620752,1750523137,1,397878056,0,0,0,0,0,1708128232,5,,,你要这么说我就想起一个人了，下场时队长袖标给了队友，夺冠他亲自举杯队长袖标又回到了手臂上[支持],[支持],,,False,4,保密,《咏梅》无意苦争春，一任群芳妒,半步金丹搓泥丸,https://i2.hdslb.com/bfs/face/26600c1a17346a209f5dc9bde7af59c3ba2c17b1.jpg
208829084208,1750523137,1,3493075705923641,0,0,0,0,0,1708333779,3,,,举报了,,,,False,4,保密,,浩瀚无边的洋,https://i2.hdslb.com/bfs/face/a9e02a7f9b84ed77fc571715cb79dafa0f6d2370.jpg
208505958848,1750523137,1,1434109394,0,0,0,0,0,1708162569,5,,,结晶莓莓酥酪,,,,False,6,保密,私信打广告没用，防骚扰已开,bili_37625992445,https://i2.hdslb.com/bfs/face/de737cd746a96742c07ced6c213aa25cf0429d90.jpg
208434222816,1750523137,1,229097233,0,0,0,0,0,1708129672,9,,,支持up 记得删括号,,,,False,6,保密,,AxL1e,https://i1.hdslb.com/bfs/face/fb35d71ca59951ab2170e6073fee6406a9aa8a69.jpg
208229804400,1750523137,1,40168504,0,0,0,0,0,1708006539,5,,,还是你们煤粉强大，我们想象不行，你们想象行。,,,,False,6,保密,,说十句删十句,https://i1.hdslb.com/bfs/face/6566840dcb1feaa289a571395f0aac78cc8db439.jpg
208213282416,1750523137,1,1511723450,0,0,0,0,0,1708000501,2,,,你什么合同[喜极而泣],[喜极而泣],,,False,5,保密,,十里长空空对月,https://i2.hdslb.com/bfs/face/a04b2388c379b2d57d9537d26acc7880884b79d7.jpg
209241010144,1750523137,1,78479822,0,0,0,0,0,1708533242,4,,,谈谈不尊重球迷这件事吧 看了几个类似这种视频了 没一个博主出来洗这个,,,,False,5,保密,我梦寐以求 是真爱和自由,悲伤猪肘饭,https://i2.hdslb.com/bfs/face/7a1d648a3a6f484c6ecc3b7b0ad21f7adebbe4c0.jpg
208813995328,1750523137,1,6246251,0,0,0,0,0,1708327143,3,,,笑除了梅西绕圈，还有其他人绕了，按你理解都拒绝领奖了，后面为什么还去后面凑去照相。至于没工作人员，更乐了，前面你们不一直在说港媒和主办方沟通吗，香港人员这会又能跳过中间环节了。而且所以人都排队往前吧，没工作人员阁下是穿班尼路的吗，不走寻常路。,,,,False,6,保密,,gundamif,https://i2.hdslb.com/bfs/face/6fe9a63b5c9662f3ea80f576ed853f8c358661a1.jpg
208178261120,1750523137,1,3546575888452138,0,0,0,17,9,1707986985,19,,,其实没有必要谴责群众，信息本来就是不平等的[吃瓜],[吃瓜],,,False,2,保密,,LINK777777,https://i1.hdslb.com/bfs/face/fcf6abc3843b06895df1549eee8a5b82086f4cf7.jpg
208180911024,1750523137,1,31993858,208178261120,208178261120,208180911024,0,0,1707988169,28,,,二十年前你可以说信息不平等，现在这个网络信息时代还能说信息不平等的就有点刻意了，看看现在简中互联网还有当初信息不平等时期的公知存在吗?都是动动手的事情，有些人只是不愿意去追寻事实，确实事实对他们也不太重要，就是要有一个情绪发泄口，特别是涉及到中日，那更不可能理智了，只要扯到这上面了，事实是什么已经不重要了，本来去年就有人想把梅西往fh这方面引，说他个人品牌那个UI把台湾单独列成国家的事情，当然那事发酵几天后就冷下去了，至于为什么发酵速度如此快，冷的也如此之快，那还是因为最后魔法对轰，皇马官网用了同意的UI，由此诞生了著名的“行，我联系一下。”，然后那事就直接消失了，现在看来，解释啊辟谣啊什么的都不重要了，只能开启魔法对轰，让造谣者感同身受就好了，热度自然就下去了。,,,,False,5,保密,"你爱或不爱
爱就在那里
不增，不减",这下开始有点意思了,https://i1.hdslb.com/bfs/face/ca86e90b56e617db104c6103dd6a5092f19e6150.jpg
208184107072,1750523137,1,3546575888452138,208178261120,208180911024,208180911024,0,0,1707989479,10,,,回复 @这下开始有点意思了 :很多都是自由市场选出来的结果，专业且枯燥的内容天然就没有受众。整个舆论场只会是乐子人和整活人。个人就算有能力辟谣，也是言轻人微。慢慢思考，你也会发现一人一票会成为最大的不民主。,,这下开始有点意思了,31993858,False,2,保密,,LINK777777,https://i1.hdslb.com/bfs/face/fcf6abc3843b06895df1549eee8a5b82086f4cf7.jpg
208183389136,1750523137,1,3546575888452138,208178261120,208180911024,208180911024,0,0,1707989185,8,,,回复 @这下开始有点意思了 :况且B站能量大的就那么几个，普通人能接触到的大概率就是这些人。在信息建房里想保持独立思考是很难的，况且很多还是未成年人。,,这下开始有点意思了,31993858,False,2,保密,,LINK777777,https://i1.hdslb.com/bfs/face/fcf6abc3843b06895df1549eee8a5b82086f4cf7.jpg
208444110336,1750523137,1,12308664,0,0,0,0,0,1708135611,3,,,"其实我和其他博主在这个时候做和流量相违背的视频，不是因为我们不喜欢流量，
，
，

，

，
，
，，，
而是因为这样恰得更多[星星眼]",[星星眼],,,False,5,男,左转右转向前走，同志别吵手拉手,Taserfaceeee,https://i0.hdslb.com/bfs/face/81e79b2a6c8501504dc8d7f096dd0b07e681b6fe.jpg
208224393952,1750523137,1,232624959,0,0,0,1,1,1708004607,2,,,行嘞 都知道了 没签合同呗 所以梅西在没签呼吸合同的情况下擅自呼吸香港的空气怎么解释[吃瓜],[吃瓜],,,False,5,女,简介：懒、馋、痴、傻、呆、萌、色,misa呆呆,https://i0.hdslb.com/bfs/face/bf3487d4379483a2181f7b0f3eabfbee25eee56a.jpg
208256209712,1750523137,1,234074411,208224393952,208224393952,208256209712,0,0,1708017162,1,,,希望你工作的时候劳动合同记得签呼吸合同,,,,False,6,男,"he feels deeply, he feels tenderly.",副导演meiko,https://i2.hdslb.com/bfs/face/f1ecdeff552a225d050cd572d0b7906264675fed.jpg
209459934816,1750523137,1,310091168,0,0,0,4,3,1708662400,3,,,欧冠决赛和迈阿密中国行是一个级别的比赛啊？梅西就这么品格高尚连一个圈钱比赛上颁发的奖都考虑这么些个问题？现在连现场都混乱了？特首出面全港挂你头像，还告诉我怀疑霍启刚的话呢？自己去看看你们现在说的主办方、迈阿密贝克汉姆这些洗白的观点最初是不是霍启刚提到的，人家本来就没过度追究梅西就让你对球迷解释道歉，就这到现在还全是微博特供。一个低调谦逊的人有双手插兜的习惯，可能这就是文化差异吧[星星眼]。我唯一同意的就是他确实还是一点没变，还是那个发布会穿拖鞋睡觉，巴萨中国行无视汶川地震的孩子的梅西。,[星星眼],,,False,5,保密,,路人巽,http://i0.hdslb.com/bfs/face/member/noface.jpg
210923763216,1750523137,1,2185658,209459934816,209928422096,209781213744,0,0,1709531832,0,,,回复 @路人巽 :对对对，穿拖鞋就是不尊重你[星星眼],[星星眼],路人巽,310091168,False,5,保密,w蠢货一只,奏曲东风破丶,http://i2.hdslb.com/bfs/face/ce7eaf535f3c947ceea4f5e23963d3786fe0a55c.jpg
209928422096,1750523137,1,310091168,209459934816,209781213744,209781213744,0,0,1708917741,0,,,回复 @二少知更鸟 :主办方是台毒梅西冰清玉洁，台毒都退款道歉请问梅西的退款和道歉在哪里？你是中国人知道要反台毒，梅西是阿根廷人也反台毒所以不上场是吧[喜极而泣]从飞机上下来累了，你可以不参加发布会，参加了睡觉和穿拖鞋这就叫不尊重，你告诉我他是不是穿的拖鞋啊，这叫造谣[喜极而泣]最后聊聊巴萨中国行呗，搜搜视频，看是不是新闻也造谣[喜极而泣],[喜极而泣],二少知更鸟,356371833,False,5,保密,,路人巽,http://i0.hdslb.com/bfs/face/member/noface.jpg
209781213744,1750523137,1,356371833,209459934816,209459934816,209781213744,0,0,1708829060,0,,,弟弟找的台毒主办方，还有穿拖鞋那一次，B站有视频，你可以自己去搜，全队赶飞机就他一个人下来了，其他人都在酒店里面休息，也是他主动要求要来的。造谣真是不用成本,,,,False,5,男,知更乌你何必等待,二少知更鸟,https://i0.hdslb.com/bfs/face/fef24bbfc00e64beb327d15438d8f6517e5ae03f.jpg
208754837232,1750523137,1,1273304219,0,0,0,1,0,1708290654,3,,,感谢霍启刚先生为四万球迷发声！！,,,,False,4,保密,,mdld1981,http://i0.hdslb.com/bfs/face/member/noface.jpg
208209335136,1750523137,1,34881678,0,0,0,0,0,1707999103,2,,,因为世界上并没有梅西这个人，这个人完全就是虚拟的不存在的，所有的梅结晶都是在粉一个不存在的人,,,,False,6,男,,看评论学辩论,https://i0.hdslb.com/bfs/face/2c3a364cf409a85b4c651a6afbf6ffe22208c654.jpg
208224127936,1750523137,1,25997809,0,0,0,2,2,1708004497,3,,,搞得好像梅西这个事情的重点是在插兜跟绕开特首似的？在球迷眼里这两个事情根本不是事，伤害球迷的是梅西在几天后就可以在日本上场的情况下，在香港拒绝上场并且对中国球迷毫无回应毫无解释，这个重点洗不动讲什么插兜跟绕开特首？,,,,False,5,保密,,wang19890210,http://i0.hdslb.com/bfs/face/member/noface.jpg
208882392880,1750523137,1,25997809,208224127936,208865992320,208865992320,0,0,1708353408,0,,,回复 @bili_81549341032 : 你要不要找找别人第一视角全程记录的视频，从比赛60几分钟开始全场高呼梅西，直到终场前变成了漫天嘘声，这种情况下梅西不懂得发生了什么？他的回应竟然是直接带队一走了之。贝克汉姆都能意识到问题的严重性赛后尽自己所能安抚球迷，他会没去跟梅西沟通过？是有多看不起中国球迷才会一点点面子都不给贝克汉姆，竟然一分钟都不愿意在赛场多留？现在随便录个视频搪塞一下你们还真信了，拜托看看他是怎么做的。,,bili_81549341032,1451401406,False,5,保密,,wang19890210,http://i0.hdslb.com/bfs/face/member/noface.jpg
208865992320,1750523137,1,1451401406,208224127936,208224127936,208865992320,0,0,1708347691,0,,,梅西在记者采访的时候说了他都受伤了，内收肌水肿了。在香港没有上场，很希望下一次来香港踢球。他已经解释过了呀。本身梅西的性格就很内敛。他不会说太多的。说的太多，那都不是他了。也许有人觉得他解释的不够吧。但是了解他的人自然会相信他。,,,,False,2,保密,,bili_81549341032,https://i0.hdslb.com/bfs/face/member/noface.jpg
208172958784,1750523137,1,387582443,0,0,0,1,1,1707984665,4,,,结晶：举报我都按冒烟了，怎么还没下架？,,,,False,5,保密,,马副主任,https://i2.hdslb.com/bfs/face/3561b2243a2095cbc62ac32ed3fc8d79d53069d3.jpg
208174294192,1750523137,1,3546554889668802,208172958784,208172958784,208174294192,0,0,1707985265,5,,,梅结晶最近才是举报按冒烟了[笑哭],[笑哭],,,False,2,保密,,真小桌,https://i0.hdslb.com/bfs/face/58b82075ba62a40799755cdd804ec11018d4e38d.jpg
208245006592,1750523137,1,3546373823663048,0,0,0,0,0,1708012011,2,,,你的大大的忠犬,,,,False,0,保密,,账号已注销,https://i0.hdslb.com/bfs/face/member/noface.jpg
208244222000,1750523137,1,14972002,0,0,0,0,0,1708011721,4,,,up主应该是跟侏儒签了反转合同，大家理解一下,,,,False,5,男,这个人非常勤劳,名字太難取了_,https://i1.hdslb.com/bfs/face/9e6441e6d54a992bc524eac81db75e7eff5f7e59.jpg
208172411072,1750523137,1,142546111,0,0,0,25,16,1707984347,13,,,为什么央视不放美斯的镜头了？,,,,False,6,保密,,bili_142546111,https://i1.hdslb.com/bfs/face/105531a5f17efa757dd6bcbd4a43c6537429a56c.jpg
208173301728,1750523137,1,2851909,208172411072,208172411072,208173301728,0,0,1707984774,55,,,因为拉姆签了合同了，下次就是厄齐尔的镜头了,,,,False,6,男,,夏虫语冰云,https://i1.hdslb.com/bfs/face/499b3ffe1e775a9798b2ef22486b5c9b8eeb7f9d.jpg
208172703472,1750523137,1,327593413,208172411072,208172411072,208172703472,0,0,1707984529,38,,,因为拉姆也干了,,,,False,5,保密,三皇五帝神圣事，骗了无涯过客。,粥罐笼,https://i1.hdslb.com/bfs/face/aa0501b4c6b9c47b79cd65497ccb2bb2f10a5302.jpg
208228977504,1750523137,1,285068668,208172411072,208227905088,208172703472,0,0,1708006216,8,,,回复 @羴鱻驫 :央视特意用拉姆替换梅西！就是为了提醒我们球迷不要忘记拉姆干的事呜呜[大哭]央视他真的，我哭死[委屈],[大哭] [委屈],羴鱻驫,470707163,False,6,男,,Mad7777777,http://i0.hdslb.com/bfs/face/member/noface.jpg
208895595952,1750523137,1,1829349289,0,0,0,0,0,1708358183,3,,,儒老鼠最新的回应看了么？对于拒绝握手，只字不提，别告诉我这么多天过去了，他本人什么情况都不知道别，录个视频还一直抖腿,,,,False,4,保密,,WatcDoge,http://i1.hdslb.com/bfs/face/79f16247c70d1d2749572412d5c7100bdfcbbd09.jpg
208250625456,1750523137,1,3461573601396831,0,0,0,3,2,1708014325,5,,,一些媒体为了博流量这么做确实不对，但你全把锅推媒体？自己做的好会怕黑？再说了媒体总不至于奔着黑他才去现场的吧,,,,False,3,保密,,失忆1蝴蝶,https://i0.hdslb.com/bfs/face/member/noface.jpg
