rpid,oid,type,mid,root,parent,dialog,count,rcount,ctime,like,plat,device,content,emote,at_uname,at_mid,invisible,level,sex,sign,uname,avatar
208110245568,1100483248,1,97360242,208091370832,208091370832,208110245568,0,0,1707951765,4,,,不尊重你就是不尊重，有什么好洗地？别人都踩你到地上了，还在找理由洗地，贱不贱啊？你要继续喜欢，那就默默支持，别再虚拟捏造理由，这只会让人觉得你是个贱骨头,,,,False,6,保密,2021年英雄联盟总冠军的粉丝向你问好*╭︎( ˙º˙)╯︎*,可惜没如果seven,https://i0.hdslb.com/bfs/face/94599f75a2cb2a02ed31766d016acedfa6ff6d61.jpg
208105554128,1100483248,1,219853367,208091370832,208091370832,208105554128,0,0,1707939921,1,,,不满你就别签，又不是摁着手逼签的，别说他说的不算，他是队内唯一大咖，也是股东。,,,,False,6,男,are you ok？,凯菇壹号,https://i2.hdslb.com/bfs/face/61a34d01426a5c129a481683ee3ca3af0c6773f2.jpg
208159267904,1100483248,1,829689,208091370832,208110245568,208110245568,0,0,1707978183,0,,,回复 @可惜没如果seven :现在情况是人们思维太过发散了，什么事都往zz上扯。这些非正式没有赛事积分的比赛，球星都不怎么会上场踢的（这次苏亚雷斯都没上）大部分情况都是出来走走过场。合同规定让他出来踢45分钟，不然违约，这种条款对球星来说可能会引起不满。如果真要怼，只怼梅西是不够的，应该要怼整支球队，他们为了赚钱搞了波虚假宣传。,,可惜没如果seven,97360242,False,6,保密,,恒鬼,http://i0.hdslb.com/bfs/face/member/noface.jpg
208191830800,1100483248,1,3494364653291645,0,0,0,1,1,1707992595,0,,,本来是一个挺好的回忆的，结果最想看的却不上场[笑哭],[笑哭],,,False,3,保密,,多多学习常受益,https://i0.hdslb.com/bfs/face/member/noface.jpg
210570200896,1100483248,1,450187068,208191830800,208191830800,210570200896,0,0,1709311222,0,,,你去了？,,,,False,5,保密,放弃助人情结 尊重他人命运,勿扰嗷z,https://i0.hdslb.com/bfs/face/a07e550243b65a86c81721238371fa34f58f9bc9.jpg
208100620848,1100483248,1,1030409485,0,0,0,1,0,1707934209,0,,,没完了！？,,,,False,4,保密,,夏侯瑾轩1314,https://i1.hdslb.com/bfs/face/eb101ef90ebc4e9bf79f65312a22ebac84946700.jpg
208531103216,1100483248,1,350086509,0,0,0,0,0,1708172087,0,,,哟西真的是全场喷[笑哭],[笑哭],,,False,5,保密,,织梦忘川,https://i0.hdslb.com/bfs/face/member/noface.jpg
207141719344,1100483248,1,34315010,0,0,0,0,0,1707409045,0,,,先反思,,,,False,5,保密,,杀戮源氏,http://i0.hdslb.com/bfs/face/member/noface.jpg
207295512240,1100483248,1,1925905,0,0,0,90,61,1707490521,12,,,"两个问题
1.梅西做过什么有益中国人的事儿吗
2.梅西做过什么侮辱中国人的事儿吗
回答完这两个问题 继续支持那就祝你好运[呲牙]",[呲牙],,,False,6,男,,reg活在当下,https://i1.hdslb.com/bfs/face/3e895046dc93bd6b1b227a4e083e720c782ec652.jpg
207351634816,1100483248,1,508636991,207295512240,207345608400,207332589040,0,0,1707531356,8,,,回复 @reg活在当下 :你是中国人你做过什么安有益中国的事嘛？ 你自己都不做，你有什么资格让外国人做？ 小丑,,reg活在当下,1925905,False,5,保密,无惧破灭，奔向顶峰,坠入狂赌之渊,https://i2.hdslb.com/bfs/face/c7c5a1fd0fa45a925feca575765e531bcc9a0150.jpg
207501404832,1100483248,1,1382684490,207295512240,207488770048,207488770048,0,0,1707615909,8,,,回复 @秋天噢OOo :十几年前中国地震，梅西说跟它无关就没捐款，第二年日本地震立马捐了300万欧[思考],[思考],秋天噢OOo,6946668,False,2,男,,梦碎华年,https://i0.hdslb.com/bfs/face/50b3ab7f4adeffedbf93ca8532039aaff77cc719.jpg
207442418544,1100483248,1,358367539,207295512240,207380292848,207332589040,0,0,1707571082,7,,,回复 @reg活在当下 :为国家找罕见还轮不到你，要不然你去报警，然后给别人安一个罪名，看看有没有人理你,,reg活在当下,1925905,False,4,保密,,法特end,https://i1.hdslb.com/bfs/face/fc8bef8c64d07a3757e613d24ef3857179dabf63.jpg
208060400512,1100483248,1,2105389701,0,0,0,2,2,1707916477,0,,,就算知道真相也无济于事，任何洗白都改变不了事实,,,,False,5,保密,https://space.bilibili.com/2105389701/dynamic,热血小子2021,https://i0.hdslb.com/bfs/face/488771dd1437f1b3bb989797d239ebab6032dcf6.jpg
210266734528,1100483248,1,315938426,208060400512,208396321264,208396321264,0,0,1709126229,1,,,回复 @贫嘴小小 :你被主办方主导的媒体舆论绑架了知不知道，硬是和爱国扯上钩，过一段时间就来一遍的套路还真是一钓一个准。香港本身对内地认同感就低，他们有种骨子里面的优越感。,,贫嘴小小,7963867,False,5,保密,,笑魇如花的boy,https://i2.hdslb.com/bfs/face/e9f68776b1d266682edc4807d4ed8530ef4e413d.jpg
208396321264,1100483248,1,7963867,208060400512,208060400512,208396321264,0,0,1708095397,1,,,真相？什么乱七八糟的，真相就是哟西态度问题。你以为上不上场是主要的？,,,,False,6,保密,勤奋好学，天天向上,贫嘴小小,https://i1.hdslb.com/bfs/face/42db4801c46bfafe6839cfd6b785eca8f1016efd.jpg
207688171104,1100483248,1,17402073,0,0,0,0,0,1707719502,1,,,有图有真相,,,,False,6,保密,一自开天辟地，两仪便有吾身，曾教三界费精神，四方神道怕，五岳鬼兵嗔，六合乾坤混扰，七冥北斗难分，八方世界有谁尊，九天难捕我，十万总魔君。,武翊,http://i0.hdslb.com/bfs/face/7badd8d1adfa2cdec4933111b5789c70e085d34d.jpg
207160933200,1100483248,1,413080918,0,0,0,4,2,1707425802,0,,,不能惯这种现象,,,,False,5,保密,,木子PD,https://i0.hdslb.com/bfs/face/member/noface.jpg
207358250848,1100483248,1,29638004,207160933200,207160933200,207358250848,0,0,1707534342,0,,,“惯”,,,,False,6,保密,,豆腐要冻着的,https://i2.hdslb.com/bfs/face/387a858972f15681ad257e5c1f9ded20935a5d61.jpg
207497449920,1100483248,1,18745133,207160933200,207351804208,207351804208,0,0,1707613499,0,,,回复 @坠入狂赌之渊 :[吃瓜]你不就是理了嘛？还“谁理你啊”,[吃瓜],坠入狂赌之渊,508636991,False,6,保密,,颓废角落,http://i2.hdslb.com/bfs/face/a07fc0cb3184e1cb4952b234fd1bdc2b65d86f5a.jpg
208053625472,1100483248,1,1402456281,0,0,0,3,2,1707913937,0,,,回水是什么意思,,,,False,5,保密,,伊布09,https://i0.hdslb.com/bfs/face/8a69b3cda536e9de8f5961ff909f07e391f7ee35.jpg
208284916112,1100483248,1,3238333,208053625472,208053625472,208284916112,0,0,1708049624,1,,,水为财，回水就是回本,,,,False,6,保密,,猪小婷819生日快乐,https://i1.hdslb.com/bfs/face/157a3d624f9ac437d0494f074a177b63cfc458af.jpg
208061554208,1100483248,1,9873446,208053625472,208053625472,208061554208,0,0,1707916920,0,,,退钱,,,,False,5,保密,,清贫小吏,https://i2.hdslb.com/bfs/face/071b166056bbb5b54bb904b016d220bb23ff44d4.jpg
207552766480,1100483248,1,19037196,0,0,0,2,2,1707640323,3,,,抵制哟西,,,,False,6,男,,萧萧若絮,https://i0.hdslb.com/bfs/face/44098878330844df06107ee6bfeb358d19b7155d.jpg
207870418640,1100483248,1,19037196,207552766480,207730509984,207730509984,0,0,1707817809,0,,,回复 @湘潭孙一峰 :无所谓啊 不抵制不亏 抵制血赚 纯属看乐子人,,湘潭孙一峰,29991385,False,6,男,,萧萧若絮,https://i0.hdslb.com/bfs/face/44098878330844df06107ee6bfeb358d19b7155d.jpg
207730509984,1100483248,1,29991385,207552766480,207552766480,207730509984,0,0,1707738502,0,,,当年全国上下抵制日货，抵制nba，现在呢？放心好了，梅西这事比前面两个性质上来说稍微轻一些，过几年又会开始的，做好你自己就行，其他人你真别奢望,,,,False,5,保密,,湘潭孙一峰,http://i1.hdslb.com/bfs/face/523f281a1a8adfbdec3a271bcf643aa5c455da50.jpg
208234817408,1100483248,1,348625213,0,0,0,0,0,1708008271,8,,,两边都在洗，洗呗。真的假的又能如何。有人喜欢就有人烦。喜欢的就喜欢去，烦的就烦呗。喜欢的可以说，烦的就不能说，只要说就被喷？咋地这社会？,,,,False,4,保密,,给糖果也捣乱,https://i0.hdslb.com/bfs/face/member/noface.jpg
208342889456,1100483248,1,286626060,0,0,0,0,0,1708075340,1,,,真心喂狗，有球迷还跑5000公里去看梅西，就这素质？有必要？,,,,False,4,保密,,凌晨风寒,https://i0.hdslb.com/bfs/face/e1b5e2d8bb8644c6e26374444e826f9655d32f4d.jpg
207200237504,1100483248,1,403782966,0,0,0,0,0,1707452703,0,,,九个粉丝,,,,False,5,男,龙的传人,天下第二8823,https://i0.hdslb.com/bfs/face/4d464748780dd68048af9d5dc708fedd44421e30.jpg
209295294064,1100483248,1,224860283,0,0,0,0,0,1708576402,0,,,呵tui老鼠西,,,,False,5,男,BrightMine工作室,狗狗糖叫,https://i2.hdslb.com/bfs/face/855d6314a837a959acf8a76f9272d9ed8a4b0c6f.jpg
208438252080,1100483248,1,1102272432,0,0,0,0,0,1708132460,0,,,孝子贤孙，没用的东西,,,,False,4,保密,,妙蛙花阿,https://i0.hdslb.com/bfs/face/da1549b1072ef5a31b3460a2e07e0d9710a9a993.jpg
208368098816,1100483248,1,265923252,0,0,0,1,1,1708085083,0,,,贱不贱？被人侮辱还要自我安慰～,,,,False,6,男,fighting！,盗尸的雷斯,https://i0.hdslb.com/bfs/face/9b53b7547575843d475132ab06401879bd80f048.jpg
208425905392,1100483248,1,342850755,208368098816,208368098816,208425905392,0,0,1708113924,0,,,洗的都是二鬼子梅兵,,,,False,5,保密,,头号科密,http://i0.hdslb.com/bfs/face/member/noface.jpg
211305500160,1100483248,1,399631924,0,0,0,0,0,1709782475,0,,,得了吧，没梅西上场的合同能签到650万美元？美职联倒数的球队没梅西想来开球赛都没资格，迈阿密第一站出场费才350万美元，梅西还上场20分钟，真以为香港那么傻花650万美元去请倒数球队来踢球啊，没有梅西这球队50万都不一定有人请，真以为是什么稀罕球队啊。650万再加一点你甚至都可以请欧洲豪门球队来个全明星赛了，香港gov又不是脑子有病。,,,,False,5,保密,,益达还很年轻,https://i1.hdslb.com/bfs/face/90be348588d17f75bfbbfbee353fdb85fb1a7d40.jpg
208248254240,1100483248,1,290740785,0,0,0,2,2,1708013294,3,,,现在舆论好像是发展到霍少爷网上发小作文，霍少爷外网微博被网民冲了不知道是不是梅粉反正就是被人冲了，霍少爷祖上又是抗战功勋，现在网络民众舆论是要打倒和喷梅粉，导致网民谈梅就要踩喷梅，不踩梅者就容易被网民当梅粉打倒和喷，其次才是打倒梅西球星了。网络民众舆论主要还是靠蛛丝马迹比如媒体删除梅西广告推测上面意思要打倒梅西和梅粉（梅西没违约官方不可能明说封杀的）。不过就国内网民这舆论环境是不适合靠名气商业变现，不适合非应用科学学术者生存（非应用科学学术变现不了产品的）。不能一直有应用科学学术突破变现产品的可能也不适合生存。就是有科学学术突破贡献又要不求名利才比较适合生存。梅西事件现在最好不要谈了，马上热度也下去。经过这次网络舆论梅西没违约的话是不会道歉的，道歉的话中国足球的市场不能来，外国足球市场也会失去，外国比较重视合同用律师打官司。不过梅西虽有瑕疵（不违约不违法情况下谁都有瑕疵让人看不爽），年龄也大了也快要退役了，即使外国足球市场能靠足球名气商业变现也没多久了，不过在世界足坛历史上应该有一笔色彩。,,,,False,5,保密,人口过载觉悟渣男勿搞性。,人口过载渣男勿搞性,https://i0.hdslb.com/bfs/face/82e612c32bfa920d3bce93e97b7fee9b28a15417.jpg
208333462752,1100483248,1,36396195,208248254240,208248254240,208333462752,0,0,1708071249,1,,,两天看你一段话刷八遍了[疑惑],[疑惑],,,False,6,保密,,不如秒睡i,https://i0.hdslb.com/bfs/face/6bbacbceb7afcb1b14ba4f2caef64c833c4aef69.jpg
208339620672,1100483248,1,290740785,208248254240,208333462752,208333462752,0,0,1708074001,0,,,回复 @不如秒睡i :没钱蹭热度，自己在热门博主视频下隔断时间发下蹭下最新热度。,,不如秒睡i,36396195,False,5,保密,人口过载觉悟渣男勿搞性。,人口过载渣男勿搞性,https://i0.hdslb.com/bfs/face/82e612c32bfa920d3bce93e97b7fee9b28a15417.jpg
208247227904,1100483248,1,279709628,0,0,0,16,9,1708012894,34,,,这事已经和上不上场没关系了，是态度问题。不仅是对球迷的态度，是对港府的态度。不过非要纠结一嘴合同的话，不知道评论区有多少人签过合同，因为合同打过官司。如果只有有伤不能上场这么简单的话，那就没的打这个官司，因为没有明确指出伤情报告由哪个医疗机构出。更像一个君子条款，其实在很多行业都有这种君子条款。那就是看道德操守了。,,,,False,5,保密,只要你不放弃，努力自信拼搏，不要抱怨，热爱生活。梦想就一定会照进现实。CR7，best ever,东dong董咚咚7,https://i2.hdslb.com/bfs/face/2e64b8b92e9a4dfd687dbf915b064f8492c53c50.jpg
208557450320,1100483248,1,259908872,208247227904,208465999424,208280463792,0,0,1708181674,5,,,回复 @dmzero :？这好像就是这次香港行拍的，别的视频里也看到过这些画面。但好多视频把梅西不去领奖说成不打招呼就跑有点断章取义[笑哭],[笑哭],dmzero,1768010,False,6,保密,,-铭某-,https://i2.hdslb.com/bfs/face/944af69fa214df838ee4206e140c2caa753ab4f1.jpg
209821486064,1100483248,1,243644561,208247227904,208557450320,208280463792,0,0,1708846788,2,,,回复 @-铭某- :正常，他们只愿意看到自己愿意相信的,,-铭某-,259908872,False,5,男,足球爱好者,勾与杠杠杠,http://i2.hdslb.com/bfs/face/91e2101580efede3f11de6029ff7d3d1f6ae85ec.jpg
208280463792,1100483248,1,308028571,208247227904,208247227904,208280463792,0,0,1708047278,6,,,你说对球迷态度就行了，对港府态度也是事吗？,,,,False,5,保密,,sti4yy,http://i1.hdslb.com/bfs/face/ac93928d0ac9a4cc5a84089426bf782e36a5f101.jpg
208224177824,1100483248,1,401011787,0,0,0,0,0,1708004515,0,,,不就是为了流量  为了币   你每部视频不超过100个人看  懂吗！,,,,False,2,保密,,捣蛋鬼小峻熙,https://i0.hdslb.com/bfs/face/member/noface.jpg
208152813312,1100483248,1,290740785,0,0,0,4,4,1707975256,2,,,现在舆论好像是发展到霍少爷网上发小作文，霍少爷外网微博被网民冲了不知道是不是梅粉反正就是被人冲了，霍少爷祖上又是抗战功勋，现在舆论是要打倒和喷梅粉，导致网民谈梅就要踩喷梅，不踩梅者就容易被网民当梅粉打倒和喷，其次才是打倒梅西球星了。舆论主要还是靠蛛丝马迹比如媒体删除梅西广告推测上面意思要打倒梅西和梅粉（梅西没违约官方不可能明说封杀的）。不过就国内网民这舆论环境是不适合靠名气商业变现，不适合非应用科学学术者生存（非应用科学学术变现不了产品的）。不能一直有应用科学学术突破变现产品的可能也不适合生存。就是有科学学术突破贡献又要不求名利才比较适合生存。梅西事件现在最好不要谈了，马上热度也下去。经过这次网络舆论梅西没违约的话是不会道歉的，道歉的话中国足球的市场不能来，外国足球市场也会失去，外国比较重视合同用律师打官司。不过梅西也快要退役了年龄大了，即使外国足球市场能靠足球名气商业变现也没多久了，不过在世界足坛历史上应该有一笔色彩。,,,,False,5,保密,人口过载觉悟渣男勿搞性。,人口过载渣男勿搞性,https://i0.hdslb.com/bfs/face/82e612c32bfa920d3bce93e97b7fee9b28a15417.jpg
208233133360,1100483248,1,116178668,208152813312,208152813312,208233133360,0,0,1708007683,1,,,霍启刚的账号在一夜之间突然被大量简中账号冲击，队形整齐，冲他的人甚至上升到“定体问”，很可能有公关公司在背后操作。对了，港府没有直接和球队签约，和球队签约的是tatler。港府只和tatler签了约，赛前tatler向外界声称梅西会上场，关键在于瑞士公司tatler和国际迈阿密之间签的那份合同，但是tatler和国际迈阿密迟迟不肯公开这份合同。,,,,False,5,保密,o.o,slzzzzzzzzp,https://i2.hdslb.com/bfs/face/f5ad1de19e42810dea12a8d14dce818e7f052237.jpg
208233824848,1100483248,1,116178668,208152813312,208152813312,208233824848,0,0,1708007939,0,,,对了，没道歉并不能倒推出没违约[吃瓜]，当然也不能倒推出违约了。想要清白?建议公开tatler和国际迈阿密之间的合同，不公开的话永远处于争议中。,[吃瓜],,,False,5,保密,o.o,slzzzzzzzzp,https://i2.hdslb.com/bfs/face/f5ad1de19e42810dea12a8d14dce818e7f052237.jpg
208202017808,1100483248,1,1368549359,208152813312,208152813312,208202017808,0,0,1707996348,0,,,杭州直接取消了邀请,,,,False,4,保密,,冉凤之舞,https://i2.hdslb.com/bfs/face/534afb8970237f1fea8beded04de8119917e44e7.jpg
207878704928,1100483248,1,339018600,0,0,0,109,78,1707821162,25,,,梅西这波想翻过来难度是极大的，首先这个人就是个闷葫芦，不吭声的。也许有机会在以后某次传记或者个人访谈里被问到他可能回答。其次梅黑群体是相当恐怖的，那是群造谣成瘾带点精神问题的一帮人，他们会无限放大这次事件，最好一次给他压死。梅西的错无非就是没有那份球迷为我而来的责任感，没能安抚现场球迷。什么握手领奖那都是扯淡，他一个坐场边看球的有什么脸去握手领奖。就你去让一个社恐给你发言也好，让他之后给你解释也好~白等，闷葫芦一个。,,,,False,5,男,,心态最好的男,https://i0.hdslb.com/bfs/face/6eff2b4d3d9d258a69fa37fe2627273c7a198ede.jpg
207901789760,1100483248,1,399870973,207878704928,207878704928,207901789760,0,0,1707830215,20,,,你好努力，有工资吗？我都想替呦西给你发五毛钱安慰奖了,,,,False,5,男,当你打开我主页的那一刻，你就已经输的很彻底了，我的观点像刀刃一样已经深深扎进了你的心里，你试图反驳我可是你无能为力，所以你焦急的点开我的主页,精嘤怪boss,https://i1.hdslb.com/bfs/face/0694500274c5bbb52c2ec581da3bc911444724a9.jpg
207943708288,1100483248,1,3493120933103847,207878704928,207878704928,207943708288,0,0,1707849835,13,,,在香港是闷葫芦，在日本就不闷了嘛！你换个角度再洗好不好？,,,,False,3,保密,,鹏GG0936,https://i0.hdslb.com/bfs/face/534afb8970237f1fea8beded04de8119917e44e7.jpg
207947071104,1100483248,1,452625286,207878704928,207878704928,207947071104,0,0,1707855024,11,,,闷葫芦 指在日本一人被采访,,,,False,5,男,,c呆小可爱,https://i1.hdslb.com/bfs/face/e4e3e1b246dcacbcc6f8f389d147a163ecadf051.jpg
207831943280,1100483248,1,443004754,0,0,0,28,18,1707800715,10,,,主办方为了省钱，不签梅西必须上场的合同，半场休息时迫于港府压力还想道德绑架逼梅西上，梅西作为现在的足球届历史第一人，什么场面没见过，阿根廷总统都叫不动他，凭什么惯你们毛病,,,,False,6,保密,,yzhpb4,https://i1.hdslb.com/bfs/face/7318902db0dc856237aa1887dc7f66cb27a82a50.jpg
207850374928,1100483248,1,5158925,207831943280,207831943280,207850374928,0,0,1707808954,20,,,签的一整队，附加梅西必须上场45分钟，只是有一条尊重伤病的条款，被臭侏儒拿来诈伤钻空子了，诈骗犯的球迷真是幼稚😀,,,,False,6,男,,雨声鱼zz,https://i2.hdslb.com/bfs/face/43c9c7de98d4078ede2887091ef1daff4ae05bda.jpg
207859947760,1100483248,1,5852914,207831943280,207850824720,207850374928,0,0,1707813331,13,,,回复 @yzhpb4 : 你儒都连累国家队不能来华了，还不放出真合同狠狠的打这些人的脸，我哭死[笑哭],[笑哭],yzhpb4,443004754,False,6,保密,可可爱爱，没有动态。,肘孑,https://i1.hdslb.com/bfs/face/e3050f84ea657255bff5c7ba710d8f1a9bb3ffe5.jpg
207956795360,1100483248,1,256278293,207831943280,207831943280,207956795360,0,0,1707871798,9,,,2010年来我国不和灾区孩子互动也是因为没写进合同里罗[大笑]，后面几次来中，新闻会穿拖鞋，睡觉也是因为没把不能做的事项写进合同里罗[大笑]，就这么个劣迹斑斑的货色，居然还有人舔着脸洗，你得多贱骨头啊？还阿根廷总统来了都不给面子[大笑]，蠢这样大过年的别出来找骂了，别人面子我不知道，球迷是衣食父母，衣食父母的面子都不给就是个垃圾！！！,[大笑],,,False,4,女,,小小财喵喵,https://i2.hdslb.com/bfs/face/030b3524bfcebb0456dea2ae88be558070cc7890.jpg
207804284848,1100483248,1,14518113,0,0,0,23,19,1707788835,6,,,up在现场 确实梅西没上最对不起的 就是up这样买票到现场的球迷 其他人上升政治洗洗睡吧 阿威罗称日本是亚洲最好的国家的时候 你们这些人怎么不爱国了 纯扯犊子,,,,False,6,男,cs最新资讯 比赛预告 数据盘点 关注我 好不啦555,马神csgo杂谈,https://i0.hdslb.com/bfs/face/b3848aa553dc245046b4fdde44bbb6dd4baf2799.jpg
207903234464,1100483248,1,399870973,207804284848,207804284848,207903234464,0,0,1707830758,2,,,"黄昏见证真正的侏儒[支持]梅结晶不等式：
下一场马上能踢≠没受伤
没受伤不踢不谢场不领奖≠看不起球迷
看不起现场球迷≠看不起我
梅西看不起我≠我不喜欢梅西
我还舔梅西≠我下贱
还在舔的梅结晶必定相信其中至少一条，发现梅结晶可对质验证",[支持],,,False,5,男,当你打开我主页的那一刻，你就已经输的很彻底了，我的观点像刀刃一样已经深深扎进了你的心里，你试图反驳我可是你无能为力，所以你焦急的点开我的主页,精嘤怪boss,https://i1.hdslb.com/bfs/face/0694500274c5bbb52c2ec581da3bc911444724a9.jpg
207964544656,1100483248,1,634524932,207804284848,207804284848,207964544656,0,0,1707876165,2,,,哟西！你滴大大滴忠诚！,,,,False,5,保密,Been seeking for 'it' but still nothing out of anywhere under my scope,EKINGDAWG,http://i2.hdslb.com/bfs/face/ea0ba3318636dfc34ec28cd4e64524de6e7077a6.jpg
207902941136,1100483248,1,399870973,207804284848,207804284848,207902941136,0,0,1707830684,1,,,梅毒离了C罗奶嘴不会说话了，真可怜[吃瓜],[吃瓜],,,False,5,男,当你打开我主页的那一刻，你就已经输的很彻底了，我的观点像刀刃一样已经深深扎进了你的心里，你试图反驳我可是你无能为力，所以你焦急的点开我的主页,精嘤怪boss,https://i1.hdslb.com/bfs/face/0694500274c5bbb52c2ec581da3bc911444724a9.jpg
207617208512,1100483248,1,42822826,0,0,0,67,57,1707666400,27,,,"香港文旅→主办方→迈阿密→梅西，相当于甲→丙→丁→乙。。甲方跨越两个中间环节去操作乙方，如果在生意场上，霍生的这种幼稚兼低级的运作，他和他的整个团队都会被公司炒掉。
你们总说意大利对韩国有02之仇，意甲不用韩国人；葡萄牙对韩国有02之仇，C罗恨韩国和韩国人。。可金玟载这不就打破谣言了吗？？？所以，关于C罗这条，你们真的有信息来源来佐证呢？是C罗亲自表达过了呢？。还是有官方媒体证实过呢？。22世界杯时C罗站出来助攻韩国导致输球，你见到葡萄牙媒体和球迷有一条新闻、一次表达是从世仇这点出发？！！！。。为什么总以自己的思维忖度他人之见？为什么总活在自己臆想的世界里呢？？？？！！！！！唉！",,,,False,6,保密,,亦凡子,http://i0.hdslb.com/bfs/face/member/noface.jpg
207650136832,1100483248,1,292939586,207617208512,207617208512,207650136832,0,0,1707701627,18,,,站起来，别跪了，你认的主人不认你。别当舔狗了，你的女神不爱你，她甚至讨厌你。我们对他无感，但见不得你们这样作践自己，你起码还是中国人，我们原本是一边的。他现在不尊重你，就是不尊重我们，你觉得没关系，我们看不下去啊！,,,,False,5,保密,,three的三大爷,http://i2.hdslb.com/bfs/face/e0abc2d314bd9fed3f6df0a32806d16ef25df1b7.jpg
207653897584,1100483248,1,25595348,207617208512,207617208512,207653897584,0,0,1707703729,10,,,是的 梅西是我们爹,,,,False,6,男,我想吃掉你的胰脏 ,苍汰の拓実,http://i2.hdslb.com/bfs/face/1c67f7f43b05dddf4156f00f2796cd7fbc44e1cb.jpg
207652159968,1100483248,1,1164382183,207617208512,207617208512,207652159968,0,0,1707702765,10,,,那你感觉合同的作用是什么？就是规范具体事宜，不按合同办事外还有抵触情绪，那主办方花钱养父呢？,,,,False,4,保密,,bili_42301174288,https://i0.hdslb.com/bfs/face/member/noface.jpg
207537941344,1100483248,1,175992,0,0,0,55,39,1707632918,67,,,"香港人路過
非球迷，沒有進場，不過用滿城風雨來形容這次事件是合適不過了[吃瓜]
個人體感，雖然可能各有立場，但爆頭片出來時基本上個個拍手稱快[doge]被問到想不想霉西再來香港時，基本上人人都說no thank you，我覺得這個可以代表大多數香港人想法了[嗑瓜子]",[doge] [吃瓜] [嗑瓜子],,,False,5,保密,,HeaD,http://i0.hdslb.com/bfs/face/cc6774614be8e956b00d391d769f28447b736119.jpg
207607762384,1100483248,1,97016982,207537941344,207606743200,207606743200,0,0,1707662714,20,,,回复 @Signal_Chen :你这话颇有种我不是xx人，但我比xx居民更懂当地的美😅,,Signal_Chen,1165281733,False,5,保密,Henshin!!!,GAga__316,https://i0.hdslb.com/bfs/face/cd3f95768e6112fd146681efd6691b7196cf3006.jpg
207589336192,1100483248,1,15323252,207537941344,207574759136,207574759136,0,0,1707655687,18,,,回复 @呦呵能耐了是吧 :错了只有呦西不需要我们中国市场，中国体育市场更不需要里奥呦西,,呦呵能耐了是吧,982092,False,6,保密,,萨萨纳,http://i2.hdslb.com/bfs/face/0e1aebad0e8610fed2308cf668a73903d690dc41.jpg
